body,score_hidden,archived,name,author,author_flair_text,downs,created_utc,subreddit_id,link_id,parent_id,score,retrieved_on,controversiality,gilded,id,subreddit,ups,distinguished,author_flair_css_class,removal_reason
"&gt; The mayors advisory committee is considering different options, including phasing in the $15 wage over time, giving exemptions to small businesses and nonprofitsm and giving credits for other forms of compensation, like health insurance or tips, according to committee co-chair Howard Wright.

&gt; But those conditions are not sitting well with the leaders of 15 Now, like Sawant. We are not interested in a measure that is 15 in name only but has more holes than Swiss cheese, she said.

So... everyone who has been saying this would be done in a measured, rational way... that doesn't sound like what people are pursuing here. This may not play in their favor.",false,true,t1_cfujarb,[deleted],,0,1393978469,t5_2qhad,t3_1zkoke,t3_1zkoke,8,1432660489,0,0,cfujarb,Seattle,8,,,
I always say if Gates started in a garage it was a nice garage.  His father being an attorney certainly helped at the start.,false,false,t1_clcbvix,Monorail5,,0,1413575176,t5_2qhad,t3_2jjck1,t3_2jjck1,8,1426478487,0,0,clcbvix,Seattle,8,,,
"Between Broadway and Harvard on Thomas, north side.  

Source: garbageman - I delivered those dumpsters",false,true,t1_ckaklao,CodeBlue_04,,0,1409981435,t5_2qhad,t3_2fl9tu,t1_ckag5mp,8,1427171939,0,0,ckaklao,Seattle,8,,,
"Jesus camp style. ",false,true,t1_cf9sjxb,uselessattempt,,0,1391816437,t5_2qhad,t3_1xaxdx,t1_cf9sh29,8,1432301576,0,0,cf9sjxb,Seattle,8,,,
Your assumption is wrong.,false,true,t1_cj1admz,cultmember,,0,1405720163,t5_2qhad,t3_2b2d9t,t1_cj19yqu,9,1434783574,0,0,cj1admz,Seattle,9,,,
"I take it you weren't living in Seattle during the 90s and early 00s...

You want to learn how a city can fuck up so badly, read about the Seattle monorail project. It was a massive failure. Monorails will never be accepted again.  ",false,false,t1_cltfib7,Lindsiria,,0,1415165770,t5_2qhad,t3_2lbxzi,t1_clteyxg,9,1426184478,0,0,cltfib7,Seattle,9,,,
"East of the lake- East side

West of the lake- West side ",false,true,t1_ceomm0d,Glitter_shits,,0,1389640370,t5_2qhad,t3_1v2ixb,t1_ceolulg,9,1431925954,0,0,ceomm0d,Seattle,9,,,
I love the rain.,false,true,t1_cfnnuxw,zenbubz,,0,1393274435,t5_2qhad,t3_1ysvrp,t3_1ysvrp,9,1432541573,0,0,cfnnuxw,Seattle,9,,,
"People die daily.  Lots of people.  In this case the evidence was pretty clearly again the deceased so while I can feel sympathy toward the mother for the loss of a family member, I don't have to also feel anger against the cop and the system for this incident.",false,false,t1_cmg05lk,choseph,,0,1417250279,t5_2qhad,t3_2nq2oc,t1_cmg03vw,9,1425772645,0,0,cmg05lk,Seattle,9,,,
"Here's one: 'A visiting CMU professor who has permanent hearing damage as a result of an LRAD used on a crowd of protesters will get $72,000.'

http://pittsburgh.cbslocal.com/2012/11/14/pittsburgh-forks-over-200k-after-g-20-lawsuits/

Took 5 seconds to lookup.",false,true,t1_cjqs3xs,who8877,,0,1408080808,t5_2qhad,t3_2dk1de,t1_cjqs0nn,9,1435246322,0,0,cjqs3xs,Seattle,9,,,
just in time for shark week.,false,true,t1_cjplgf8,ch0colate_malk,,0,1407977129,t5_2qhad,t3_2dhf4q,t3_2dhf4q,10,1435225010,0,0,cjplgf8,Seattle,10,,,
"I knew MSFT couldn't help itself.

""We need to trim the workforce to remain viable.""

""We need more H1B's since we have a shortage of skilled workers.""",false,true,t1_cj1zylg,[deleted],,0,1405799854,t5_2qhad,t3_2b5e3t,t3_2b5e3t,10,1434796228,0,0,cj1zylg,Seattle,10,,,
"These aren't mutually exclusive problems. ",false,true,t1_cjgnh5v,uselessattempt,,0,1407170031,t5_2qhad,t3_2clans,t1_cjgmz3k,10,1435062976,0,0,cjgnh5v,Seattle,10,,,
"Man pulls weapon on cops, cops respond with adequate force to neutralize the threat.....

AAAAAAAAAAAANNNNNNNNNNNNNDDDDDDDDD Seattle Protests",false,true,t1_cisobog,Mikeshouse2012,,0,1404925415,t5_2qhad,t3_2a80ip,t3_2a80ip,10,1434627945,0,0,cisobog,Seattle,10,,,
"And house prices will continue to rise.

And yet Sawant thinks doing this will help the middle class...  How did she get a degree in economics?",false,true,t1_chn70rx,[deleted],,0,1400639393,t5_2qhad,t3_262zya,t3_262zya,10,1433886920,1,0,chn70rx,Seattle,10,,,
"And the Taco Bell on Broadway. ",false,true,t1_cjolf99,sirernestshackleton,Seattle Expatriate,0,1407889492,t5_2qhad,t3_2dcajn,t1_cjobqf9,10,1435207862,0,0,cjolf99,Seattle,10,,flair,
They were celebrating an emotional win.,false,true,t1_cev5kw5,Jamesnitric,,0,1390323379,t5_2qhad,t3_1vqg1h,t1_cev1z21,11,1432039733,0,0,cev5kw5,Seattle,11,,,
"What do we want? DENSITY!
When do we want it? NOW!
Where do we want it? NOT IN MY BACKYARD!",false,true,t1_ck3uqjp,[deleted],,0,1409329425,t5_2qhad,t3_2ew7fc,t1_ck3u9vl,11,1427296915,0,0,ck3uqjp,Seattle,11,,,
"Agreed.  I could learn to love hockey, but it's going to be a slow process.  I know I'll like it more so than soccer.",false,true,t1_cfu7zdu,[deleted],,0,1393955528,t5_2qhad,t3_1zjnz0,t1_cfu7wok,11,1432655089,0,0,cfu7zdu,Seattle,11,,,
"1. Microsoft buys a bus pass from Metro for every employee, and those who use the commuter don't contribute to wear and tear on other buses, so this helps keep other bus lines running

2. You can't use the connector until you're a permanent, full-time employee, and how many Microsofties are contract?

3. These private routes are in such low supply that there are waiting lists

In short, there's no way the small number of people on those lines make any sort of difference in the grand scheme of Capitol Hill housing.",false,true,t1_cfbyzdz,lilbluehair,First Hill,0,1392066083,t5_2qhad,t3_1xj2cq,t1_cfbykqd,11,1432339201,0,0,cfbyzdz,Seattle,11,,flair,
[deleted],false,true,t1_chtf21w,[deleted],,0,1401309479,t5_2qhad,t3_26q5si,t3_26q5si,11,1433994415,0,0,chtf21w,Seattle,11,,,
What are the settings you used? I love how vibrant this is,false,true,t1_cip0xf3,dakilazical,,0,1404553983,t5_2qhad,t3_29vtj0,t3_29vtj0,11,1434560946,0,0,cip0xf3,Seattle,11,,,
"Maybe you should take some time off man ",false,true,t1_ceneod3,vatothe0,Queen Anne,0,1389496946,t5_2qhad,t3_1uzpgf,t1_cenc6tj,11,1431904781,0,0,ceneod3,Seattle,11,,flair,
"The proper etiquette of staying to the far right unless you are passing and not riding astride. There's plenty of room on that trail if the slowpokes stay to the right. I'm not a Spandex clad racer, but that trail aggravates me because of all he slowpokes who don't pay attention. Especially the families who think the world should come to a complete halt for them. ",false,true,t1_cieosou,MsCurrentResident,,0,1403509271,t5_2qhad,t3_28u7ra,t1_ciemv19,11,1434362416,0,0,cieosou,Seattle,11,,,
If you were looking at a 100 day break then you were a temp not an employee.  Abrupt ends to temp work is part of the deal. Pretty different from an employee layoff.,false,true,t1_ciyl5xu,phenry103,,0,1405473144,t5_2qhad,t3_2as7lf,t1_ciyi081,12,1435470847,0,0,ciyl5xu,Seattle,12,,,
"Citation requested on that first bullet.  I recall reading that Seattle was too cool and too wet of a climate for the animals, leading to them spending large portions of the winter in their barns, reducing their movement, socialization and over all long term life expectancy. ",false,false,t1_cm7u2ij,sculptedpixels,,0,1416474869,t5_2qhad,t3_2mtb2s,t1_cm7f3mo,12,1425933248,0,0,cm7u2ij,Seattle,12,,,
try reading the entire article.,false,true,t1_chg4erw,skooterblade,,0,1399918416,t5_2qhad,t3_25d7o7,t1_chg3zb7,12,1433764456,0,0,chg4erw,Seattle,12,,,
Meanwhile Washington people are driving over the border to avoid alcohol tax.,false,false,t1_cletcyq,Moonsnail8,,0,1413830441,t5_2qhad,t3_2jsu2t,t3_2jsu2t,12,1426435856,0,0,cletcyq,Seattle,12,,,
"During a period where Boeing contracts are being made through the roof. During a period where the state of Washington is offering record tax credits - essentially giving Boeing millions of free money. During a period where the CEO is getting raises...

During the period where Boeing is getting all of this, they turn to their employers and say 'Listen, we want to renegotiate the contract, and if you don't comply with the results, we will relocate'

It's economic extortion on their workers. If anything, boeing workers should be getting fucking raises considering all of the additional work cut out for them in the next few years. The company is apparently doing great - why can't the machinists get something for this?

How can anyone justify the greed of Boeing CEOs? Sales are high. production is high. Profits are high. And they're going after their employers for even more. And if Boeing doesn't get their way, they will simply move, which puts not only the machinists' lives and economic well-being in jeopardy, but the states economy in jeopardy.",false,true,t1_cegj1la,cancercures,Capitol Hill,0,1388779609,t5_2qhad,t3_1uba6a,t3_1uba6a,12,1431784917,0,0,cegj1la,Seattle,12,,flair,
"have you ever seen wta.org? it's the entirety of what you're asking for. ",false,false,t1_cl81b2j,derrickito,Green Lake,0,1413180801,t5_2qhad,t3_2j33mn,t3_2j33mn,12,1426553685,0,0,cl81b2j,Seattle,12,,flair,
"This is ridiculous.  I would never ask to bring in outside food/drink to a restaurant (unless its a case of bringing your own wine and paying a corkage fee), but the restaurant allowed it.  They even ASKED before they did it.  And were told it was fine by the staff.  The staff had the opportunity to decline, which they didn't.  After that, its suck it up and deal with it.  Don't go bitching on social media that a customer did something that said they could do after the explicitly asked.

Also, it sounds like they are regular customers who really enjoy the food.  And beyond that, they are GOOD regular customers.  Running up  $400+ bill on just food?  And then realizing that they had a lower bill due to not drinking, and being aware enough to leave an extra tip to help out the server who probably would have gotten a larger tip had they been drinking?  That isn't the norm.  That is them going above and beyond.

I worked in restaurants for about 5 years through college and after.  These sounds like great, aware customers.  This is all on the restaurant, IMO.",false,true,t1_cgygakg,cmk2877,Capitol Hill,0,1398117825,t5_2qhad,t3_23lw48,t3_23lw48,12,1433459137,0,0,cgygakg,Seattle,12,,flair,
"Mars hill is trying to sell lots of property, and their history with buying/selling property is kind of shady.


If you want to know more, [there is a blog](http://wenatcheethehatchet.blogspot.com/) that covers all the goings-on when it comes to mars hill and it's finances. [Here's the info](http://wenatcheethehatchet.blogspot.com/2014/10/throckmorton-mars-hill-big-box-for-sale.html) on the Ballard sale specifically.",false,false,t1_cl9lm85,[deleted],,0,1413326617,t5_2qhad,t3_2j8kia,t3_2j8kia,12,1426526136,0,0,cl9lm85,Seattle,12,,,
It will not stop my pursuit of blackoutness!,false,true,t1_cjmqzzl,axos91,,0,1407725202,t5_2qhad,t3_2d6irw,t3_2d6irw,-2,1435175736,1,0,cjmqzzl,Seattle,-2,,,
[deleted],false,true,t1_cjj1vqn,[deleted],,0,1407372109,t5_2qhad,t3_2cskdr,t1_cjiz26u,-2,1435110638,1,0,cjj1vqn,Seattle,-2,,,
"But half of the cars in the pics looked to be parked correctly.  Sure some were sticking out, but not every one!",false,true,t1_chxpq5s,getthejpeg,Kirkland,0,1401761103,t5_2qhad,t3_272hjm,t1_chxi14n,-2,1434068800,0,0,chxpq5s,Seattle,-2,,flair,
"You inhibited the fun of a lot of little kids who dug up the precious metals used in the making of your electronic device you used to get on Reddit ;) ",false,false,t1_cmg7l49,blackbirdrising,,0,1417281052,t5_2qhad,t3_2nq2oc,t1_cmfyjnz,-2,1425769108,0,0,cmg7l49,Seattle,-2,,,
"my premise is that new purchasers, without a CC should be able to benefit for the lack of waiting period, after being verified with a clean background check.  ",false,false,t1_cmi83of,perfidity,,0,1417468292,t5_2qhad,t3_2nwekc,t1_cmi3fe7,-2,1425734772,0,0,cmi83of,Seattle,-2,,,
"545 is run by Sound Transit, the 2 is run by Seattle Metro.",false,false,t1_clhr025,OrionSr,,0,1414088923,t5_2qhad,t3_2k1tpp,t1_clhlw2u,-2,1426385598,0,0,clhr025,Seattle,-2,,,
African studies much?,false,false,t1_cllxvgd,Laxmouth,,0,1414477280,t5_2qhad,t3_2k9puh,t1_cllx599,-2,1426313062,0,0,cllxvgd,Seattle,-2,,,
"I can't help to notice that when I go into tribal casinos all over the state those same totems and spirit dancers adorn the walls of the showrooms where they do the boxing matches and serve up the $8.99 all you can eat shrimp dinners. 
That's the Indians themselves using their imagery to support something materialistic and vain.  (Can't get much more materialistic and vain than those walls of slot machines and jackjack tables.)
I don't blame them really.  Not anymore than I blame the retailers for commercializing Christmas.  This is the 21st century and everything is used to sell something. 


",false,true,t1_cemcz1c,JohnnyMagpie,,0,1389383305,t5_2qhad,t3_1uuc58,t1_cemcoi7,-1,1435533715,0,0,cemcz1c,Seattle,-1,,,
"whoa, kinisonkhan. nice to see you around here.

i originally CAME TO YELL AT YOU AND THAT CURSE WORDS ARE FROWNED UPON

but since you gave me the 2005 hawks games you get a pass.

&lt;3

edit: also get your ass in the IRC",false,true,t1_cenlu3i,cerjam,,0,1389523223,t5_2qhad,t3_1v00tl,t1_cencdps,-1,1431908158,0,0,cenlu3i,Seattle,-1,,,
"Traffic it appears was slowing anyway since you can clearly see in the video that cars ahead of him were stopped at Broadway.

In heavier traffic it's better to err on the side of caution whether you're driving or cycling. He would not have been out of line to brake and proceed more slowly down the hill in that situation. Even if there were motorists behind him, most would have understood.",false,true,t1_ck3uyjl,[deleted],,0,1409329853,t5_2qhad,t3_2ev9n7,t1_ck3ukyx,-1,1427296812,0,0,ck3uyjl,Seattle,-1,,,
"These are all really good suggestions. 

I still feel like need help finding a way to get along with men, though. They're more sexist here than anything I have seen before. Literally the only men who will talk to me want to date me. And I really do have to find a way to get clients. Most of whom will be men because that's the way my business works. So even if they don't actually try a move, I'm not going to get anywhere with someone who sees me and thinks, ""Girl = date."" I need someone who sees me and thinks, ""Professional colleague..."" which just doesn't seem to be happening. 

I know people are focusing on the ""oh she has too many dates boo hoo"" angle. But I'm really freaking out about my ability to make a living here. Seattle is sexist as hell. I didn't expect it and I don't know how to deal with it. I need guys around and I need them to like me and think i'm competent. But the only ones who will make eye contact are hitting on me.  ",false,true,t1_cey7y6q,[deleted],,0,1390613650,t5_2qhad,t3_1w2i56,t1_cey7pfn,-1,1432095645,0,0,cey7y6q,Seattle,-1,,,
I'm guessing they readily bid on a piece nobody else really wanted.,false,true,t1_cgos1tn,[deleted],,0,1397110703,t5_2qhad,t3_22molt,t3_22molt,-1,1433290936,0,0,cgos1tn,Seattle,-1,,,
"""Because I'm a fucking stupid asshole""",false,true,t1_ckd029n,inibrius,Snohomish County,0,1410224093,t5_2qhad,t3_2ft974,t3_2ft974,-1,1427117308,0,0,ckd029n,Seattle,-1,,flair,
"Lesson time, Seattle is apparently home to butt hurt children who are easily offended",false,false,t1_cn0bzie,DeadAleWives,,0,1419060696,t5_2qhad,t3_2psu56,t1_cmzx6jz,-1,1425304887,0,0,cn0bzie,Seattle,-1,,,
"""They buy more stuff"" I like that one too.",false,false,t1_clvi40l,[deleted],,0,1415339196,t5_2qhad,t3_2ljlfv,t1_clvhz7u,-1,1426148792,0,0,clvi40l,Seattle,-1,,,
"pretty funny if you ask me, the caltards ruined their own state so they want to get away to seattle, but as soon as they get here they starting making it just as bad as it was in the places they're leaving. ",false,true,t1_chbfik1,RedditGuy4U,,0,1399423621,t5_2qhad,t3_24w8xn,t3_24w8xn,-1,1433683176,1,0,chbfik1,Seattle,-1,,,
Fucking graffiti'ing assholes.,false,true,t1_chcj7c9,jenbanim,,0,1399529481,t5_2qhad,t3_250fhq,t3_250fhq,-1,1433702431,0,0,chcj7c9,Seattle,-1,,,
Because of articles like this one and the comments people say. Apparently you do understand some of what happened.  But you dont seem to care.,false,true,t1_cex3mzr,btspman,Ballard,0,1390509096,t5_2qhad,t3_1vyokm,t1_cex3hbz,-1,1432075590,0,0,cex3mzr,Seattle,-1,,flair,
"Make sure no one calls and tells the cops that people are hanging out with guns that are probably fake. ",false,false,t1_cmnb5dz,HastenTheRapture,,0,1417909576,t5_2qhad,t3_2ohwpa,t3_2ohwpa,-1,1425567711,0,0,cmnb5dz,Seattle,-1,,,
[deleted],false,false,t1_cmrlc4a,[deleted],,0,1418278358,t5_2qhad,t3_2ow54r,t1_cmrdp3a,-1,1425490488,0,0,cmrlc4a,Seattle,-1,,,
"That was Washington, DC. Seattle's has only just arrived.",false,true,t1_ch8ye31,9ozFlask,,0,1399169635,t5_2qhad,t3_24ncby,t1_ch8voh2,-1,1433640452,0,0,ch8ye31,Seattle,-1,,,
Its at 26000 right now pretty awesome.,false,true,t1_ci1ribc,theavatare,Westlake,0,1402180334,t5_2qhad,t3_27krpa,t3_27krpa,-1,1434138711,1,0,ci1ribc,Seattle,-1,,flair,
"Actually, the vast majority guns bought on the black market were originally purchased legally. It's very rare a home made gun is ever used in a shooting.

Countries that limit gun ownership have far less gun deaths. 

The above is factual. The debate on whether its a reasonable risk to sell guns without registration is personal. 

I am personally for guns and for cars. I expect I'd I buy either thought that I should have to register it. Again, this part is opinion only.",false,false,t1_clq9b85,1standarduser,,0,1414877613,t5_2qhad,t3_2kyvjx,t1_clpxxv9,-1,1426238712,0,0,clq9b85,Seattle,-1,,,
"Not for long, prices are going to continue rising.",false,true,t1_celtmaa,ericjs,,0,1389322084,t5_2qhad,t3_1uu6a5,t1_celtcft,-1,1431877164,0,0,celtmaa,Seattle,-1,,,
"A ""bad driver"" for the purposes of this thread is anyone stopping a 22 year old from getting to Starbucks in under 3 minutes.

To me, a bad driver is someone causing a safety hazard.",false,true,t1_chnsjm9,LaCanner,Alki,0,1400703828,t5_2qhad,t3_264xl2,t3_264xl2,-1,1433897263,1,0,chnsjm9,Seattle,-1,,flair,
"&gt;Some Military people are dicks, but so is the rest of the population.

&gt;Please do not act as though you understand the training we undertook.

It's not the training that people care about. It's the roving packs of people from the military that get wasted in public, act like complete dicks to strangers, call everyone else ""civilians"" and look down on them like they are some kind of lesser being.

They cause trouble and harass others, and then leave after breaking stuff.

This is the public face a lot of people see. 

Of course not everyone in the military is like that, but when it happens enough that's the perception people are going to have.",false,true,t1_cj65b4z,ClockCat,,0,1406172571,t5_2qhad,t3_2bipt6,t1_cj62p5t,-1,1434870822,1,0,cj65b4z,Seattle,-1,,,
What is good for the goose is good for the gander.  If I am supposed to stay off the road because cyclists break the law then why should we allow cars or pedestrians?,false,false,t1_cl152s5,[deleted],,0,1412531793,t5_2qhad,t3_2iarny,t1_cl0w1cm,-1,1426672240,0,0,cl152s5,Seattle,-1,,,
That's a false-pretense.,false,false,t1_clcd09n,Cataclyst,Capitol Hill,0,1413577369,t5_2qhad,t3_2jj7vb,t1_clcca5r,-1,1426477959,0,0,clcd09n,Seattle,-1,,flair,
"Yet fares only cover 29% of the cost, which is less than the national average of 36%.  Asking for higher fares is reasonable.

Edit: 29% not 30%.  Here is the evidence (1:30):

http://www.nwcn.com/news/Will-voters-pay-more-in-tabs-and-taxes-for-Metro-Transit-253655921.html[1]


",false,true,t1_ch4tg13,Fat_Carl_12,Ballard,0,1398747261,t5_2qhad,t3_248r40,t1_ch4rp7r,-9,1433568991,0,0,ch4tg13,Seattle,-9,,flair,
"The analogy breaks down for that example (was intending it as a 'government gets to catalog your property' analogy), but we register our cars so the county &amp; state can tax them accordingly, and it makes it easy when a car is stolen or involved in a crime.",false,true,t1_chnyuxe,charlesgrodinfan,Queen Anne,0,1400717520,t5_2qhad,t3_265v0x,t1_chnyt8k,-16,1435492746,0,0,chnyuxe,Seattle,-16,,flair,
With great spandex comes great responsibility.,false,true,t1_ciey9lk,Rock_N_Rye,,0,1403542630,t5_2qhad,t3_28u7ra,t1_ciej56j,53,1434366941,0,0,ciey9lk,Seattle,53,,,
You are the person in the left lane. Move over! It's the law.,false,true,t1_chwlkeq,niewinski,,0,1401653749,t5_2qhad,t3_271qng,t1_chwkt15,77,1434049456,0,0,chwlkeq,Seattle,77,,,
"Looks like a set up with a few people involved, all for insurance. Who just happens to be filming for no reason, while driving?",false,true,t1_cjjmlgn,LegacyZXT,Tacoma,0,1407429786,t5_2qhad,t3_2cui93,t3_2cui93,-3,1435121036,0,0,cjjmlgn,Seattle,-3,,flair,
"Selling 60k tickets as the only team in a market of around 11+ million people is not difficult. ",false,true,t1_centjbx,JohnStamosBRAH,Capitol Hill,0,1389553664,t5_2qhad,t3_1v0uw7,t1_centdzt,-7,1431911926,1,0,centjbx,Seattle,-7,,flair,
"I'm a POC.  Honestly, you might mean well, but you're coming off like a child here.  The discrimination proposed in the flyer is wrong, in either direction.  Quit trying to justify it because ""whites did it first"".  That's school yard mentality.",false,true,t1_cg1tnn7,seattletono,West Seattle,0,1394739368,t5_2qhad,t3_20btcu,t1_cg1qcp4,27,1435497787,0,0,cg1tnn7,Seattle,27,,flair,
"Raising the price of labor doesn't raise its value. ",false,true,t1_chxfw7c,svengalus,Downtown,0,1401739422,t5_2qhad,t3_274mos,t3_274mos,53,1434064040,0,0,chxfw7c,Seattle,53,,flair,
"And like Tim Eyeman's Initiative-O-Matic machine, if it gets struck down, the offending portion of the law gets removed, re-submited and put up to another vote.  And again the defense will be a chorus of gun owners who will claim it was poorly written, or that voters are stupid, when it passes again",false,false,t1_cm89r0k,kinisonkhan,Kent,0,1416515151,t5_2qhad,t3_2mw61v,t1_cm88lpi,-5,1425923754,0,0,cm89r0k,Seattle,-5,,flair,
"You also can't go when the light turns green. This frustrates me to no end. It is NOT LEGAL for you to use your phone while operating a car, plain and simple. You are also being rude to everyone who has to wait behind you. Don't think for a second you always catch the green right when it turns, you are wasting other peoples time.",false,false,t1_cn2bm6o,thewildcard02,,0,1419267945,t5_2qhad,t3_2q1ql9,t1_cn289it,14,1425270888,0,0,cn2bm6o,Seattle,14,,,
"For skiers/snowboarders, it means the difference between a powder day and freezing rain.",false,true,t1_ckjajj8,torquesteer,Wallingford,0,1410818774,t5_2qhad,t3_2ghihw,t1_ckja3xj,18,1426995439,0,0,ckjajj8,Seattle,18,,flair,
"No, just the neon sign makers. ",false,true,t1_ch48cy2,Ahundred,The CD,0,1398703468,t5_2qhad,t3_246yfq,t1_ch484ed,18,1433558857,0,0,ch48cy2,Seattle,18,,flair,
[deleted],false,false,t1_cl59xcz,[deleted],,0,1412903545,t5_2qhad,t3_2iso5k,t1_cl56a79,15,1426601165,0,0,cl59xcz,Seattle,15,,,
"The argument against in the voter guide is fairly concise. I'm leaving our irrelevant paragraphs. 

&gt; Public transit is an important part of our transportation system, but Metros current shortfall of $75 million, annually, results from its expenses long increasing at over twice the rate of inflation despite its own stated commitment to reduce those costs to or below inflation.

&gt; This is why Sound Transit stopped purchasing services from Metro for several bus routes within King County and, instead, substituted Pierce Transit in order to save nearly 30%.  Pierce Transit has worked to reduce costs while Metros continue rising.

&gt; For taxpayers living in east-and-south county  who already pay 65% of transit taxes but receive just 37% of transit services  piling on these added taxes would make this unfairness even worse.

&gt; Sustainable transit requires real financial controls, not Metros repeatedly broken promises.

",false,true,t1_cgmnwl0,[deleted],,0,1396911452,t5_2qhad,t3_22giji,t1_cgmmwwo,35,1433254456,0,0,cgmnwl0,Seattle,35,,,
Yeah!  Everybody just needs to pipe down and accept whatever shit happens to them because it's worse someplace else.,false,true,t1_ch4axon,SeattleMan001,West Seattle,0,1398708679,t5_2qhad,t3_24728u,t1_ch497dl,14,1433560136,0,0,ch4axon,Seattle,14,,flair,
"those voters are idiots. I hate to resort to that, but, it is what it is. If you're too stupid to see how they are in the same system..... ",false,true,t1_chbwevh,alexfrancisburchard,Kent,0,1399478388,t5_2qhad,t3_24xger,t1_chbv7r6,-8,1433691339,0,0,chbwevh,Seattle,-8,,flair,
...doesn't matter had sex.,false,false,t1_cmkv0r5,joeschmidlap,,0,1417693353,t5_2qhad,t3_2o8s2g,t3_2o8s2g,14,1425613481,0,0,cmkv0r5,Seattle,14,,,
[deleted],false,true,t1_cj7l7rl,[deleted],,0,1406308342,t5_2qhad,t3_2bp942,t1_cj7kxlj,-5,1434895733,0,0,cj7l7rl,Seattle,-5,,,
"Yes, there will always be another route.  If there isn't another route, this city will pretty much cease to function.",false,true,t1_ckjwajn,El_Nopal,Leschi,0,1410880151,t5_2qhad,t3_2gi7rt,t1_ckjmnc7,-5,1426985013,0,0,ckjwajn,Seattle,-5,,flair,
"ITT: Commenters not feeling bad for OP, but getting downvoted for it.",false,true,t1_ck493vl,Darkersun,,0,1409358744,t5_2qhad,t3_2exlor,t3_2exlor,-7,1427290043,0,0,ck493vl,Seattle,-7,,,
I just don't like the product team in charge of the web player for streaming video. Where's the 'next episode' button or next episode auto-start when I'm watching Jersey Shore?,false,true,t1_chfdiiw,charlesgrodinfan,Queen Anne,0,1399838407,t5_2qhad,t3_25ar2a,t3_25ar2a,16,1433751504,0,0,chfdiiw,Seattle,16,,flair,
"I get the history, but I'm not a fan of ""Metropolitans"". It seems pretty... generic, and maybe even a bit goofy? It certainly doesn't sound intimidating.

I don't really follow sports though, so maybe my opinion doesn't matter much here.",false,true,t1_ck1nr1f,JimmyMcReputation,,0,1409121054,t5_2qhad,t3_2ep398,t1_ck1nig3,23,1427338568,0,0,ck1nr1f,Seattle,23,,,
