body,score_hidden,archived,name,author,author_flair_text,downs,created_utc,subreddit_id,link_id,parent_id,score,retrieved_on,controversiality,gilded,id,subreddit,ups,distinguished,author_flair_css_class,removal_reason
"Thunder.  Saw the lightning.  And in past years the Angels haven't boomed, have they?  Just fwooshed, right?",false,true,t1_cjf13io,lilzilla,,0,1407003349,t5_2qhad,t3_2cftzl,t3_2cftzl,72,1435034088,0,0,cjf13io,Seattle,72,,,
Hmm all 3 comments got downvoted in here.. wonder who it was...,false,true,t1_cfwch18,jesuswuzanalien,Lynnwood,0,1394156032,t5_2qhad,t3_1zrkkk,t3_1zrkkk,-15,1432691806,0,0,cfwch18,Seattle,-15,,flair,
"

I figure the rule is: you may walk in the bike lane if there is room to go around you, but if you clog everything, don't be mad when a rollerblader shoves between you and your walking partner, because honestly they can't even stop very easily and you shouldn't be there. That's weird that anyone got mad about anything. Especially a bike that has brakes, or can go off the path.",false,false,t1_cl0pvdx,sontato,,0,1412478811,t5_2qhad,t3_2iarny,t3_2iarny,-8,1426679473,0,0,cl0pvdx,Seattle,-8,,,
That person would not be a conservative. A conservative would want to prevent government regulating the price of labor.,false,true,t1_chzxq2o,svengalus,Downtown,0,1401987205,t5_2qhad,t3_27e606,t1_chzx5oe,13,1434107169,0,0,chzxq2o,Seattle,13,,flair,
"No. It's helped by *you* doing work with *your* dog in a controlled setting, not continually reinforcing negative expectations and responses in your animal by thrusting them into situations that cause anxiety.


You're a bad pet owner. You're not trying to help your animal, only blaming everyone around you.

And I wasn't talking about breed agggression after these other comments but as a thing as a whole that off leash dogs = dogs that bite.  Which is what you andthe other commentor have stated. ",false,false,t1_cll8vz7,ryan_goslings_smile,,0,1414428284,t5_2qhad,t3_2kduxq,t1_cll8n07,-4,1426325607,0,0,cll8vz7,Seattle,-4,,,
When I was in high school I regularly drove my parents minivan. I also drove it like a teenage idiot. I'd imagine this is what is happening here. An idiotic teen acting idiotically.,false,false,t1_cl6dvdb,travio,,0,1413010073,t5_2qhad,t3_2iwx8l,t1_cl6ai9q,13,1426582174,0,0,cl6dvdb,Seattle,13,,,
"Dude, compared to FIFA? the NFL might as well be ran by mother teresa.  [you don't see sex trafficking at NFL games](http://www.aljazeera.com/indepth/opinion/2014/06/world-cup-sex-trafficking-201465123438956286.html)",false,true,t1_ci726ar,daveimprovement,Denny Triangle,0,1402708742,t5_2qhad,t3_282i1o,t1_ci7117c,-8,1434230448,0,0,ci726ar,Seattle,-8,,flair,
"Seattle has some of the ugliest architecture of most major cities.

This continues that trend...",false,true,t1_che97qw,acidmonkey,,0,1399698520,t5_2qhad,t3_256lj2,t3_256lj2,-34,1433732182,0,0,che97qw,Seattle,-34,,,
[Here you go](http://lmgtfy.com/?q=the+basic+principles+of+anarchism),false,true,t1_ch8pnus,Bird_Person,Rainier Beach,0,1399145631,t5_2qhad,t3_24lzbt,t1_ch8nucs,-5,1433636268,0,0,ch8pnus,Seattle,-5,,flair,
"You can thank your state Liquor Control Board for the SNAFU.

""You know what would be *great*? Getting a holdover from the alcohol prohibition days staffed with old people who don't like pot **at all** to be in charge of full implementation. From producer to retailer, it will be a capital idea!""

I mean, we could have just rolled the medical pot system into the business model but oh heavens no, think of the children! They could actually see it and then you know what that means...jazz music and all that nonsense.",false,true,t1_cj7vumk,[deleted],,0,1406328797,t5_2qhad,t3_2bq46a,t1_cj7uoge,16,1434900897,0,0,cj7vumk,Seattle,16,,,
"Guize...I think they are serious. They're bringing a *community megaphone*, guize.",false,false,t1_cmts3b1,co_radio,,0,1418487374,t5_2qhad,t3_2p605a,t3_2p605a,14,1425453111,0,0,cmts3b1,Seattle,14,,,
"You signed the lease... why don't you understand your legal rights and abilities before signing it?

Ignorance is not being ""taking advantage off"".",false,true,t1_cklxovr,sea_love,,0,1411060320,t5_2qhad,t3_2gre9m,t1_cklwtz0,-7,1426942228,0,0,cklxovr,Seattle,-7,,,
"This is high on my list, but my all-time favorite was ""bear snatch"" written on some rocks in Wallingford. I also saw it sprayed on a used mattress on the side of the road in Cap Hill.",false,true,t1_cfrdp7i,BWDpodcast,Ballard,0,1393634635,t5_2qhad,t3_1z7agx,t3_1z7agx,20,1432605956,0,0,cfrdp7i,Seattle,20,,flair,
"Bars/venues: Jazz Alley (big names), Tula's, Lucid, Cafe Racer, Seamonster (more funk, but my fav)

Restaurants: Vito's, Serafina, The Pink Door, Sullivan's (my trio will be there tonight)

edit: Also I found this cool website just now: http://seattlejazzscene.com/",false,true,t1_chd18tm,LeviWhoIsCalledBiff,Wallingford,0,1399582034,t5_2qhad,t3_252hbd,t3_252hbd,16,1433711072,0,0,chd18tm,Seattle,16,,flair,
"Not sure which you'll delete, so I'll reply to both:


No thank you... I'd rather be taxed 10% on what I spend, than 10% of what I make.

",false,false,t1_cmp0rbg,Schwa142,Bellevue,0,1418070037,t5_2qhad,t3_2oo157,t1_cmp0f7d,-7,1425537754,0,0,cmp0rbg,Seattle,-7,,flair,
"Where your mom works. ",false,true,t1_ck2fqfa,grantizzle,,0,1409191722,t5_2qhad,t3_2es81e,t3_2es81e,-15,1427324731,0,0,ck2fqfa,Seattle,-15,,,
"Your scare tactic has no power over me.

My gut tells me the folks who rely on public transportation to get to and from are going to be resourceful enough to get around despite the cuts w/out buying a car.",false,true,t1_cgnqaeh,widdershins13,Capitol Hill,0,1397008991,t5_2qhad,t3_22ju9h,t3_22ju9h,-4,1433272877,1,0,cgnqaeh,Seattle,-4,,flair,
A line out the door means you haven't scaled appropriately to demand. It means there are other people choosing not to go because they don't want to wait in line. It's a hallmark of bad restaurant management.,false,false,t1_clzo0h4,Bensch,Downtown,0,1415735837,t5_2qhad,t3_2lzsbw,t1_clznq8q,-7,1426075252,0,0,clzo0h4,Seattle,-7,,flair,
"It's PIKE Place Market people! NOT Pike's Place Market! ",false,true,t1_ckgjznt,AlienMutantRobotDog,,0,1410550761,t5_2qhad,t3_2g7w67,t3_2g7w67,22,1427046379,0,0,ckgjznt,Seattle,22,,,
I can live with being a bigot toward bigotry...just like I have no problem killing murderers or hating haters /shrug,false,false,t1_cl2flsq,Eryb,,0,1412645578,t5_2qhad,t3_2ih8kx,t1_cl2fd1h,-4,1426650070,0,0,cl2flsq,Seattle,-4,,,
"Everyone here is a bunch of squares, but this is beautiful! Love ya, CI!!",false,false,t1_cmmnc71,videodads,Ballard,0,1417837575,t5_2qhad,t3_2oevf6,t3_2oevf6,-20,1425579053,0,0,cmmnc71,Seattle,-20,,flair,
"When people say they don't care about politics all I hear is ""I don't care about people""",false,true,t1_cjed1no,KonradHarlan,Ballard,0,1406929433,t5_2qhad,t3_2cdflh,t3_2cdflh,13,1435022212,0,0,cjed1no,Seattle,13,,flair,
"Lets lock this bitch up then. Dont worry, in 2033 we'll feel bad and let her go. ",false,false,t1_cm8zwuo,CharlieBaumhauser,,0,1416584251,t5_2qhad,t3_2mznqv,t3_2mznqv,31,1425911077,0,0,cm8zwuo,Seattle,31,,,
"LOL @ this.

JUST GO BUY A BUDWEISER AND SOME FRIES YOU COMMIES. ",false,false,t1_ckoujkp,iamseriodotus,Seaview,0,1411342993,t5_2qhad,t3_2h2nqb,t1_ckotybm,42,1426887191,0,0,ckoujkp,Seattle,42,,flair,
like....wtf...what can we do about this,false,true,t1_cfehy18,Realik,,0,1392316569,t5_2qhad,t3_1xtiv4,t3_1xtiv4,-3,1432382862,0,0,cfehy18,Seattle,-3,,,
"This article pretty much sums up why most people hate them. http://www.thestranger.com/seattle/church-or-cult/Content?oid=12172001
",false,true,t1_cfk1ebx,bipbopcosby,,0,1392891759,t5_2qhad,t3_1yepwl,t1_cfk11w4,29,1432479011,0,0,cfk1ebx,Seattle,29,,,
"Wow thanks man, im over in a deserted area of A right now. Heading over there now!

Edit: The Promised Land!  http://imgur.com/t3QNJtS",false,false,t1_claw06v,Hooligan8,,0,1413441631,t5_2qhad,t3_2je4uf,t1_clavshg,44,1426504015,0,0,claw06v,Seattle,44,,,
"A densely-populated urban area is the only place that espouses a far-left liberal agenda?

Who could have predicted that?

EDIT: Geez people, lighten up. It's just a joke (although there is some truth to it so I don't see what the butthurt is all about).",false,true,t1_cj0b4gq,WhatsThatNoize,Delridge,0,1405630381,t5_2qhad,t3_2azhzb,t3_2azhzb,-8,1434766420,1,0,cj0b4gq,Seattle,-8,,flair,
Lol reddiquette,false,true,t1_cep2m1w,fact0,,0,1389676189,t5_2qhad,t3_1v5hoj,t1_cep2jbf,-20,1431933783,0,0,cep2m1w,Seattle,-20,,,
You can be nicer than that.,false,false,t1_cn3hoc6,careless,North Capitol Hill,0,1419361507,t5_2qhad,t3_2q6rl1,t1_cn3dmrg,-3,1425250281,0,0,cn3hoc6,Seattle,-3,,flair,
I DIDNT PASS OUT I WAS NAPPING,false,false,t1_cn81j26,napalm_beach,Bainbridge Island,0,1419828243,t5_2qhad,t3_2qnyif,t1_cn81g6i,14,1425171287,0,0,cn81j26,Seattle,14,,flair,
"The Seattle No, The Freeze, The Whatever....

Loneliness has a name, several names actually. Add the internet and you have a place to complain about it and a name to give it. 

Guys, I know you're lonely. Try harder to make friends at work. ",false,true,t1_cjjrkwl,Amoq,Lower Queen Anne,0,1407438361,t5_2qhad,t3_2cwgnw,t1_cjjrint,-4,1435123511,0,0,cjjrkwl,Seattle,-4,,flair,
I moved here earlier this year. The fact that you got downvotes for asking this question basically sums it up.,false,false,t1_clhlkah,face_butt,,0,1414078794,t5_2qhad,t3_2k3pn2,t3_2k3pn2,21,1426388176,0,0,clhlkah,Seattle,21,,,
"If only there was a police station in the neighborhood.

##**/s**",false,false,t1_ckslaqf,[deleted],,0,1411685217,t5_2qhad,t3_2hgylm,t1_ckskoc0,13,1426822641,0,0,ckslaqf,Seattle,13,,,
"OP is not a special snowflake and neither are you.

Get over yourself, nobody gives a shit about you, nobody gives a shit about me, nobody gives a shit about anybody.

A thousand innocent people died in bombings in Syria today alone and I seriously don't give a fuck. Why on Earth would I care about this idiot's wedding.",false,false,t1_ckqupx2,highonstress,,0,1411523178,t5_2qhad,t3_2ha2bn,t1_ckqtqqf,-6,1426852668,0,0,ckqupx2,Seattle,-6,,,
"As a Kentuckian, stop movin' in on our turf, boy.  

*aggressive beard stroking*",false,false,t1_ckq4soa,Thjoth,,0,1411461871,t5_2qhad,t3_2h6lsv,t1_ckpxfgs,19,1426864894,0,0,ckq4soa,Seattle,19,,,
"Now if they could work on retaining leadership, that'd be nice.",false,false,t1_ckyimr8,cokernoodle,University District,0,1412268000,t5_2qhad,t3_2i3ij2,t3_2i3ij2,16,1426717909,0,0,ckyimr8,Seattle,16,,flair,
Ok i can't help myself...pigs eat anything!,false,false,t1_cme8g3g,P0x26A,,0,1417064166,t5_2qhad,t3_2niqz8,t1_cmdzm7c,-10,1425820740,0,0,cme8g3g,Seattle,-10,,,
"* Actually know the city layout and not be beholden to a GPS to navigate

* Stay off their fucking phones while driving.",false,true,t1_cffdxn2,TheRealBramtyr,Capitol Hill,0,1392405151,t5_2qhad,t3_1xwsmg,t1_cffci3k,17,1432398477,0,0,cffdxn2,Seattle,17,,flair,
I count 4 chicks I'd fuck.,false,true,t1_ci8ar9b,guns_r_us,,0,1402861766,t5_2qhad,t3_287a5w,t3_287a5w,-18,1434251856,0,0,ci8ar9b,Seattle,-18,,,
"The general idea is ""Fuck the companies - they make money so they're evil."" I don't think it gets any deeper than that.",false,true,t1_chjoqp5,SnarkMasterRay,,0,1400263618,t5_2qhad,t3_25pwia,t1_chjo5tc,34,1433826067,0,0,chjoqp5,Seattle,34,,,
"I always laugh because that was literally their logic when opening that place. ""Paseos line is long as shit, let's open an knockoff across the street.""",false,false,t1_clzrt5d,reginaldtato,,0,1415742894,t5_2qhad,t3_2lzsbw,t1_clzo552,19,1426073481,0,0,clzrt5d,Seattle,19,,,
"Wow, that's *awful.*  I couldn't have possibly predicted such a massive failure on behalf of this city, and this state.

I will not miss Seattle. Fuck this miserable cesspool of a ""progressive"" city.  Oklahoma City on the coast. I'm genuinely shocked a city can be this terrible at pretty much everything but natural beauty. It's so good on paper...",false,true,t1_ch82ox6,65436456345,,0,1399067422,t5_2qhad,t3_24k3m8,t3_24k3m8,-14,1433625259,0,0,ch82ox6,Seattle,-14,,,
"The anti-science movement, particularly on the political left which generally lacks a ""moral"" objection to the overall body of science, is one of the most alarming trends in our society at the moment. Children are really suffering because of this bullshit.",false,true,t1_cii25r9,oofig,,0,1403827182,t5_2qhad,t3_296ttd,t3_296ttd,19,1435488958,0,0,cii25r9,Seattle,19,,,
"I'm a Seattle native, but I'm not indigenous to the Salish Sea. The folks up in BC use ""First Nations"" and that sounds more proper to my ears. Properer.",false,false,t1_cl2lse7,baking_soda_method,Columbia City,0,1412659229,t5_2qhad,t3_2ihssj,t1_cl2ipod,13,1426647156,0,0,cl2lse7,Seattle,13,,flair,
"If I were you I would get on a fishing boat for a 60-90 day contract. Google them, they are all over the Washington and Oregon coast.",false,false,t1_cn8qodq,fencer3,,0,1419893674,t5_2qhad,t3_2qr7bt,t3_2qr7bt,15,1425159350,0,0,cn8qodq,Seattle,15,,,
"I'd hardly point to seattle cyclists as paragons of fitness. Narrow chests. ",false,true,t1_ch8xxh7,red454545,Hilltop,0,1399168334,t5_2qhad,t3_24nroi,t1_ch8whsx,-6,1433640228,0,0,ch8xxh7,Seattle,-6,,flair,
"Eat your heart out, San Francisco",false,true,t1_chz22x4,ELChad0,University of Washington,0,1401902324,t5_2qhad,t3_27awmi,t3_27awmi,137,1434091997,0,0,chz22x4,Seattle,137,,flair,
"This Saturday in Ballard, $10 will get you [all-you-can-eat pie](http://www.ballardpieparty.org/) for charity!",false,true,t1_cew8dct,Will_Im_Not,University District,0,1390424716,t5_2qhad,t3_1vvqjk,t3_1vvqjk,13,1432059364,0,0,cew8dct,Seattle,13,,flair,
[deleted],false,true,t1_ceooura,[deleted],,0,1389645275,t5_2qhad,t3_1v3k2i,t1_ceoijf6,-4,1431927173,0,0,ceooura,Seattle,-4,,,
"3 is also horrible advice.  Washington (and Seattle) has pretty good tenant protections but one the thing that will get you evicted the fastest is willfully refusing to pay rent when you have the means to do so.  ""Just put it in escrow"" is not a valid suggestion since ""in escrow"" does not equal ""in the landlord's bank account.""",false,true,t1_cihohd0,somenewuser,Central Area,0,1403799556,t5_2qhad,t3_295iu3,t1_cihnrp3,18,1434414473,0,0,cihohd0,Seattle,18,,flair,
"Had to remind myself that looking at comments to the DREAM act in WA, raising minimum wage, Machinists pensions, etc. Lots of thinking only about me. ",false,true,t1_cevcrc8,[deleted],,0,1390338144,t5_2qhad,t3_1vru1k,t1_cev95ve,0,1432043262,1,0,cevcrc8,Seattle,0,,,
"They don't think to themselves ""me first.""   Instead they think ""everyone wants to steal my space, because if I open up a space, someone will jump into it!   If I open up more, *everyone* will jump into it, and then I'll be sitting there at 0MPH!!!""    (In forums there are usually many users saying this, saying it repeatedly.)

.

Actually it doesn't happen: if you open up a space, then it's probably the only gap in a solid-packed lane of tailgaters.   *Of course* the people who are trying to merge will jump into any space offered.

So open up ten spaces.

This will make you 10sec late to work!!!!  You'd better eat your morning toast very slightly faster to compensate!!!!!!!
",false,true,t1_cgtpcf5,wbeaty,,0,1397626921,t5_2qhad,t3_2347dg,t1_cgtf15m,0,1433376918,0,0,cgtpcf5,Seattle,0,,,
"Capitol Hill ending at Madison much like that link is a joke though. If you were from out of town and looked at that map, then went to 18th and Madison you'd be expecting to look up a hill, much like one would at Mercer and Queen Anne, and wonder why the clear hill to the south was not the same.  The TV towers are on Capitol Hill, but according to the map they are not. These areas can have more than one moniker. Like Downtown includes SLU, Belltown, Denny Triangle, Pioneer Square, SODO, etc. Those who grew up here often refer to all of these places as Downtown, but will also refer to specific places within the greater downtown complex to  provide reference. The term 'going downtown' really encompasses everything from Mercer to Boeing and west of I5 to the water. 

'I'm heading downtown for dinner'
'Where downtown?'
'This new little itallian place in Pioneer Square.'",false,true,t1_cjwkbyg,jll206,,0,1408634853,t5_2qhad,t3_2e32s0,t1_cjvwxnr,0,1435361514,0,0,cjwkbyg,Seattle,0,,,
Thank goodness!,false,true,t1_ciz8jl0,quatroquesodosfritos,Junction,0,1405536618,t5_2qhad,t3_2au6s3,t1_ciz16tx,0,1434747243,0,0,ciz8jl0,Seattle,0,,flair,
"How is the church affecting the state here?

I'll also point out that the Constitution only restricts the government.  It says ""Congress shall make no law respecting an establishment of religion, or the free exercise thereof""  It says NOTHING about what religion can or can't do.",false,true,t1_cissm33,juiceboxzero,Bothell,0,1404933308,t5_2qhad,t3_2a7oth,t1_cisorrg,0,1434629890,0,0,cissm33,Seattle,0,,flair,
Ate there last night for the first time.  Excellent.,false,true,t1_cibuarh,cmk2877,Capitol Hill,0,1403205328,t5_2qhad,t3_28kl3o,t1_cibsq1s,0,1434313007,0,0,cibuarh,Seattle,0,,flair,
[deleted],false,true,t1_cj12vj8,[deleted],,0,1405705439,t5_2qhad,t3_2ay64t,t1_cj0dw63,0,1434779971,0,0,cj12vj8,Seattle,0,,,
[deleted],false,true,t1_cgkgcq1,[deleted],,0,1396666001,t5_2qhad,t3_227z8r,t1_cgkfyt0,0,1433216225,1,0,cgkgcq1,Seattle,0,,,
[deleted],false,true,t1_cfxbblf,[deleted],,0,1394255608,t5_2qhad,t3_1zsmp6,t1_cfwloe8,0,1432708539,0,0,cfxbblf,Seattle,0,,,
"I would add legal weed and note that Seattle Central Community College is now just Seattle Central College.

",false,true,t1_cgnya7j,bigpandas,,0,1397036282,t5_2qhad,t3_22l2fm,t3_22l2fm,0,1433276716,0,0,cgnya7j,Seattle,0,,,
"i dunno, the whole tour is kind of silly. you get duck quakers and the tour guides where goofy hats. i think it'd be charming and goofy. i didn't know that about the old military vehicles. makes a bit more sense now..",false,true,t1_cf29lve,fashionandfunction,Mill Creek,0,1391041835,t5_2qhad,t3_1whvqi,t1_cf2997c,0,1432167102,0,0,cf29lve,Seattle,0,,flair,
[deleted],false,true,t1_cfa2our,[deleted],,0,1391848141,t5_2qhad,t3_1xb0rn,t1_cfa2opg,0,1432306418,0,0,cfa2our,Seattle,0,,,
TIL that sub-pop did not die out with the 90s.,false,true,t1_ch7xm14,derrickito,Green Lake,0,1399056271,t5_2qhad,t3_24k7q0,t3_24k7q0,0,1433622782,0,0,ch7xm14,Seattle,0,,flair,
Nothing to see here.  Move along.  Just more Responsible Gun Owner^tm persecution.,false,false,t1_cmf46ge,Big_MacLargeHuge,,0,1417156774,t5_2qhad,t3_2nmbp6,t3_2nmbp6,0,1425805573,0,0,cmf46ge,Seattle,0,,,
"These protests have become an outlet for teenagers who think the world cares about their feelings. The fact is, they are clueless both to the issues they are protesting and to the fact that the world doesn't give a shit about their feelings.",false,false,t1_cmdwgwg,svengalus,Downtown,0,1417037024,t5_2qhad,t3_2nf6n3,t3_2nf6n3,0,1425826444,0,0,cmdwgwg,Seattle,0,,flair,
"2 Cars, motorcycle, and a rv",false,true,t1_ch1upp8,xoomerfy,Burien,0,1398445021,t5_2qhad,t3_23v4py,t1_ch1sca0,0,1433517771,0,0,ch1upp8,Seattle,0,,flair,
"You should be more careful than the car, because you have more to lose",false,false,t1_ckrv8yo,StabbyPants,Wallingford,0,1411614870,t5_2qhad,t3_2hcxio,t1_ckrub0j,0,1426835180,0,0,ckrv8yo,Seattle,0,,flair,
" /me pulls out a map, looks it over, then agrees with you",false,false,t1_cm9hwdf,puerh_lover,Lynnwood,0,1416620641,t5_2qhad,t3_2n1cfu,t1_cm9h6kl,0,1425902661,0,0,cm9hwdf,Seattle,0,,flair,
Being bumper-to-bumper and being forced to actually stop is horrible for traffic behind you.  It's much better better to leave enough space that you can keep rolling.,false,true,t1_cjp3t4f,docebt,Ravenna,0,1407943623,t5_2qhad,t3_2dd29y,t1_cjojbta,0,1435216534,0,0,cjp3t4f,Seattle,0,,flair,
"I was speaking more to what I saw as a hyperbolic desired elimination of all suburban service, not to the specific metro cuts being enacted/proposed. ",false,true,t1_ch5ley5,alexfrancisburchard,Kent,0,1398822142,t5_2qhad,t3_248r40,t1_ch5lc78,0,1433582434,0,0,ch5ley5,Seattle,0,,flair,
[deleted],false,true,t1_cfsx65k,[deleted],,0,1393815537,t5_2qhad,t3_1zaps2,t1_cfs5w9f,0,1432632621,0,0,cfsx65k,Seattle,0,,,
"You need to look up the definition of ""am"" and/or how time works.",false,false,t1_cmnov8x,idontknowhowreddit,Pioneer Square,0,1417945296,t5_2qhad,t3_2oh70l,t1_cmn4pl9,0,1425561112,0,0,cmnov8x,Seattle,0,,flair,
"I feel like that's a separate issue of the atrocious low level of public spending on transit. ",false,false,t1_cmwcirp,JowsephVonSassypantz,,0,1418712006,t5_2qhad,t3_2pditu,t1_cmwa33a,0,1425376168,0,0,cmwcirp,Seattle,0,,,
"This is about cost-of-living in the Seattle area. In other words, this is an attempt at raising the minimum wage to a level that actually fulfills the inherent meaning of a minimum wage. It's been stagnant for decades, everywhere. If the cost of living in Alaska isn't very high, then people won't scream for it.

EDIT: This is also being phased in over the next 3-7 years, I believe, depending on the business.",false,true,t1_chxremt,droctopu5,,0,1401764963,t5_2qhad,t3_274mos,t1_chxng1a,0,1434069605,1,0,chxremt,Seattle,0,,,
"Gosh, what a well thought out response. You sure showed me, citing data and fact and studies instead of crying about the evil liberal socialists taking your guns. ",false,true,t1_cg3hlt3,konrad9,Wallingford,0,1394919825,t5_2qhad,t3_20fonl,t1_cg3gdjh,0,1432815578,1,0,cg3hlt3,Seattle,0,,flair,
"&gt; The victims had just been robbed, their behavior is justified IMO.

You should probably argue that with the shooter. 

I'm not blaming the victims, and justified really has nothing to do with it. Kind of the classic bullying scenario where any resistance is met with an escalation of violence. From watching the video, the robbery looked like just a means of asserting dominance.",false,true,t1_ckaka61,standard_staples,,0,1409980374,t5_2qhad,t3_2fkdfp,t1_ckajxpd,0,1427172082,0,0,ckaka61,Seattle,0,,,
"Precisely.  Look at what they said would happen in Seatac, then look what actually happened.  It's not like we're doing this blind.",false,true,t1_cgsq68g,pivolover,,0,1397533070,t5_2qhad,t3_230op6,t1_cgshtl7,0,1433360079,0,0,cgsq68g,Seattle,0,,,
"So, I know it is fun to bash cops and shit, but here is the deal with the number of shots fired by police.

Most police are normal human beings, their level of training is not all that much higher than normal people. They are not soldiers (despite how much Reddit loves to talk about the militarization of police) who are trained to kill. They are law enforcement officers trained to do an entirely different job, and SOMETIMES that involves the use of lethal force.

The thing to remember about normal human beings is that they tend to not like to kill each other. Killing each other is usually bad for a species and so over the tens of thousands of years of being human and the millions of years of being primates we pretty much developed a very very strong urge to NOT kill each other. Despite that we figured out along the way that as an intelligent beast we sometimes do need to kill each other, and yes it sucks, and when we have to do it we have to fight against our natural urges to do so. Killing isn't easy.

Guess how many people actively shot at the enemy in WW2? Take a wild one? These were all trained soldiers. Less than 10%. The number of people who actually fired their weapons was slightly higher, but those people shot above their targets or intentionally missed. This is a war that killed tens and tens of millions of people and only 10% did the shooting, heck of that 10% they were accountable for less than 40% of the actual casualties. Artillery fire killed or injured 60% of combatants in WW2, a form of combat that is very easy since the killing is so detached. The rest was made up for by bombings, other forms of combat, including small arms fire.

So what does this say about cops? Well cops are not soldiers. They don't even have the training of a WW2 soldier, who barely fired his weapon at the target and if they did was more likely to miss on purpose (subconsciously though most of the time). This is the same thing that happens with cops. They don't want to kill people (seriously, they don't, only 2% of the population are actual psychotics who can act with out empathy) and they do not have the training to turn that part of their brain off in that situation like modern soldiers do.

This is a good thing. A cop needs to exercise discretion when using lethal force. Sometimes they over react, again, not having that drill level of training is a double edged sword, you don't know how everyone is going to react in a situation that potentially involves mortal combat. Cops are not regimented like soldiers, they go home at night, have family issues, and come to work the next day, it is not as controlled an environment as a military. Most of the time cops do make the right decision, sometimes they do not.

So when you hear about so many rounds being fired at a suspect by police it is most likely not because they are poor shots, but because no one there actually wanted to shoot the person in the first place, but felt they still needed to fire their weapon.

For more information you should check out *On Killing* by former Lt. Col. Dave Grossman. It is a very excellent book on the psychology of killing and really gives perspective on the act of taking another life and is one of the few books to actually study it in depth.",false,true,t1_ciyoln7,NouberNou,Capitol Hill,0,1405480536,t5_2qhad,t3_2asy46,t1_ciyjh8q,0,1434737184,1,0,ciyoln7,Seattle,0,,flair,
"""Of course I can stereotype other people, because they're all homogenous and fit to generalize. But me? No - you can't stereotype where *I'm* from!""",false,true,t1_ch10t8a,ericjs,,0,1398364553,t5_2qhad,t3_23vney,t1_ch10mz2,0,1433503412,1,0,ch10t8a,Seattle,0,,,
"Arguably more than $40/hour when you consider they get a few months off during the summer. ",false,true,t1_ckenu8a,Lars9,,0,1410378507,t5_2qhad,t3_2g0f9e,t1_ckelwew,0,1427086167,0,0,ckenu8a,Seattle,0,,,
