body,score_hidden,archived,name,author,author_flair_text,downs,created_utc,subreddit_id,link_id,parent_id,score,retrieved_on,controversiality,gilded,id,subreddit,ups,distinguished,author_flair_css_class,removal_reason
"Presumably, you have to dig a bigger hole for a center platform. So it's about saving money and, possibly, dealing with the local geography.",false,true,t1_cjvsw33,stares_at_screens,,0,1408562246,t5_2qhad,t3_2e3o1u,t1_cjvraml,2,1435344694,1,0,cjvsw33,Seattle,2,,,
It is.  It's the [747-8F](http://en.wikipedia.org/wiki/Boeing_747-8).,false,true,t1_cf2su7l,Bleach-Free,,0,1391101455,t5_2qhad,t3_1wi9tz,t1_cf28cvp,2,1432176502,0,0,cf2su7l,Seattle,2,,,
"I was driving down 90 just a few dayz ago and the entire landscape was hazy and blanketed with smoke in places. I got sort of depressed on that drive, I was so glad everything started to clear up past Ellensburg and I could feel myself get happier. It's like hell out there in eastern washington on a good day, and even more like hell right now.",false,true,t1_cjibbfl,[deleted],,0,1407307710,t5_2qhad,t3_2crc1m,t3_2crc1m,2,1435459195,0,0,cjibbfl,Seattle,2,,,
White children,false,true,t1_cibs0jv,AutomaticGats,,0,1403200785,t5_2qhad,t3_28igba,t1_cibftl2,2,1434311931,0,0,cibs0jv,Seattle,2,,,
"Right. It says, and I'm paraphrasing, ""this is what we're looking for but some of these things might not be communicated for expediency.""

So, yeah, in the boat world, if you don't have power and are in a lane, and drifting toward shoal, specific issue and your location are priority. 

Edit: Ah, so that's the guard freq. Understood. ",false,false,t1_cmjpn2i,StellarJayZ,Frallingford,0,1417588669,t5_2qhad,t3_2o3yzc,t1_cmjpiyq,2,1425706988,0,0,cmjpn2i,Seattle,2,,flair,
"Sorry. My company uses Amazon Web Store as well. ",false,true,t1_ceqanlt,vatothe0,Queen Anne,0,1389809948,t5_2qhad,t3_1v8edy,t1_ceq7vyp,2,1431954965,0,0,ceqanlt,Seattle,2,,flair,
Are friends from out of town swear by the Mayflower.,false,false,t1_cmkkdg3,aldenrower,,0,1417660233,t5_2qhad,t3_2o774p,t3_2o774p,2,1425692333,0,0,cmkkdg3,Seattle,2,,,
[deleted],false,true,t1_chhy6l9,[deleted],,0,1400093431,t5_2qhad,t3_25jxaj,t3_25jxaj,2,1433795932,0,0,chhy6l9,Seattle,2,,,
"This dog may not be a better driver than some Seattleites, but he always uses his lights when drives at night. http://youtu.be/BWAK0J8Uhzk",false,false,t1_ckrc2k6,bigpandas,,0,1411576508,t5_2qhad,t3_2hc5df,t1_ckrazgc,2,1426844404,0,0,ckrc2k6,Seattle,2,,,
"This review's kind of annoying for Peachd because the guys are giving it crap for how it's delivered - which is in bulk, a particular meal to a particular office. From a less ""HOW DO I SHOT DELIVERY?"" POV, Peachd is awesome and the cheapest by far. 

Its only downside is the limited and random selection, but they let you know by text message around 10am what the meal will be for your location. You can even place an order by replying to the text. The whole setup works quite well (provided your co-workers are trustworthy.)",false,true,t1_cj52c4h,derangedhyena,Lynnwood,0,1406080210,t5_2qhad,t3_2bf723,t3_2bf723,2,1434851243,0,0,cj52c4h,Seattle,2,,flair,
"Thank you, I will!",false,false,t1_cn3iuji,tywtly,,0,1419363654,t5_2qhad,t3_2q72rx,t1_cn3ibxa,2,1425249598,0,0,cn3iuji,Seattle,2,,,
It's the *only* way *I* roll at Costco,false,true,t1_ckaz9sf,madnesscult,The CD,0,1410032816,t5_2qhad,t3_2fknqk,t1_ckan7lz,2,1427164091,0,0,ckaz9sf,Seattle,2,,flair,
Did they ever solve the problem of how to run a train on a floating bridge? Is the train always going to close down when it's windy?,false,true,t1_ci2d98b,[deleted],,0,1402256283,t5_2qhad,t3_27kfj4,t3_27kfj4,2,1434149092,0,0,ci2d98b,Seattle,2,,,
"Are you thinking of the Minds Eye right by Gargoyle Statuary? ",false,false,t1_clqmiey,behvin,Haller Lake,0,1414910428,t5_2qhad,t3_2ksl4z,t1_clog4rv,2,1426232452,0,0,clqmiey,Seattle,2,,flair,
"&gt; Shh, stop giving away my secret location.

;-)",false,false,t1_ckti2bt,pala4833,,0,1411771114,t5_2qhad,t3_2hj9lt,t1_cktdr9h,2,1426806782,0,0,ckti2bt,Seattle,2,,,
"The most fucked up part to me, is that this is a fairly new occurrence.  It wasn't all that long ago that our legislators, regardless of party affiliation, knew that different parts of the state had different needs and they managed pretty well to figure out how to make things work. 

I can't help but feel that we've poisoned ourselves by letting national issues and differences dictate our local needs.",false,true,t1_cf4n2fq,pmar,Cascade Foothills,0,1391292030,t5_2qhad,t3_1wogyr,t3_1wogyr,2,1432209466,0,0,cf4n2fq,Seattle,2,,flair,
"Yes, you've listed other residential neighborhoods. 

Few or none of which have important music venues that have been anchors and incubators for music and culture of Seattle. ",false,true,t1_ck8jgux,ericjs,,0,1409792295,t5_2qhad,t3_2ew7fc,t1_ck4zshd,2,1427208124,0,0,ck8jgux,Seattle,2,,,
"The OP didn't respond to you directly, so in case you missed it they [responded in the positive](http://www.reddit.com/r/Seattle/comments/2ctjtv/lost_cat_please_help_bring_her_home_she_is/cjizq3h).",false,true,t1_cjj52nz,another_foot,Columbia City,0,1407378929,t5_2qhad,t3_2ctjtv,t1_cjixvhg,2,1435112774,0,0,cjj52nz,Seattle,2,,flair,
"As someone whose hometown didn't get a Starbucks until after I'd left for college, I can tell you the excitement is real. But after having *real* coffee on a regular basis, I noped right out of the opportunity to wait in a horrendous line at the only Starbucks in the state while home for the holidays.",false,true,t1_cjp7s8y,pipedreamSEA,Fremont,0,1407951040,t5_2qhad,t3_2ddv9i,t1_cjp1i4a,2,1435218387,0,0,cjp7s8y,Seattle,2,,flair,
"Wow. I can't imagine a scared ferret in unfamiliar territory is anything easy to deal with. Good luck finding her owner, and good on you for caring for her!",false,false,t1_ckzvrn2,oreotiger,West Seattle,0,1412385676,t5_2qhad,t3_2i67kt,t3_2i67kt,2,1426693814,0,0,ckzvrn2,Seattle,2,,flair,
"lol jeezus that escalated quickly. let me know how you like seattle, I've been in phoenix for 4 months and am not a huge fan. thinking about sending it to the north west next summer. 

best of luck with the interview/move. ",false,false,t1_clxa47v,upnorth906,,0,1415514473,t5_2qhad,t3_2lpfrq,t3_2lpfrq,2,1426116978,0,0,clxa47v,Seattle,2,,,
"&gt;You said retailers can't make money because they're taxed too heavily

No I didn't. I said ""I doubt they're making that much money"". Taxes hurt both sellers and buyers. ",false,false,t1_cmsc5g6,Will_Im_Not,University District,0,1418343822,t5_2qhad,t3_2ozq47,t1_cmsc3g8,2,1425477694,0,0,cmsc5g6,Seattle,2,,flair,
"Every nook and cranny that has a view is going to be crowded and terrible parking. Get there early and set up the chairs and tripod to stake your territory. Usually people respect the camera. Areas I know are Lynn &amp; 5th on QA hill, maybe Aurora bridge but might not be stable enough. Don't expect to leave right away, everybody is doing the same thing at the same time. I'm glad I walk there.",false,true,t1_cin1m8x,NeedRez,Queen Anne,0,1404341641,t5_2qhad,t3_29ougw,t3_29ougw,2,1434523559,0,0,cin1m8x,Seattle,2,,flair,
Im glad y'all have ber. We're not getting a car so that makes me feel better about getting around the city.,false,false,t1_cl7afz2,OneTreestump,,0,1413119844,t5_2qhad,t3_2iz5wz,t1_cl71gvd,2,1426566671,0,0,cl7afz2,Seattle,2,,,
"Oh yeah, that is some sort of shady call centre now.",false,false,t1_cmncyjh,[deleted],,0,1417913556,t5_2qhad,t3_2ohr2s,t1_cmncl6q,2,1425566866,0,0,cmncyjh,Seattle,2,,,
"Safari on the iPhone has a private browsing mode and I assume Chrome would as well.

If you're on Windows Phone, I'm not sure if you have similar options.",false,true,t1_cfsvj42,blladnar,Fremont,0,1393811571,t5_2qhad,t3_1zdg6u,t1_cfssg1b,2,1432631781,0,0,cfsvj42,Seattle,2,,flair,
"The guy is a bit of a sexist prick, but *damn* does he know how to cut hair. 

(I won't be going back due to how he treated his employees while I was there, but it was the best haircut I've ever had.)",false,true,t1_ckl6tya,jrandom,Fremont,0,1410987098,t5_2qhad,t3_2gom55,t1_ckl473t,2,1426954955,0,0,ckl6tya,Seattle,2,,flair,
I thought I made out that they may have a suspect and found shotgun rounds in his pockets. Then they noted that there were two more suspects inside the house with possible ammunition.,false,true,t1_cjpsyjm,rainymondays,,0,1407994932,t5_2qhad,t3_2digay,t1_cjpsq6u,2,1435228568,0,0,cjpsyjm,Seattle,2,,,
"Part of it is probably because Portland doesn't have grade separated rail downtown or really at all until it gets out to the suburbs. In that sense, the LINK, despite having only one line, is superior.",false,true,t1_cf1z76o,kduffygreaves,,0,1391021132,t5_2qhad,t3_1wdvdf,t1_cf1dm7g,2,1432162037,0,0,cf1z76o,Seattle,2,,,
It gets better...,false,false,t1_cmafho5,jeexbit,Licton Springs,0,1416720880,t5_2qhad,t3_2n49wg,t1_cma8no9,2,1425886475,0,0,cmafho5,Seattle,2,,flair,
"I tried them, thanks for the tip. Their latency kept getting me killed in Call of Duty, so I switched over.

edit, I do miss being able to have internet out on the lake though.",false,true,t1_ch64in1,tannerz,South Lake Union,0,1398879295,t5_2qhad,t3_24d8cy,t1_ch64fay,2,1433591569,0,0,ch64in1,Seattle,2,,flair,
"I'm not a fan of In-N-Out, but I had the same expectation when I clicked the link hahaha. ",false,true,t1_civ4v7k,Wessykins,,0,1405135167,t5_2qhad,t3_2ah0q0,t1_civ1wci,2,1434674852,0,0,civ4v7k,Seattle,2,,,
Columbia City Theatre has a great open mic every Tuesday at 8:30pm,false,false,t1_clu9we4,PasswordGoneForever,,0,1415237886,t5_2qhad,t3_2lf2i6,t3_2lf2i6,2,1426169970,0,0,clu9we4,Seattle,2,,,
I don't see any reason to shut off the headlights unless your are boarding a ferry at night . Otherwise you just open yourself up to forgetting to turn them back on again.,false,true,t1_cei1vpb,Dognutz1,Marine Area 7,0,1388952374,t5_2qhad,t3_1ufk1d,t1_cei0bxk,2,1431811548,0,0,cei1vpb,Seattle,2,,flair,
The same camera could be used for all infringing parties. But I was mostly being facetious in an attempt to show you how some things just aren't worth the effort to set up. (like registering bicyclists or pedestrians),false,false,t1_cmnkv7y,Filtering,,0,1417931053,t5_2qhad,t3_2ofu98,t1_cmmzq5y,2,1425563105,0,0,cmnkv7y,Seattle,2,,,
"Sears has been going out of business since the 1980s. Don't bet money that behemoth will fail in your lifetime. ",false,true,t1_cjuose4,douglascoolgrey,Jet City,0,1408467256,t5_2qhad,t3_2dykfm,t1_cjunlrw,2,1435320198,0,0,cjuose4,Seattle,2,,flair,
greater seattle area is 3.5 MM,false,true,t1_cf8d9aa,aboganza,,0,1391669529,t5_2qhad,t3_1x4qib,t1_cf8ciak,2,1432276938,0,0,cf8d9aa,Seattle,2,,,
"Dont know. I just know its split up between different investors. I don't care that much to pay that much attention. ",false,true,t1_cgdmswz,aseattlethrowaway,,0,1395957507,t5_2qhad,t3_21gfj9,t1_cgd2ih9,2,1433098320,0,0,cgdmswz,Seattle,2,,,
Thank [Wickard V Filburn.](http://en.wikipedia.org/wiki/Wickard_v._Filburn),false,true,t1_ci5y8fu,jefftickels,,0,1402603227,t5_2qhad,t3_27wtq2,t1_ci573a3,2,1434211228,0,0,ci5y8fu,Seattle,2,,,
[deleted],false,true,t1_chm5qzm,[deleted],,0,1400541161,t5_2qhad,t3_25yjn5,t3_25yjn5,2,1433869024,0,0,chm5qzm,Seattle,2,,,
"I've heard rents in Ballard are getting weird because of all the construction and condos being built up, but I live in Capitol Hill so I don't really know. My rent is a little higher than I would like for the size of our space, but the convenience of all major transit lines right downtown, plus 3 walk-able grocery stores make it well worth it for us. Good luck on your hunt!",false,true,t1_cgq2n1d,000katie,Capitol Hill,0,1397247900,t5_2qhad,t3_22jbki,t1_cgpa9aq,2,1433314225,0,0,cgq2n1d,Seattle,2,,flair,
"Grasses, trees, and ""weeds"" all have flowers as well, just saying.",false,true,t1_cg8h447,[deleted],,0,1395428251,t5_2qhad,t3_20xq37,t1_cg7uhvh,2,1433008968,0,0,cg8h447,Seattle,2,,,
"Anyone can also start a charitable organization or volunteer at one. Some do it, and others use it to scam the fucking life out of the venerable.

Simply having a child may not be noble, but raising them and sacrificing so that they may go on to be useful is pretty noble.",false,false,t1_clfopbu,golfbybryan,Snohomish,0,1413910070,t5_2qhad,t3_2jsxw7,t1_clfersh,2,1426420961,0,0,clfopbu,Seattle,2,,flair,
"This summer uber cut its fares by 20% but kept paying their drivers the same amount. Recently they cut the pay as well. Also uber drivers are not actually employees but contractors, which is a little shady. I don't know why they don't just quit and start driving for Lyft or something like that.",false,true,t1_ck52bfc,[deleted],,0,1409446835,t5_2qhad,t3_2ey15f,t1_ck47gp8,2,1427276178,0,0,ck52bfc,Seattle,2,,,
"get a place in belltown while you can still afford it. don't bother with any of the satellite neighborhoods; traffic will lock your busses up so unexpectedly you will be leaving for work 2hrs early every day. ",false,true,t1_cgjdyrw,vivaelbanko,Interbay,0,1396560818,t5_2qhad,t3_222p3g,t3_222p3g,2,1433197799,0,0,cgjdyrw,Seattle,2,,flair,
"She was making a gun, the joke of the post wasn't that she was using her middle finger...",false,true,t1_cef7lvb,[deleted],,0,1388633706,t5_2qhad,t3_1u5xr4,t1_cef0atu,2,1427896121,0,0,cef7lvb,Seattle,2,,,
[deleted],false,false,t1_clpp5u5,[deleted],,0,1414807536,t5_2qhad,t3_2kwhdn,t3_2kwhdn,2,1426248195,0,0,clpp5u5,Seattle,2,,,
Scary is the best downtown option I've found and has good bang for your buck.,false,true,t1_ck2ejr0,duffman03,,0,1409188534,t5_2qhad,t3_2er25w,t1_ck26qd6,2,1427325337,0,0,ck2ejr0,Seattle,2,,,
Sports.,false,true,t1_cki0vyq,[deleted],,0,1410710057,t5_2qhad,t3_2gbf8g,t3_2gbf8g,2,1427017317,0,0,cki0vyq,Seattle,2,,,
I have Wave.  I like Wave.,false,true,t1_cgwfe2p,somenewuser,Central Area,0,1397898740,t5_2qhad,t3_23f59n,t1_cgwe7ds,2,1433424125,0,0,cgwfe2p,Seattle,2,,flair,
The Garage,false,false,t1_ckry9li,bigdelite,Kent,0,1411622990,t5_2qhad,t3_2he4tp,t3_2he4tp,2,1426833701,0,0,ckry9li,Seattle,2,,flair,
"HA! i know, i moved from portland.  these hippies are actually from alaska.  i can tell by the very expired alaska plates and all the stickers on the van about alaska pride.",false,true,t1_cihsurv,pdxportlandia,,0,1403808010,t5_2qhad,t3_295iu3,t1_cihsr90,2,1434416891,0,0,cihsurv,Seattle,2,,,
great city A+++++ will live again!!!,false,true,t1_ch2t8g1,llllllllll0lllllllll,,0,1398546633,t5_2qhad,t3_2420wl,t3_2420wl,2,1433534305,0,0,ch2t8g1,Seattle,2,,,
Lovely.,false,false,t1_cmjovgm,SixAlarmFire,Capitol Hill,0,1417586423,t5_2qhad,t3_2o2ucc,t3_2o2ucc,2,1425707348,0,0,cmjovgm,Seattle,2,,flair,
"Nonone chose to be born where they were born,  and that simple minded assessment doesn't even consider socioeconomic factors that cause a person to be where they are. 

Also america is(obviously)  just another human construct.  To the natives its still their lands.  ",false,false,t1_cmce118,alocalanarchist,,0,1416896971,t5_2qhad,t3_2nbzhs,t1_cmcdlui,2,1425852502,0,0,cmce118,Seattle,2,,,
Libertarianism is now sadly just a coverup for elitist sociopathy and racism.,false,true,t1_cjw11n5,[deleted],,0,1408578101,t5_2qhad,t3_2e3rvu,t1_cjvzb46,2,1435349705,1,0,cjw11n5,Seattle,2,,,
"Yeah, those traffic circles are what I'm referring to. They are roundabouts since you are supposed to go wide around them to make a left turn.

I guess it's two ways of saying the same thing, since everyone in the intersection before you will be to your left.",false,true,t1_cjw4q6d,mywowtoonnname,Queen Anne,0,1408586034,t5_2qhad,t3_2e48qc,t1_cjw25sj,2,1435351708,0,0,cjw4q6d,Seattle,2,,flair,
"I will be staying at the Silver Cloud in Capitol Hill in a couple if weeks. I was born and raised in Seattle and lived on capitol hill after high school. I'm now in Florida and this will be the first time I need to stay at a hotel in the city. I'm coming for a conference and there are too many of us to crash on a friend's couch. I've heard great things about the hotel and I LOVE the Capitol Hill area. Loads if stuff to do, and it's really eclectic. ",false,true,t1_cf58ucu,PainIsPrecious,,0,1391366335,t5_2qhad,t3_1wo3k4,t1_cf3wyub,2,1432220915,0,0,cf58ucu,Seattle,2,,,
My favorite is the value village at capital hill (11th and pike?) There are amazing clothes because hipsters...,false,false,t1_clciql7,alwaysomewhere,,0,1413589766,t5_2qhad,t3_2jjnzq,t3_2jjnzq,2,1426475215,0,0,clciql7,Seattle,2,,,
"Good advice. Being from the south myself, the only clarification I would make to OP is that when someone here says BBQ, they mean generally any activity involving a grill - well, any activity involving cooking something on a grill - not actual barbecue!",false,true,t1_cg41h0k,OhFrakReddit,,0,1394989695,t5_2qhad,t3_20i5sa,t1_cg3r1vy,2,1435553744,0,0,cg41h0k,Seattle,2,,,
"Yes, same time and place.",false,false,t1_clszrqm,wonderwanderexplore,First Hill,0,1415134691,t5_2qhad,t3_2l3wvz,t1_clsymx9,2,1426192020,0,0,clszrqm,Seattle,2,,flair,
"&gt;Income Inequality Advisory Committee

You mean misinformed government schills?

What isn't equal about income?",false,true,t1_ch0tywf,AFuddyDuddy,,0,1398350784,t5_2qhad,t3_23t25p,t3_23t25p,2,1433500180,0,0,ch0tywf,Seattle,2,,,
"I'm just being realistic. If the Church were to support something like that, then it would seem like it was supporting gay marriage. The media can't get simple things correct about the Pope and Church teaching, so it would definitely mess this sort of thing up, too.

And it's not proven that this is a social justice issue. I think that assumes a lot.",false,true,t1_cejua1v,fr-josh,,0,1389128306,t5_2qhad,t3_1ujldr,t1_cejspzo,2,1431842489,0,0,cejua1v,Seattle,2,,,
"No, I was around for a conference at the Washington State Convention Centre (Mozcon). Great City!",false,true,t1_cj2uelb,staceycav,,0,1405892560,t5_2qhad,t3_2b89fg,t1_cj2u318,2,1434810927,0,0,cj2uelb,Seattle,2,,,
"In the same boat. Are there any apartments that people have had **good** experiences with? I'm only temporary (May, June, July) and it's proving difficult to get any traction right now. I've probably sent 60 email and gotten 10 replies. ",false,true,t1_cg6klew,ladybro,Capitol Hill,0,1395245595,t5_2qhad,t3_20sy1i,t3_20sy1i,2,1432976193,0,0,cg6klew,Seattle,2,,flair,
"Kind of sucks... the settlement should obviously be paid entirely by the gun owner. ",false,true,t1_cjfruc1,Scr3wy0u,,0,1407084359,t5_2qhad,t3_2cfes8,t3_2cfes8,2,1435047453,0,0,cjfruc1,Seattle,2,,,
"I'm from Kansas and not sure if I want to make a new thread to ask this or not but I just have to know...

How's the weather? I'm considering Seattle because I'm done with the &lt;25F **incredibly** dry winters, and 90F+ summers. How does Seattle compare to our awful weather?",false,false,t1_cmm8p88,Geekuru,,0,1417807638,t5_2qhad,t3_28ky7p,t1_cibxlwt,2,1425586499,0,0,cmm8p88,Seattle,2,,,
"Damn, I have the SnoCon 25th anniversary board that Lib Tech produced too. I'm gonna miss that place. ",false,true,t1_cjauztj,soccerandsnow,,0,1406626661,t5_2qhad,t3_2bz8lj,t3_2bz8lj,2,1434953939,0,0,cjauztj,Seattle,2,,,
"You can sign an affidavit that the pet has been fixed.  ",false,true,t1_choj2sq,sherideswildhorses,Kent,0,1400779056,t5_2qhad,t3_265v0x,t1_choisbn,2,1433909967,0,0,choj2sq,Seattle,2,,flair,
"I highly recommend this option. Bring a book, buy an orca card pass, and enjoy the morning commute.",false,true,t1_cjomqn0,WickedSideburns,,0,1407892326,t5_2qhad,t3_2ddkqm,t1_cjohhrj,2,1435456118,0,0,cjomqn0,Seattle,2,,,
[deleted],false,true,t1_cin28l3,[deleted],,0,1404342996,t5_2qhad,t3_29owkn,t1_cin1zqh,2,1435482872,0,0,cin28l3,Seattle,2,,,
"Agreed.  And I'm OK with paying double price for good quality, non-sketchy retail experience, detailed information, knowledgable staff, etc.

But most people I know, unfortunately, are not, and they're still getting it off the street.  If this is going to work it still has to be competitive.  Most retail I've seen is about $20/gram, compared that to Winterlife (when they were selling to the general public), at $7 or $8/gram.  Big difference that might not convince a chunk of people.  Yeah, they support legalization don't want to break the law, but for daily smokers that can be a shitload of money.",false,false,t1_cmbwyur,slash178,,0,1416862869,t5_2qhad,t3_2n0a2k,t1_cm9jweq,2,1425860707,0,0,cmbwyur,Seattle,2,,,
Oh man so many onions :(,false,true,t1_chpq5dg,jasperspee,Bainbridge Island,0,1400895985,t5_2qhad,t3_269pc8,t1_chpdytf,2,1433930664,0,0,chpq5dg,Seattle,2,,flair,
"Kirkland itself isn't that big, and a very short drive from there are cheap suburbs.

Seattle is pretty expensive. Look at apartment prices on Craigslist.",false,true,t1_cep4cp0,n0exit,West Woodland,0,1389681524,t5_2qhad,t3_1v5x86,t1_cep1znm,2,1431934636,0,0,cep4cp0,Seattle,2,,flair,
Really sad news.,false,true,t1_cgkyv3p,breached,,0,1396733873,t5_2qhad,t3_228fcp,t3_228fcp,2,1433225082,0,0,cgkyv3p,Seattle,2,,,
"There are many good restaurants in Lower Queen Anne, north and west of the Seattle Center.  My faves would be Roti (Indian), Mashawi (Lebanese), the Nabob (Pub - lotsa great beers), and Roaring Bowl (shabu shabu). ",false,false,t1_cllm6i3,DoctorFork,Queen Anne,0,1414452340,t5_2qhad,t3_2kifl9,t3_2kifl9,2,1426318658,0,0,cllm6i3,Seattle,2,,flair,
"I ride the 372 from Kenmore, and it has switched from a 60' to a 40'.  ",false,true,t1_ci9d5lv,Flanaganm,,0,1402963460,t5_2qhad,t3_28ape6,t3_28ape6,2,1434270271,0,0,ci9d5lv,Seattle,2,,,
"There are stages of being a newcomer in Seattle. 

The first stage is ""Everyone seems really nice. It must e the fault of other people if they say they can't make friends."" 

This lasts about a year. After a year, you realize that you have ""people who talk to me in certain situations."" But you don't know these people any better than you did a year ago. Then you get annoyed. 

It's such a problem that Amazon has started making little pods of people who are hired at the same time and encouraged to get to know each other so their out of town new hires won't get depressed and leave. (So if you work at Amazon you might be an exception - but only because of social engineering at the corporate level). ",false,true,t1_ck7bb1b,[deleted],,0,1409685043,t5_2qhad,t3_2f44cm,t1_ck5y40n,2,1427236151,0,0,ck7bb1b,Seattle,2,,,
He made their intentions clear in the announcement. He said they want a fresh talent pool aka they are going high tech and all the smart people live here.,false,true,t1_ck5j6q7,madechidna,,0,1409505155,t5_2qhad,t3_2f2mu4,t3_2f2mu4,2,1427268155,0,0,ck5j6q7,Seattle,2,,,
You should listen to it. CDs end up in my house unsolicited pretty frequently and i feel compelled to listen to all of them. I end up keeping half of them.,false,true,t1_cizej2d,Ahundred,The CD,0,1405547587,t5_2qhad,t3_2avyf1,t1_cizaqzv,2,1434750407,0,0,cizej2d,Seattle,2,,flair,
Community and Pierce Transit have already had massive service cuts due to the economic recession.  (Though CT is trying to restore some limited Sunday service and is adding a second Swift route with federal assistance.)  Metro Transit has held on for as long as it can but the bottom has arrived.  Restoring needed money is what the April countywide vote was for and what the November citywide vote will try to accomplish.,false,true,t1_ckf465r,somenewuser,The CD,0,1410413846,t5_2qhad,t3_2g09yp,t1_ckeo2pm,2,1427077202,0,0,ckf465r,Seattle,2,,flair,
[deleted],false,false,t1_clap405,[deleted],,0,1413423114,t5_2qhad,t3_2jbtai,t1_cladgfo,2,1426507301,0,0,clap405,Seattle,2,,,
"&gt;  If you have people behind you and you're holding up traffic, THEN GET THE FUCK OUT OF THE WAY.

Is that your reaction to the horse-and-buggy crawling down 4th Ave? What about when a large piece of farm equipment is going 5 mph in front of you on a country road?",false,false,t1_cn9p933,therealbrennen,Belltown,0,1419975930,t5_2qhad,t3_2qtk4y,t1_cn9p3s7,2,1425142955,0,0,cn9p933,Seattle,2,,flair,
"&gt; ""late 20s/early 30s, no kids, and i love food"" vibe.

Never been to Chicago, but your criteria sounds like Capitol Hill. People in their 20s and 30s for miles, plenty of food within walking distance (and places to drink for that matter), and I almost never see kids. It's just minutes from downtown.

Ballard is nice as well, but I love how alive and active the hill is even at later hours on weekdays.",false,true,t1_cj5xjup,what_a_cat_astrophe,Capitol Hill,0,1406155876,t5_2qhad,t3_2bi9yf,t3_2bi9yf,2,1434867018,0,0,cj5xjup,Seattle,2,,flair,
"I paired with Jbaab for doubles there at the end. We were unstoppable, until I was ready to go home and go to sleep!",false,true,t1_cf1m62z,mountainsntrees,,0,1390974720,t5_2qhad,t3_1vye8k,t1_cf1kvgp,2,1435513167,0,0,cf1m62z,Seattle,2,,,
Fernando?,false,true,t1_cey29lz,guru7892,,0,1390600527,t5_2qhad,t3_1w28sq,t3_1w28sq,2,1432092879,0,0,cey29lz,Seattle,2,,,
"Ladies and gentlemen I present to you: Oak Harbor, Washington. ",false,true,t1_cgmjv2n,LordLongSchlong,Pull And Be Damned,0,1396903187,t5_2qhad,t3_22geic,t3_22geic,3,1433252486,0,0,cgmjv2n,Seattle,3,,flair,
"The only valid reason to arrest prostitutes is to get them to ""flip"" on their pimps, in exchange for walking free. In any case, if we must arrest these women we should be doing something to get them into rehab or some kind of halfway house, because it'll be almost impossible to turn your life around being a prostitute AND an ex-con.",false,false,t1_cm64va4,comebackjoeyjojo,Kenmore,0,1416333603,t5_2qhad,t3_2mngrw,t1_cm63mvg,3,1425963935,0,0,cm64va4,Seattle,3,,flair,
"Ha, I had no idea there was a banana slug mascot there. I only lived there maybe 6 months. ",false,true,t1_ck8afrz,[deleted],,0,1409774071,t5_2qhad,t3_2fd5f3,t1_ck8a9ki,3,1427212689,0,0,ck8afrz,Seattle,3,,,
