body,score_hidden,archived,name,author,author_flair_text,downs,created_utc,subreddit_id,link_id,parent_id,score,retrieved_on,controversiality,gilded,id,subreddit,ups,distinguished,author_flair_css_class,removal_reason
"Sounds like some hocus but if it's true then as a student who is a commuter, I expect to take a significant hit on my budget.",false,true,t1_chhvj1w,Zikro,,0,1400088085,t5_2qhad,t3_25jrbp,t3_25jrbp,1,1435493774,0,0,chhvj1w,Seattle,1,,,
"Not in Capitol Hill, but George and the Dragon in Fremont might be showing the games.",false,true,t1_cheonu4,honvales1989,,0,1399755967,t5_2qhad,t3_2588sz,t3_2588sz,1,1433739593,0,0,cheonu4,Seattle,1,,,
[deleted],false,false,t1_cm71pee,[deleted],,0,1416414075,t5_2qhad,t3_2mr25q,t3_2mr25q,1,1425947994,0,0,cm71pee,Seattle,1,,,
"I've been visiting from out of town this week, and the buses here are pretty reliable! Transit and Google Maps are the apps I've been using for knowing which buses to catch. 

Lyft is also a good service. It's an app for your phone that pinpoints your GPS coordinates and sends a sort of taxi to you (because apparently the normal cabs here are horrible). I've only used it twice late at night when I don't want to grab the bus but it's pretty convenient. I guess Uber is the competing service as well. ",false,true,t1_cjvyjve,[deleted],,0,1408572819,t5_2qhad,t3_2dv38u,t3_2dv38u,1,1435348118,0,0,cjvyjve,Seattle,1,,,
"here have a blast from the past
https://www.youtube.com/watch?v=YVgvwh1WVxk",false,false,t1_cn28yvy,diablofreak,Cascade,0,1419262455,t5_2qhad,t3_2q1py2,t3_2q1py2,1,1425272135,0,0,cn28yvy,Seattle,1,,flair,
"Some spots you could check out, mostly Capitol Hill-based for your convenience: Sun Liquor, Analog Coffee, Smith, Wandering Goose, Montana, Arabica Lounge, Paseo (after their January holiday break, just go ahead and mark your calendar now for Feb 1).",false,true,t1_cep66iy,dbalatero,,0,1389689715,t5_2qhad,t3_1v0lyl,t3_1v0lyl,1,1431935499,0,0,cep66iy,Seattle,1,,,
I was expecting a couple of solid white vertical lines.  But this works too.,false,true,t1_cfaqb4g,skilas,,0,1391924136,t5_2qhad,t3_1xdhh8,t3_1xdhh8,1,1432317759,0,0,cfaqb4g,Seattle,1,,,
As if trying to go north from W Seattle wasn't shitty enough.,false,true,t1_ci1i30f,[deleted],,0,1402154482,t5_2qhad,t3_27ik5l,t3_27ik5l,1,1434134138,0,0,ci1i30f,Seattle,1,,,
"I hope you left at 1. ",false,true,t1_cj52m6s,MrWright,North Queen Anne,0,1406080794,t5_2qhad,t3_2bfr7y,t1_cj4wnpo,1,1435466144,0,0,cj52m6s,Seattle,1,,flair,
"I was a communicative disorders major in California and my favorite professor also worked at the high schools in the area and was Coleman's speech pathologist as he was growing up. I had her classes back when he was at UCLA but she would always tell us how they still talk and he would go back to the schools once or twice a year to talk to the kids who were hard of hearing. 
One boy in particular was a big fan and also really struggling with wearing his hearing aid in class. She set up a dinner with herself, the kid and his mom, and Coleman and he talked to him about being comfortable with his hearing impairment was and being able to do anything he wanted. She showed us a picture of this little kid and Coleman together holding up a football he signed and his smile was unforgettable. She was telling us how that dinner made a night and day difference in how that boy did. I think it is great that he is going to the Super Bowl, such an inspiration for the kiddos who are deaf/hard of hearing. ",false,true,t1_cex34k2,littlegnomie,,0,1390508089,t5_2qhad,t3_1vwbt2,t3_1vwbt2,1,1435520516,0,0,cex34k2,Seattle,1,,,
The point is that it shouldn't be a legal minefield to own/buy/sell guns. It shouldn't be a concern that you may commit an accidental felony without harming anyone in your own kitchen. Whats the point of laws if you're going to just make everyone a criminal? Why not just be honest and admit the goal is to prohibit guns for the common class entirely?,false,false,t1_cm0mslh,ampersand20,,0,1415820513,t5_2qhad,t3_2ld0k8,t1_cm08hjx,1,1426058727,0,0,cm0mslh,Seattle,1,,,
Worst title ever.,false,true,t1_ceys0ub,fivefourtwo,,0,1390686142,t5_2qhad,t3_1w2irn,t3_1w2irn,1,1432105613,0,0,ceys0ub,Seattle,1,,,
"The ""social contract"" actually includes following all the laws. If you don't like not being allowed to set off fireworks maybe you should move to the damn middle of nowhere where nobody gives a shit.",false,true,t1_cef6evj,jacalata,Capitol Hill,0,1388630666,t5_2qhad,t3_1u53ih,t1_ceex0ev,1,1427896678,0,0,cef6evj,Seattle,1,,flair,
I shall be joining indeedly dee. :),false,true,t1_ch4moxa,dman24752,South Beacon Hill,0,1398732957,t5_2qhad,t3_242u5g,t1_ch4kzxb,1,1433565744,0,0,ch4moxa,Seattle,1,,flair,
Should be arrested for the hat on its own,false,false,t1_cluczd4,-H__H-,,0,1415244093,t5_2qhad,t3_2lfa68,t1_cluaaif,1,1426168533,0,0,cluczd4,Seattle,1,,,
Its looking like it.,false,true,t1_cgxjx9d,Phoenix_Ember,,0,1398026948,t5_2qhad,t3_238jgi,t1_cgvex0u,1,1433443555,0,0,cgxjx9d,Seattle,1,,,
"And that proves that my reading comprehension has dropped to zero today.  You're right, my mistake.",false,false,t1_clcn4mc,somenewuser,The CD,0,1413601232,t5_2qhad,t3_2jklkn,t1_clcn0bt,1,1426473096,0,0,clcn4mc,Seattle,1,,flair,
"Jackson and Occidental ave here: Still have power, which is a shame. I'd love to leave work because no electricity.",false,false,t1_cm2n5y2,Dudist_PvP,,0,1415996806,t5_2qhad,t3_2mb6mz,t3_2mb6mz,1,1426024045,0,0,cm2n5y2,Seattle,1,,,
How so? Its a county job right?,false,true,t1_cj14qt2,unalienable1776,Matthews Beach,0,1405709006,t5_2qhad,t3_2awowi,t1_cj11ms3,1,1434780938,0,0,cj14qt2,Seattle,1,,flair,
It's so amazing that these days people can just press a couple of buttons and somehow beautiful noises magically come out of the speakers! That's all it takes!,false,true,t1_cj6yioo,what_a_cat_astrophe,Capitol Hill,0,1406244947,t5_2qhad,t3_2blvzp,t1_cj6yfmy,1,1434884796,0,0,cj6yioo,Seattle,1,,flair,
"This is looking quite a ways out, yes. This is for after the university extension (almost finished), the Northgate extension (just getting started) and the Bellevue/Redmond extension (funded but not started). Unfortunately it all just takes a really long time, so we need to be getting plans ready now if we're going to have continuous expansion through the next decade.",false,true,t1_chg2vop,iotatron,Northgate,0,1399915250,t5_2qhad,t3_258hkx,t1_cheq64n,1,1433763658,0,0,chg2vop,Seattle,1,,flair,
They stopped doing that for me after the first couple years.,false,true,t1_cix88ml,n0exit,West Woodland,0,1405360574,t5_2qhad,t3_2amec4,t1_ciwt8ht,1,1434711552,0,0,cix88ml,Seattle,1,,flair,
You must live extremely close to a Central Office (less than 1 cable length mile).  Your speeds aren't typical for DSL.,false,true,t1_cfgxl10,AGlassOfMilk,Yesler Terrace,0,1392585225,t5_2qhad,t3_1y02xw,t1_cfgtkkk,1,1432425247,0,0,cfgxl10,Seattle,1,,flair,
"Both are good as well. I prefer Tippe to The Oak, though.",false,true,t1_cg8c5j2,derekpetey_,Capitol Hill,0,1395417938,t5_2qhad,t3_20y2nn,t1_cg8ag0s,1,1433006629,0,0,cg8c5j2,Seattle,1,,flair,
"Chicago transplants should have a pizza meet-up!!! ",false,true,t1_cfkkd3d,chicagogal28,,0,1392940093,t5_2qhad,t3_1ygkpi,t3_1ygkpi,1,1432488082,0,0,cfkkd3d,Seattle,1,,,
"Indeed.  ""Interesting"" was something the OP mentioned so it fits the bill.  

",false,false,t1_clphiif,zoeyversustheraccoon,West Seattle,0,1414787964,t5_2qhad,t3_2kwcqt,t1_clpg1du,1,1426251785,0,0,clphiif,Seattle,1,,flair,
"Ask yourself, how would you feel if that was your head? It's not like it was a person's hand it was their goddamn head! If anything it should be attempted murder as it is not much different than a curb stomp...

I'm tiring of Seattle's police and their continued misconduct. ",false,true,t1_chyj0mz,P0x26A,,0,1401842687,t5_2qhad,t3_277u5h,t3_277u5h,1,1434082811,0,0,chyj0mz,Seattle,1,,,
"Good point, I guess I just assumed dark when I read ""evening"".",false,true,t1_ci2kw2l,roggz,Ballard,0,1402274906,t5_2qhad,t3_27ncet,t1_ci2kpe4,1,1434152757,0,0,ci2kw2l,Seattle,1,,flair,
"I like my roads the way they are, thanks",false,true,t1_cgnvoi7,[deleted],,0,1397022774,t5_2qhad,t3_22i7bp,t1_cgntg3d,1,1433275423,0,0,cgnvoi7,Seattle,1,,,
"I would take them off your hands. My friend uses them for online business. ",false,false,t1_cl30den,jmoney927,,0,1412705160,t5_2qhad,t3_2igws6,t3_2igws6,1,1426640204,0,0,cl30den,Seattle,1,,,
Is this a play on the fact that creamer is 12% milk fat or am I reading too far into it?,false,false,t1_clcpfft,Sic_Em,,0,1413607970,t5_2qhad,t3_2jj7vb,t1_clciy39,1,1426472021,0,0,clcpfft,Seattle,1,,,
That's it? That's all you have to defend your point with?,false,false,t1_clzdlx8,thejkm,,0,1415715515,t5_2qhad,t3_2lvv8x,t1_clzcirv,1,1426080178,0,0,clzdlx8,Seattle,1,,,
"And fractals! That Mandelbrot set!

",false,true,t1_cjzp9im,Problem119V-0800,Lower Queen Anne,0,1408939699,t5_2qhad,t3_2edvw1,t1_cjyj1do,1,1427372110,0,0,cjzp9im,Seattle,1,,flair,
Why is it good that we have a judiciary interfering in legislative matters?  We have separate powers for a reason.,false,true,t1_ckgiuac,jefftickels,,0,1410548611,t5_2qhad,t3_2g4bh4,t1_ckfsu9v,1,1427047091,0,0,ckgiuac,Seattle,1,,,
"The closest thing I could find was cryptic on but that already happened. Its really strange that there is absolutely nothing about this out there. ",false,true,t1_ckhteyg,Dognutz1,Marine Area 7,0,1410678878,t5_2qhad,t3_2gc7dg,t3_2gc7dg,1,1427020814,0,0,ckhteyg,Seattle,1,,flair,
"No you will still have the stigma regardless of behavior, you wont be hated as much, likely you will be merely tolerated and unlikely to get special service. 

If you are a regular who is polite and tips well you will likely receive little bonuses like stiffer drinks, perhaps free drinks that were wrong orders, comped appetizers, free pitcher when the keg blows ect. Basically you become a ""total bro"" instead of just being ""some dude"" or worse ""that asshole.""

I didn't write the rules but that tends to be how things go. ",false,false,t1_cl0mj99,hamburger666,Rat City,0,1412470561,t5_2qhad,t3_2iak4j,t1_cl0me6y,1,1426681090,0,0,cl0mj99,Seattle,1,,flair,
"I don't really understand why people buy two door cars, personally.",false,true,t1_cg3hgf4,roflautogyro,Queen Anne,0,1394919432,t5_2qhad,t3_20g533,t1_cg32y5w,1,1432815507,0,0,cg3hgf4,Seattle,1,,flair,
"law enforcement is not a typical profession for valedictorians. 

TL;DR: Cops not so smart. ",false,false,t1_cm8uv3m,ChippyMalone,,0,1416567383,t5_2qhad,t3_2mxs9p,t1_cm8lexe,1,1425913504,0,0,cm8uv3m,Seattle,1,,,
Tsukushinbo or Shiros,false,true,t1_cfoi4wt,Imperator215,,0,1393356636,t5_2qhad,t3_1ywjgy,t3_1ywjgy,1,1432556059,0,0,cfoi4wt,Seattle,1,,,
"I hadn't seen that Bowman video. What a dick. Golly, after Sunday's game I thought cheap-ass, unsportsmanlike behavior was the sole province of Richard Sherman. /s",false,true,t1_cev38ms,GEN_CORNPONE,Queen Anne,0,1390317830,t5_2qhad,t3_1vqk09,t1_cev1n74,1,1432038633,0,0,cev38ms,Seattle,1,,flair,
"I've listened to all the stated shows &amp; consistently I return to Todd n Tyler Radio Empire. They are a syndicated
show out of Omaha. I have their app &amp; they're on Tune-in radio. BJ Shea/The Men's Room  is similar, TnT is better in my opinion. ",false,true,t1_cgu1q83,allass_noboobies,,0,1397668902,t5_2qhad,t3_236rgx,t3_236rgx,1,1433382887,0,0,cgu1q83,Seattle,1,,,
[deleted],false,false,t1_cl3tiue,[deleted],,0,1412781977,t5_2qhad,t3_2ik7fq,t1_cl3rgv5,1,1426626311,0,0,cl3tiue,Seattle,1,,,
I like the $$$$$ signs on Mt. Baker. Right on..,false,true,t1_chn9bs6,likeomglolwtfun,,0,1400645605,t5_2qhad,t3_260dyk,t3_260dyk,1,1433888006,0,0,chn9bs6,Seattle,1,,,
"Naw, he probably would have done the same for a fat chick. He pracitically admitted attempting to stalk her. ",false,true,t1_cf7gri3,CB_WizDumb,,0,1391581164,t5_2qhad,t3_1x0x28,t1_cf7caoh,1,1432259373,0,0,cf7gri3,Seattle,1,,,
"Pretty close to where I live so it might be the same people that did mine. Luckily for me my insurance covered the replacement of my items which were stolen. In any case until the battery was active my devices I was able to track them to the following areas: http://goo.gl/maps/JD4VY (note there is a pawhop nearby). From there my items split up. Some where in a pioneer square at a pawnshop called Barney's Jewlrey and the others at someone's house near: http://goo.gl/maps/6rIrf

Fortunately since they were electronics I was able to lock them so they can't be used again and since the laptops had full disk encryption - pretty much the only thing of any value they took was 3$ in coin. 

Hope you get your stuff back some way. ",false,true,t1_cijgd9d,lvlolvlo,,0,1403979829,t5_2qhad,t3_2991x0,t3_2991x0,1,1434446721,0,0,cijgd9d,Seattle,1,,,
"This submission has been automatically removed, because your account is brand new.  This is intended to remove spam and troll posts.  However, accidents can and do happen, so if you feel this removal was in error please don't hesitate to [message the mods](http://www.reddit.com/message/compose?to=%2Fr%2FSeattle&amp;subject=Please+reapprove+my+post) so that we can evaluate your post and re-approve it if appropriate.  We appreciate you taking a moment to help us improve our automated moderation systems.

For reference, here is a link to more information on [reddiquette](http://www.reddit.com/wiki/reddiquette) - please review this and the rules posted on the sidebar of /r/Seattle and reproduced below:

1. **Be good**: We aim to make the Seattle reddit a friendly place for everyone, so treat your fellow humans with respect.  Specifically: **no verbal attacks**, and **no hate speech**. Violators will be warned.  Warned violators will be banned.
2. Follow [reddiquette](/help/reddiquette).
3. Don't spam: [SEO](http://en.wikipedia.org/wiki/Search_engine_optimization) and spam posts will be removed.
4. Please post classified ads in [/r/SeaList](/r/SeaList/) and job offerings in [/r/SeaJobs](/r/SeaJobs).
5. Please do your due diligence before posting questions to the community: Search Google and our FAQs (see below) first and tell us what you have found in your post.
6. We're a community, not a bulletin board or marketplace. You may not use us to increase the popularity, profit, or market presence of a personal project.  [Advertising info for /r/Seattle](http://www.reddit.com/ad_inq/).


*[I am a bot](/r/AutoModerator/comments/q11pu/what_is_automoderator/), and this action was performed automatically. Please [contact the moderators of this subreddit](/message/compose?to=%2Fr%2FSeattle) if you have any questions or concerns.*",false,false,t1_ckz3o7d,AutoModerator,,0,1412310030,t5_2qhad,t3_2i5sm6,t3_2i5sm6,1,1426707308,0,0,ckz3o7d,Seattle,1,moderator,,
It's your mom.,false,false,t1_cl3sjbs,dabockster,Moving to Seattle Soon,0,1412780023,t5_2qhad,t3_2igp9b,t1_cl2nl14,1,1426626770,0,0,cl3sjbs,Seattle,1,,flair,
The Cherry Blossom right outside my apartment window just bloomed on Wednesday and Thursday :),false,true,t1_cfytvpp,[deleted],,0,1394436296,t5_2qhad,t3_1zzcwm,t3_1zzcwm,1,1432734893,0,0,cfytvpp,Seattle,1,,,
"This submission has been automatically removed, because your account is brand new.  This is intended to remove spam and troll posts.  However, accidents can and do happen, so if you feel this removal was in error please don't hesitate to [message the mods](http://www.reddit.com/message/compose?to=%2Fr%2FSeattle&amp;subject=Please+reapprove+my+post) so that we can evaluate your post and re-approve it if appropriate.  We appreciate you taking a moment to help us improve our automated moderation systems.

For reference, here is a link to more information on [reddiquette](http://www.reddit.com/wiki/reddiquette) - please review this and the rules posted on the sidebar of /r/Seattle and reproduced below:

1. **Be good**: We aim to make the Seattle reddit a friendly place for everyone, so treat your fellow humans with respect.  Specifically: **no verbal attacks**, and **no hate speech**. Violators will be warned.  Warned violators will be banned.
2. Follow [reddiquette](/help/reddiquette).
3. Don't spam: [SEO](http://en.wikipedia.org/wiki/Search_engine_optimization) and spam posts will be removed.
4. Please post classified ads in [/r/SeaList](/r/SeaList/) and job offerings in [/r/SeaJobs](/r/SeaJobs).
5. Please do your due diligence before posting questions to the community: Search Google and our FAQs (see below) first and tell us what you have found in your post.
6. We're a community, not a bulletin board or marketplace. You may not use us to increase the popularity, profit, or market presence of a personal project.  [Advertising info for /r/Seattle](http://www.reddit.com/ad_inq/).


*[I am a bot](/r/AutoModerator/comments/q11pu/what_is_automoderator/), and this action was performed automatically. Please [contact the moderators of this subreddit](/message/compose?to=%2Fr%2FSeattle) if you have any questions or concerns.*",false,false,t1_cmp33z6,AutoModerator,,0,1418074148,t5_2qhad,t3_2oop9p,t3_2oop9p,1,1425536656,0,0,cmp33z6,Seattle,1,moderator,,
"If you don't know. Matt Groening grew up in the Portland area. Northwest ideas, news and structures went into The Simpsons.",false,true,t1_cil7ys7,LegacyZXT,Tacoma,0,1404167713,t5_2qhad,t3_29g126,t1_cikxcyx,1,1435485347,0,0,cil7ys7,Seattle,1,,flair,
So cool. I've been up there twice. As someone who doesn't have the luxury of great views from their work I thought it was awesome.,false,true,t1_cii40y7,JeffSanford,Ravenna,0,1403831436,t5_2qhad,t3_28vlox,t1_cii3w5v,1,1434421934,0,0,cii40y7,Seattle,1,,flair,
Thanks to @tb0ne this is now a thing: http://www.reddit.com/r/seattlehomebrewers/,false,true,t1_cjjrsao,JLHawkins,Lake City,0,1407438722,t5_2qhad,t3_2cw43a,t1_cjjowbe,1,1435123638,0,0,cjjrsao,Seattle,1,,flair,
"Again, you're still missing the point.  I never said that drivers shouldn't pay for the full cost of roads, so when you say I'm asking for a double standard, you're just not reading...

The argument that others benefit as well can apply to anything.  Because the work I do makes my company money, and my company pays employees other than me, then all the employees of my company benefit from the fact that I haven't starved to death, so can I reasonably expect my coworkers to foot part of my grocery bill?",false,true,t1_ch07i0y,juiceboxzero,Bothell,0,1398285249,t5_2qhad,t3_23qlvs,t1_cgzzro3,1,1433489397,0,0,ch07i0y,Seattle,1,,flair,
emmm... pumpkin fried rice and an american dream roll. /drool,false,false,t1_cm3xeov,NickRebootPlz,,0,1416126601,t5_2qhad,t3_2mcji6,t1_cm34bi0,1,1426001717,0,0,cm3xeov,Seattle,1,,,
This seems fun.,false,true,t1_cirbwgi,CosmicConn,,0,1404794080,t5_2qhad,t3_2a2m26,t1_cir4vsg,1,1434604378,0,0,cirbwgi,Seattle,1,,,
They mention it to show that its not just hippy Luddites who send there kids there.,false,true,t1_ckm9jrj,theprinceoftrajan,,0,1411082991,t5_2qhad,t3_2grezy,t1_ckm0dls,2,1426935859,0,0,ckm9jrj,Seattle,2,,,
"Google Maps lets you look ahead to see what it will be like at certain times. Just plot the route and then pick the link that says ""More options and times""",false,false,t1_cmrn1as,Klaxon5,Belltown,0,1418284118,t5_2qhad,t3_2otsxg,t1_cmqij9p,2,1425489695,0,0,cmrn1as,Seattle,2,,flair,
"Yancy was a regular at the restaurant where I worked. It was a real tragedy what happened to him, and I'm glad they got this monster convicted.",false,false,t1_cmsneo6,c1rcle0ne,Rainier Beach,0,1418369157,t5_2qhad,t3_2p0vje,t3_2p0vje,2,1425472373,0,0,cmsneo6,Seattle,2,,flair,
"+1, entertaining, would vote into the White House again.

/s",false,false,t1_cm96tzc,ihminen,,0,1416597478,t5_2qhad,t3_2mzw92,t1_cm94ifq,2,1425907848,0,0,cm96tzc,Seattle,2,,,
I've never heard of it either. I guess if the school burns down he's to blame.,false,false,t1_clmyiqy,snorlax23,Edmonds,0,1414560861,t5_2qhad,t3_2knb5y,t1_clmygfw,2,1426295748,0,0,clmyiqy,Seattle,2,,flair,
"Hi friend, 
just letting you know you're a good person and you did a great job. Good luck!",false,true,t1_cjdk41k,perestroika12,,0,1406855161,t5_2qhad,t3_2c8o3f,t1_cjdcj2d,2,1435008255,0,0,cjdk41k,Seattle,2,,,
"just because it's possible to be addicted to it doesn't make it a drug.  It's a carbohydrate and an excellent dietary energy source, and it makes sense that the brain would want to reward you for having it.  Is your definition of a drug anything that triggers a pleasure response?",false,false,t1_clrxtf6,nefffffffffff,Lower Queen Anne,0,1415043220,t5_2qhad,t3_2l2zzg,t1_clrwsvs,2,1426210027,0,0,clrxtf6,Seattle,2,,flair,
"Well, compared to your current place, even a popular, more expensive area like Capitol Hill or Queen Anne could be pretty affordable. If you want to have restaurants/bars/anything to do within walking distance, don't move to Lynnwood. If you are a homebody who doesn't mind the mall being the high point of entertainment that doesn't involve at least 30 min. of driving, Lynnwood will be significantly cheaper. You could consider the north Seattle neighborhoods like Greenlake, Greenwood, or Northgate if you're looking for something more residential (with abundant parking) but still within reach of human activity. Again, at your current price point, these areas should all be affordable.",false,true,t1_cf2bv5o,zangelbertbingledack,North Beacon Hill,0,1391046804,t5_2qhad,t3_1wihlo,t3_1wihlo,2,1432168177,0,0,cf2bv5o,Seattle,2,,flair,
"No, she was elected because Colin wasn't doing his job. Also Sawant was open to her anti-capitalist &amp; Marxist ideals since the start of the campaign. The people knew she was a Socialist and knew she was going to vote as an Socialist. They still voted her in. 


",false,true,t1_cj363jz,Bab5crusade,Skagit,0,1405919035,t5_2qhad,t3_2avrdw,t1_cj331nr,2,1434816733,0,0,cj363jz,Seattle,2,,flair,
[deleted],false,true,t1_cjmr2v8,[deleted],,0,1407725377,t5_2qhad,t3_2d6irw,t1_cjmoqfq,2,1435175773,0,0,cjmr2v8,Seattle,2,,,
"Society does not tell people they need a house, and if you buy a house because you think other people are telling you it's something you need, then you're probably not making very wise decisions to start with.  However, buying a house is a great way to keep the money you're paying for housing, instead of paying someone else's mortgage for them.

I purchased a house because over the past few years, if you have the money for a down payment, it's cheaper than renting and the money I'm spending on it is staying in my possession.  

I sold my car, and a whole mess of other items just to come up with the money to buy this place.   We bought it at the absolute right time... bottom of the lowest prices of the crash, and super low interest rate (3.65%). The property values in my neighborhood are going up at a rate of 5%-20% a year.  Since I've lived here my property value has gone up over $100K and I've only made $72K in payments on it.  Paying the mortgage is basically like putting money in a savings account with high interest.

And it's not like it takes a lot of money to get started... one of my friends bought a beat up place in Othello for like $140K.. his mortgage payment is super low.. he fixed the place up with little more than sweat equity, paint, and second hand appliances, and it's worth about twice what he paid for it now.


",false,true,t1_ck9z184,El_Nopal,Leschi,0,1409932501,t5_2qhad,t3_2fi0nl,t1_ck9ydtt,2,1427183266,0,0,ck9z184,Seattle,2,,flair,
"""Some men just want to watch the world burn"".  And get paid huge sums for setting a match to it.",false,true,t1_ck34fuc,bws2a,,0,1409257621,t5_2qhad,t3_2etipf,t3_2etipf,2,1427309398,0,0,ck34fuc,Seattle,2,,,
"The study is probably aware of tons of this stuff, the article probably is a terrible summary.",false,true,t1_ck1lgqd,tmonburns,,0,1409113827,t5_2qhad,t3_2entj6,t1_ck1afff,2,1427339635,0,0,ck1lgqd,Seattle,2,,,
"Traditional cable television is dying.  Streaming video is the future and people are already embracing it.  I downgraded my Premium Plus Comcast package to Basic and have pretty much exclusively watched content via my little Roku device.   Netflix, Amazon Prime, NBA League Pass, Hulu Plus... there's rarely any reason to watch Comcast cable anymore.  And I always find their system extremely slow and painful to navigate.  Finding a movie through their obsolete ""On Demand"" system is just awful when compared to the ease-of-use of something like Netflix.  

Alas, none of that is possible without high speed internet... and that's where Comcast has me by the balls.  Once they fully succeed in their monopoly, they can begin enforcing their data cap and suddenly I'll be drowning in overage fees.  SO really there doesn't need to be a cable competitor.  We just need another option for high speed internet.   The gigabit internet thing sounded promising, because it was faster, didn't have data caps and was reasonably priced.   

If you look at how we are consuming media... it's completely going towards streaming video.  You don't need a cable box anymore.  We can access these apps on our iOS device, android, playstation, xbox, wii, roku, smart tv, apple tv, chromecast, laptop, pc, etc...   I've been saying for a while that two things could bring Comcast to it's knees.  #1 - If HBO starts allowing you to pay for HBO GO without a cable subscription.  #2 - If we had a high speed internet alternative.    If both of those things were to happen, I think Comcast/Time Warner would begin to die without innovation. ",false,true,t1_cferl2n,nedyken,,0,1392336551,t5_2qhad,t3_1xtsjb,t1_cfeoih8,2,1432387761,0,0,cferl2n,Seattle,2,,,
Why does option C2 have so much more ridership than option C2a? Seems weird.,false,true,t1_ci6xrnn,themandotcom,Pike Market,0,1402697168,t5_2qhad,t3_2831ve,t3_2831ve,2,1434228302,0,0,ci6xrnn,Seattle,2,,flair,
"Totally would consider that. But It is about a 4 mile walk back to my place from aurora village. ",false,false,t1_cnaq3c7,slicecrispy,,0,1420065720,t5_2qhad,t3_2qy1t0,t1_cnanlxv,2,1425125359,0,0,cnaq3c7,Seattle,2,,,
