body,score_hidden,archived,name,author,author_flair_text,downs,created_utc,subreddit_id,link_id,parent_id,score,retrieved_on,controversiality,gilded,id,subreddit,ups,distinguished,author_flair_css_class
"The storm existed, it was whether it would make it to us or not. He gave it a 1/3 chance. Maybe you shouldn't join in on the hype and actually read his blog posts and understand that no one can say anything weather related with certainty. I'm sure you've noticed this if you have paid the slightest bit of attention to weather your entire life...",,,,noffles,,,1480704767,t5_2qhad,t3_5g437j,t1_dapfzps,10,1483423365,0,0,daphxdd,Seattle,,,
"Probably Seattle, but that's a pretty wild guess, don't know where I got that from.

But yeah, I live in the Seattle area too and have never seen an apartment for rent that was pre-furnished. Appliances sure, but no furniture.",,,,Tasgall,Redmond,,1481023216,t5_2qhad,t3_5gq18l,t1_daun51k,12,1483515575,0,0,dauo9g4,Seattle,,,flair
Getting half-way to somewhere and finding out you can't get the rest of the way is definitely worse than not knowing to take an alternate mode of travel in the first place.,,,,BeastOGevaudan,,,1482229099,t5_2qhad,t3_5ja3o6,t1_dbewh6s,13,1483908186,0,0,dbf2gmb,Seattle,,,
Also worth noting is that Google is building a similarly sized office just a few blocks to the north.,,,,l30,,,1480740910,t5_2qhad,t3_5g5w91,t1_daq3ix4,37,1483436031,0,0,daq6ygu,Seattle,,,
"Not if you want to spend $2k for a 1br, there are hundreds of available units.",,,,barf_the_mog,Ballard,,1483124782,t5_2qhad,t3_5l4hrx,t1_dbsuoms,27,1484156725,0,0,dbsz3ks,Seattle,,,flair
"As far as I can tell it included even citizens, even when asked to clarify. The precident they cited was Japanese internment during WWII, which mostly included Japanese-American citizens and their American born children. They forget that the internment was later found illegal, and Ronald Reagan paid reparations to the remaining victims in the 80s.",,,,thatsmycheesemonster,,,1481816587,t5_2qhad,t3_5if7xd,t1_db89niu,11,1483786304,0,0,db8am9e,Seattle,,,
It's usually not as bad on weekday evenings. And it's half price from 4-6.,,,,aklbos,,,1482473312,t5_2qhad,t3_5jv140,t1_dbjblzo,17,1483983862,0,0,dbjbw6u,Seattle,,,
Pike's Place.,,,,gotly,,,1482003179,t5_2qhad,t3_5iusrp,t1_dbb5edg,16,1483842362,0,0,dbbdrk1,Seattle,,,
Maybe it was an open ended invitation to come play Sorry? It's probably been quite a while since most people here have played a board game.,,,,NicCage420,,,1482326801,t5_2qhad,t3_5jimfn,t1_dbgih5b,10,1483936579,0,0,dbgo2c2,Seattle,,,
"I live near here as well. I am constantly harassed when I walk near there, especially at night. My car as well as my roommates' and neighbors are constantly broken in to as well. I am woken up in the dead of night to literal screaming as well as yelling/arguments on a more regular basis than I would appreciate.",,,,socialstatus,,,1480967741,t5_2qhad,t3_5gmr4r,t1_datlwcp,10,1483498712,0,0,datpqhw,Seattle,,,
"Tis the season for package thieves. They know it so it is going to spike.  I would try to have your packages sent to your office/friends/family/drop box that might be able to receive them.  

Nothing is to small to report.  If you only have time to fill out an online form, do it.  Detectives use this information to track down victims and identify trends.

I have recovered several stolen packages/ids/credit card and had a hard time reaching the victim because it wasn't reported. ",,,,Seattle_PD,Seattle Police Dept.,,1481664594,t5_2qhad,t3_5i5jry,t1_db5ktuy,10,1483740722,0,0,db5pj73,Seattle,,,flair verified
I would rather shit in my kitchen than have 5 roommates.,,,,akhalilx,Belltown,,1481008340,t5_2qhad,t3_5gq18l,t1_dauh7jg,212,1483513150,0,0,dauja5r,Seattle,,,flair
"Looks like a portable watchtower to help protect mall shoppers from car burglars or other theft crimes  ",,,,biguglydoofus,,,1480572400,t5_2qhad,t3_5fuxfm,t3_5fuxfm,26,1483383628,0,0,dan9qwg,Seattle,,,
"Yep, best fire starter tinder in an emergency EDC, ever. Couple of those in a little zip lock will stay good for years.",,,,GALACTICA-Actual,,,1482330604,t5_2qhad,t3_5jimfn,t1_dbgpkf3,64,1483937672,0,0,dbgq96n,Seattle,,,
[Reference xkcd](http://xkcd.com/1400),,,,blitzkraft,,,1482336763,t5_2qhad,t3_5jimfn,t1_dbgshhl,32,1483939939,0,0,dbgutrz,Seattle,,,
"Uhhh you're insane. 

Unless it fell into strange fluids, why would the blanket be contaminated? 

Also have you never flown before? You expected to carry your baby, blanket and all, and all his stuff though the scanner yourself so it would never have to touch anything? ",,,,megoprune,,,1482344254,t5_2qhad,t3_5jimfn,t1_dbh0y2o,23,1483943013,0,0,dbh10uk,Seattle,,,
"As someone who doesn't live in Seattle, but in a different city in the US that is super populated. I wish we had new tunnels in the works. :'(",,,,Dragonair476,,,1481695791,t5_2qhad,t3_5i8s8s,t3_5i8s8s,13,1483751732,0,0,db6c8tu,Seattle,,,
"It boggles my mind how smart people fall for this simple trick after being deployed for several decades by LEA. They keep fishing and reeling them in. LifeTip, if its illegal then there is a 99.9% chance it's a cop on the other end.",,,,nooshaw,,,1482865637,t5_2qhad,t3_5kiw3x,t3_5kiw3x,14,1484080344,0,0,dboqvec,Seattle,,,
"That averages to about 5480 jobs for each day he was in office, or roughly 4x the number of jobs 'saved' by Trump's Carrier deal **every** **single** **day**. ",,,,comfortable_in_chaos,Ballard,,1480985104,t5_2qhad,t3_5go5mr,t1_dau23d0,12,1483505655,0,0,dau3ztc,Seattle,,,flair
"UPS started in Seattle as a bike delivery service

https://en.wikipedia.org/wiki/United_Parcel_Service#Foundation

There is a park in Pioneer Square at the site.",,,,altoidaltoid,Meadowbrook,,1481238899,t5_2qhad,t3_5h9f57,t3_5h9f57,12,1483584391,0,0,daym5mb,Seattle,,,flair
Give us back our Sonics!,,,,[deleted],,,1480647617,t5_2qhad,t3_5g029p,t3_5g029p,22,1483406553,0,0,daokjd1,Seattle,,,
"$750 is the cheaper end for non-university housing. University housing is prioritized for under graduate students, so 3rd year and on wards its harder and harder to find housing.

In the U-district, housing within 7 to 10 blocks of the campus can EASILY reach $1,200 to $3,000 for a single room unit.",,,,TemptedTemplar,,,1481003073,t5_2qhad,t3_5gq18l,t1_dauf4f5,50,1483511907,0,0,daugpzd,Seattle,,,
"So your day is worse than theirs so they can't complain? That becomes a never ending wheel of someone else has it worse so why are you bitching approach to life. 

You losing your job is irrelevant to the information OP is expressing. Their post is relevant in that parents should be made aware that something common may cause them grief with TSA. If you have Vaseline on your child's blankets, they may be taken away. I hope that you can see that through your moment of frustration. ",,,,rotyag,,,1482324657,t5_2qhad,t3_5jimfn,t1_dbgmpbq,90,1483936093,0,0,dbgn1uy,Seattle,,,
Then perhaps you need to move to Kent or Auburn?,,,,ChristopherStefan,Maple Leaf,,1483005068,t5_2qhad,t3_5kvcow,t1_dbr0i2q,20,1484122267,0,0,dbr1fhn,Seattle,,,flair
That's some serious post-apocalyptic shit right there.,,,,Aqua_Rooster,,,1482079427,t5_2qhad,t3_5iztog,t3_5iztog,68,1483861385,0,0,dbcg4ka,Seattle,,,
"My mom owns her own small business and has about 12 employees she is going to have to fire at least 2 and raise prices for the food she sells. Just like any other business is going to have to do. So when prices raise the same amount as the minimum wage goes up you basically went no where in your economical growth and lost jobs in the process. ""$15 minimum wage isn't detrimental"" so all small business this rings true? No. Do you think business are just hoarding in cash in their ass and can pay their employees $3 more a hour out of no where? Cost on everyday goods are also going to go up. ",,,,JonToski98296,,,1483053895,t5_2qhad,t3_5ky66h,t1_dbru49b,14,1484137440,0,0,dbrw3yy,Seattle,,,
"Useless gestures against the loser of the election.   

Great job being the guardians of our elections.",,,,fckyourselfsarah,,,1482192128,t5_2qhad,t3_5j955k,t3_5j955k,11,1483897866,0,0,dbehmz2,Seattle,,,
Trying to catch an Uber at 12:15 a.m.,,,,solongmsft,,,1481899212,t5_2qhad,t3_5inhci,t3_5inhci,11,1483812434,0,0,db9q8g3,Seattle,,,
For tourists it's not any more expensive than Portland. Cost of living is definitely more expensive.,,,,wuddersup,,,1481077121,t5_2qhad,t3_5gx79w,t3_5gx79w,34,1483534575,0,0,davrj02,Seattle,,,
"Wow, what a negative set of comments.  I'm excited the tech sector continues to grow here.  I expect it will continue to grow to hit the shared talent pool.",,,,choseph,,,1480733682,t5_2qhad,t3_5g5w91,t3_5g5w91,67,1483433961,0,0,daq2tx7,Seattle,,,
"Says the people paying you. If employing someone costs more than the value they generate, it is unwise to employ them. That's why your pay is based on your work and not how much your rent is.",,,,chattytrout,,,1483048343,t5_2qhad,t3_5ky66h,t1_dbrr8x5,29,1484135370,0,0,dbrrzmw,Seattle,,,
You can legally buy and smoke pot.,,,,nooshaw,,,1481128230,t5_2qhad,t3_5gz7vw,t3_5gz7vw,11,1483547196,0,0,dawhj3d,Seattle,,,
"Our version of ""very cold"" differs from most of the rest of the country, it seems.",,,,alejo699,Capitol Hill,,1481819401,t5_2qhad,t3_5ii58r,t3_5ii58r,33,1483787409,0,0,db8cw1b,Seattle,,,flair
"That's.. .. Um an interesting thought you got there. So break the law is acceptable but toys for tots isn't good enough among other solutions? ",,,,PassedOutCucumber,,,1481823155,t5_2qhad,t3_5iimai,t1_db8ew32,20,1483788973,0,0,db8g2dr,Seattle,,,
Lol if it gets deep enough for you to need chains on a jeep I'll eat yellow snow,,,,MajorLazy,,,1480843958,t5_2qhad,t3_5gduzr,t1_darjvrs,18,1483462401,0,0,darnvwg,Seattle,,,
"Absolutely it's my first. And yes, I'm going to take every extra precaution with him. I shouldn't be judged for being overly mindful of his health and safety. Everyone has different approaches. This is ours. To minimize contact with any potential health hazards from public spaces. People piss on bathroom floors, walk all over it, and drags it with them. I'd rather not trust a floor that thousands of people step on and hope no one dragged anything with them that may get on a blanket unwrap him up in. I'm sorry if you believe that's too much but growing up in the healthcare industry I've become overly concerned of the transfer of contaminants. ",,,,Citrous_Oyster,,,1482345095,t5_2qhad,t3_5jimfn,t1_dbh14uw,-13,1483943353,0,0,dbh1qeg,Seattle,,,
"You're coming off as extremely entitled, paranoid, and nutty with this non-issue. Nothing even happened to you. You lost a small jar of petroleum jelly and you're threatening to call the news, posting shit in the internet about it, and you're giving it a crap ton of real estate. Nothing even happen. You were mildly inconvenienced. No one was even tried to you. 

Just because you have a baby doesn't make you above the rules or grant you special treatment. You still have to experience the annoying and frustrating airport just like everyone else. 

You do realize touching the door handles, airplane seats, waiting areas, and even your own luggage is filled with ""germs"". ",,,,Unic0rnusRex,,,1482348527,t5_2qhad,t3_5jimfn,t1_dbh1qeg,16,1483944788,0,0,dbh4lvq,Seattle,,,
While adding to it.,,,,fusionsofwonder,Bellevue,,1480891592,t5_2qhad,t3_5gc9b7,t1_dasffar,13,1483476077,0,0,dasfl0f,Seattle,,,flair
Fema death camps are what we need.,,,,Friendship1,,,1480655475,t5_2qhad,t3_5g0cvk,t1_daoh74m,-15,1483409439,0,0,daoqbwg,Seattle,,,
But DB Cooper is alive! He's actually the same person as Tommy Wiseau.,,,,slippin_squid,,,1482333779,t5_2qhad,t3_5jimfn,t1_dbgs6yw,57,1483938802,0,0,dbgshhl,Seattle,,,
What a hilarious way to delegitamize a real issue...,,,,hawtfabio,,,1481296128,t5_2qhad,t3_5hdyt7,t3_5hdyt7,-17,1483599199,0,0,dazgpbl,Seattle,,,
"It's important to remember that Strava has an extremely limited audience and excludes the vast majority of Americans who bicycle for practical reasons rather than for sport.  The average American bicycle commuter is a lower-income immigrant, not an upper-middle-class early-adopters.",,,,jmputnam,,,1482812881,t5_2qhad,t3_5khj0i,t3_5khj0i,11,1484067962,0,0,dbo1zyq,Seattle,,,
yeah I really don't understand that part. they have nothing to warm the baby with because the blankets were thrown around? do they still have the blankets or not?,,,,jbw976,,,1482331290,t5_2qhad,t3_5jimfn,t1_dbgper4,93,1483937911,0,0,dbgqpku,Seattle,,,
"Also FYI: babies aren't industrial machinery. They don't need baby oil or Vaseline. They don't need petroleum-based lubricants to function.

I raised 6 of them without it. Penaten and lanolin-based stuff works way better.

It's not an issue of the TSA as much as it's the 2016 version of humours and bloodletting. It serves no purpose.",,,,smacksaw,Seattle Expatriate,,1482342088,t5_2qhad,t3_5jimfn,t1_dbgjggv,17,1483942132,1,0,dbgz7r2,Seattle,,,flair
"I'm still waiting for that shit show of a storm that was going to happen last month that never happened... 
",,,,CokeRobot,,,1480722317,t5_2qhad,t3_5g437j,t1_dapmlr8,12,1483430384,0,0,dapvrx6,Seattle,,,
"No, sorry, that's incorrect.

http://www.navcen.uscg.gov/?pageName=Rule1415

If a vessel is crossing your bow from right to left it is your responsibility to stay out of the way.

Also, when a maritime accident occurs blame is usually assessed by a percentage. The ferry WILL take some of the blame in this case, even though the yacht skipper was being a dumbass.",,,,mmariner,,,1480984250,t5_2qhad,t3_5go4nt,t1_dau2j4k,-19,1483505355,1,0,dau3da9,Seattle,,,
"http://www.tenantsunion.org/en/programs/tenants-rights-hotline

Seattle has some pretty strict laws regarding tenants rights.
",,,,TravelKats,,,1482028531,t5_2qhad,t3_5ixzwa,t3_5ixzwa,25,1483850404,0,0,dbbtzvq,Seattle,,,
"Get an RV.  Park it in Ballard.  ",,,,JohnDanielsWhiskey,,,1482993620,t5_2qhad,t3_5kvcow,t3_5kvcow,16,1484120205,0,0,dbqxaz0,Seattle,,,
Part of the celebration is a parade through the 99 tunnel.,,,,driverightpassleft,,,1481512040,t5_2qhad,t3_5hr0bg,t1_db2z5do,10,1483661765,0,0,db313og,Seattle,,,
"&gt; Probably for the best.

Spoken like a true Reddit elitist.",,,,socksRnice35,,,1480758465,t5_2qhad,t3_5g5w91,t1_daq6v9h,16,1483439370,0,0,daqdlob,Seattle,,,
"I get 46.41 years... which would coincide with the start of the UNIX epoch - Midnight January 1st, 1970 GMT.  The app simply received '0' as the time of arrival.",,,,GoAheadMakeMySplay,,,1481743772,t5_2qhad,t3_5ic2oa,t3_5ic2oa,44,1483764766,0,0,db730px,Seattle,,,
"I dunno man, the bus driver might not approve of me reaching out for that doohickie you are talking about ",,,,18inchalloys,,,1481231859,t5_2qhad,t3_5h7xkp,t1_day6maa,14,1483581617,0,0,dayghde,Seattle,,,
That's nothing.  I heard that he may have actually voted for Trump!,,,,ThurstonHowell3rd,,,1480707491,t5_2qhad,t3_5g437j,t1_dapj6pg,-10,1483424578,0,0,dapk8xc,Seattle,,,
"&gt;The terrorists won.

I don't think the TSA protects us from much of anything. If anything, it's just a scheme to funnel taxpayer money to some political donors, but I digress.

I am sorry to hear about your situation and completely understand why you'd be frustrated. I wouldn't let blankets or anything else that's been on a conveyor belt near my grown-up child, let alone an infant.",,,,HeWhoStandsToPoo,,,1482309265,t5_2qhad,t3_5jimfn,t1_dbgg7u5,62,1483933527,0,0,dbghu22,Seattle,,,
What a useless reply! Hope you get rekt on the 520!,,,,jrswishthegoat,,,1481193633,t5_2qhad,t3_5h64ai,t1_daxpo7t,-17,1483568636,0,0,daxpp4s,Seattle,,,
"My goodness, the comments here are tantamount to waving hands in the air and fluttering around aghast. Just buy a damn screen from Amazon for $65 and put it around the toilet. ",,,,no_talent_ass_clown,Humptulips,,1481009050,t5_2qhad,t3_5gq18l,t1_daub42m,-10,1483513290,0,0,daujkn6,Seattle,,,flair
Can confirm: I've seen purple and that ain't purple.,,,,Dynamosaur,,,1483175895,t5_2qhad,t3_5l7c4x,t1_dbtsdh9,40,1484172290,0,0,dbturc6,Seattle,,,
"Idk just seems like an entitled person to me. Or someone with actual OCD maybe. ",,,,megoprune,,,1482341596,t5_2qhad,t3_5jimfn,t1_dbgy10z,25,1483941934,0,0,dbgyt4a,Seattle,,,
"Yup, kind of surprising it doesn't happen more often. Those can haulers get paid by the load, they cut all sorts of corners. They are dangerous!",,,,yourbadinfluence,,,1482263361,t5_2qhad,t3_5jef1p,t1_dbfjofp,15,1483919098,0,0,dbfokfw,Seattle,,,
"I have interviewed at Amazon for an SDE position and nothing even remotely like this happened. I strongly suspect you got conned or you are conning us.
It was a very standard procedure, a phone chat with HR about my experience, a few days later a tech-screen phone call with some collaborative coding (no computer take-over, camera, etc. whatsoever) on some simple problems, and then a very typical on-site interview.",,,,CPhyloGenesis,,,1481264609,t5_2qhad,t3_5hakza,t3_5hakza,15,1483592891,0,0,daz3q4i,Seattle,,,
You sound silly when you say supply doesn't help demand.  Tech workers move into fancy new apartments leaving their old apartments for new tenants.  If there's a glut of new residences available the price of existing will go down.  Sadly even with these coming online I don't think we will have enough available residences to meet the continuing demand.,,,,Planet_Iscandar,,,1483219098,t5_2qhad,t3_5l4hrx,t1_dbug9w4,11,1484182863,0,0,dbugg7p,Seattle,,,
"Did you take [road conditions](http://www.wsdot.com/traffic/passes/stevens/) into account on your ETA?

It's actively snowing and ""traction tires required"" from wsdot is usually not a joke.",,,,cyanicenine,,,1482542456,t5_2qhad,t3_5k0jsk,t3_5k0jsk,12,1484002739,0,0,dbke2jr,Seattle,,,
"The drivers are just trying to feed their family and many do a decent job but as they try to make ends meet it's easy to cut corners. Skip the pre trip, fudge on hours etc... It should be illegal the way it is now. I really feel for the drivers, most of which are immigrants trying to scrape by.",,,,yourbadinfluence,,,1482275027,t5_2qhad,t3_5jef1p,t1_dbfxhml,10,1483923812,0,0,dbfy6j7,Seattle,,,
"Nah, two hour delay is where it's at. You get time to sleep in or play, but don't have to make up the day later. ",,,,duchessofeire,Lower Queen Anne,,1481304394,t5_2qhad,t3_5hdqpo,t1_dazlwuh,11,1483602519,0,0,daznixt,Seattle,,,flair
"Homeless in SF and if someone belittled me for asking for change yea I'd tell you to kick rocks and if you didn't I would have done something. ",,,,Erikhatesmonkeys,,,1482525003,t5_2qhad,t3_5jyjcs,t1_dbk0ev7,-12,1483997190,0,0,dbk2xh6,Seattle,,,
"It's as if our economic system is predicated on the idea of maximizing profits at the expense of providing people with a livelihood. ",,,,nightbeast,,,1483056267,t5_2qhad,t3_5ky66h,t1_dbruad8,17,1484138264,0,0,dbrxsda,Seattle,,,
The title is a bit misleading. Nobody is saying that we're in danger of an imminent eruption... Just that earthquakes are a good reminder that the volcano is active.,,,,gandalf_alpha,,,1481612532,t5_2qhad,t3_5i24vh,t3_5i24vh,15,1483693069,0,0,db4t7qq,Seattle,,,
"That's not a fire. It's an Shelter-Challenged Personal Heating Solution. RFPs for a 10-year SCPHS management plan are currently being accepted by the mayor's new task force for Disadvantaged Community Climate Alternatives, with special emphasis on carbon-neutral initiatives to offset the greenhouse gases produced by personal solutions. ",,,,MochiMochiMochi,,,1482088671,t5_2qhad,t3_5iztog,t3_5iztog,43,1483864880,0,0,dbcn5il,Seattle,,,
"Given the huge fuck up and how much that will cost, be happy you don't. ",,,,KrasnyRed5,,,1481696665,t5_2qhad,t3_5i8s8s,t1_db6c8tu,30,1483751933,0,0,db6cnx9,Seattle,,,
"Ya bro. It's amazing up here. Weather better than Cali. Easy. Just hop on the i5 And you'll easily find a place. Just save up like 1-2k first. That should be enough to move in. Finding a job will come super quick so that can come once you're finally here. ",,,,Keepit_100_,,,1481002305,t5_2qhad,t3_5gr5e6,t3_5gr5e6,12,1483511682,0,0,daugab0,Seattle,,,
Fucking awesome. This petty property crime is becoming a fucking menace.,,,,nikdahl,Lynnwood,,1482523345,t5_2qhad,t3_5jyew2,t3_5jyew2,12,1483996617,0,0,dbk1seq,Seattle,,,flair
[deleted],,,,[deleted],,,1481525808,t5_2qhad,t3_5hust1,t1_db38yno,15,1483665861,0,0,db39ik0,Seattle,,,
"meh. I like the orca card. This doesn't support free transfers it sounds like. If they want to do something with smartphones, they should make an orca app.",,,,catphive,,,1480628038,t5_2qhad,t3_5fxmju,t3_5fxmju,18,1483399796,0,0,dao6wfb,Seattle,,,
And they won't.,,,,terminal_moraine,,,1483034293,t5_2qhad,t3_5kxxwp,t1_dbrgo7e,74,1484129811,0,0,dbrgq3e,Seattle,,,
This guy needs to go the fuck back to Minnesota.,,,,BroYourOwnWay,,,1481235427,t5_2qhad,t3_5h99q1,t3_5h99q1,12,1483583063,0,0,dayjgr7,Seattle,,,
"Why not? Our other weather people can't seem to predict shit, so his prophesy is good enough for me.",,,,amathus4321,,,1480866915,t5_2qhad,t3_5ge7eq,t3_5ge7eq,14,1483466554,0,0,darwb8q,Seattle,,,
"It's funny you mention what it would be like if Muslims had power since...

Christians *are* in power and want to control women's bodies, believe women belong at home, push creationism in schools, don't want gays to marry, discriminate against gays in general, force prayer in schools, have the Ten Commandments outside of courthouses, etc. 

**Sound similar to anything?** 

Oh and bonus points: https://en.wikipedia.org/wiki/Christian_terrorism

",,,,PoliticsBTFO,,,1481787811,t5_2qhad,t3_5if7xd,t1_db7wx17,36,1483780021,0,0,db7y4ot,Seattle,,,
"Three of those people are from Seattle ",,,,sacksmacker,,,1481867419,t5_2qhad,t3_5ilotc,t1_db94vzx,14,1483805847,0,0,db9dbgv,Seattle,,,
"What his AG actually said was: ""good people don't smoke marijuana"". That's why I think Sessions is more of an edible guy, clearly.",,,,shadow_banned_man,,,1480620328,t5_2qhad,t3_5fsyqd,t1_dan22i1,11,1483396484,0,0,dao04k0,Seattle,,,
"Nope.  Nobody here has any opinion on wings.  

https://www.reddit.com/r/Seattle/comments/2c27jy/national_chicken_wing_day_where_are_the_best/

https://www.reddit.com/r/Seattle/comments/21iuea/best_buffalo_wings_in_seattle/

https://www.reddit.com/r/Seattle/comments/51p5gv/best_hot_wings/

https://www.reddit.com/r/Seattle/comments/v6d2x/best_place_for_wings/

https://www.reddit.com/r/Seattle/comments/3bd2us/chicken_wings_in_north_seattle/

https://www.reddit.com/r/Seattle/comments/pu8n4/seattle_wings/


tl/dr: WingDome is a popular choice but not without its detractors and as with any regional food speciality not originating here there is a significant minority who will just say an acceptable rendition is not available here.  viz. Mexican food, NY Style Pizza, and bagels.",,,,strawdawgOG,,,1481577113,t5_2qhad,t3_5hz7gb,t3_5hz7gb,11,1483680606,0,0,db43pgi,Seattle,,,
That URL lol,,,,LeftOnBurnside,,,1482386582,t5_2qhad,t3_5jotdl,t3_5jotdl,14,1483957869,0,0,dbhv7dc,Seattle,,,
Why would you want a 10 minute break/  Just do your work,,,,ycgfyn,,,1480662833,t5_2qhad,t3_5g1a53,t3_5g1a53,-18,1483411470,0,0,daoud5m,Seattle,,,
*constant rains. Don't move here.,,,,tek9jansen,,,1482695258,t5_2qhad,t3_5k9i18,t3_5k9i18,44,1484037847,0,0,dbmd26c,Seattle,,,
"Weather predictions are dice rolls. Just because we rolled sixes last time does not mean snake eyes will never happen. Best to be cautious but skeptical.  ",,,,qdp,,,1480700337,t5_2qhad,t3_5g437j,t1_dapdta3,46,1483421419,0,0,dape29x,Seattle,,,
Cheeseburgers? Guns? What do you produce and sell?  Facebook helps every single fucking business on planet earth sell their goods and services to a worldwide audience.,,,,l30,,,1480740795,t5_2qhad,t3_5g5w91,t1_daq6b76,12,1483436000,0,0,daq6w6o,Seattle,,,
"I'm surprised more people don't know about the cams, let alone know there's an app for both Android and iOS devices. I use the traffic cams to check carpool lanes, 405 express and tolls (when the camera is pointing at the damn sign at least), ferry lines, and as suggested by the title, current weather conditions. Google maps is good for showing that there is traffic congestion, but the color coding doesn't really convey the relevancy of how the congestion will affect me. Having access to the cams answers this quite explicitly, and was thoroughly missed whenever I had moved to another state without this kind of access.",,,,soloxplorer,,,1481241244,t5_2qhad,t3_5ha6rx,t3_5ha6rx,13,1483585222,0,0,daynw29,Seattle,,,
"I see London, I see France... I see my house value skyrocketing!",,,,sunshine_rainbow,Bothell,,1480742419,t5_2qhad,t3_5g5w91,t3_5g5w91,30,1483436428,0,0,daq7r7u,Seattle,,,flair
"It'll take at least 30 minutes just to get off the plane and out the door, another 30-60 minutes to get back in through security, and your plane will start boarding 30 minutes before takeoff.
That would leave you 2 hours max to get into Seattle and back (the airport is not in Seattle).  There is absolutely nothing to see in the immediate vicinity of the airport except hotels and parking lots.
TL;DR: Not feasible.",,,,TheBionicProfessor,,,1482335946,t5_2qhad,t3_5jkknt,t3_5jkknt,41,1483939616,0,0,dbgu62a,Seattle,,,
"Hah! Everyone will be back to reality on Monday, when our roads built decades ago for 1993 traffic meet the massive population of 2016 once again.",,,,terminal_moraine,,,1483033706,t5_2qhad,t3_5kxxwp,t1_dbrfusm,37,1484129584,0,0,dbrg8y7,Seattle,,,
[deleted],,,,[deleted],,,1481697940,t5_2qhad,t3_5i8s8s,t1_db6cnx9,17,1483752215,0,0,db6d96a,Seattle,,,
"Post the case number here.  Get a club for your car.

90s Toyotas, Hondas, and Subies are super easy to steal and it will be stolen again if you get it back.  They most likely just joyrided in it, maybe did a deal, then ditched it.",,,,raffytraffy,,,1481667287,t5_2qhad,t3_5i5xua,t1_db5oekq,10,1483741921,0,0,db5rw9p,Seattle,,,
