body,score_hidden,archived,name,author,author_flair_text,downs,created_utc,subreddit_id,link_id,parent_id,score,retrieved_on,controversiality,gilded,id,subreddit,ups,distinguished,author_flair_css_class
"Oh, you mean you work in megacorporate big pharma?


And no, I didn't know what Facebook sells. I'm an unwitting slave to the Social Network!! Help, help, I'm being repressed!!",,,,ihminen,,,1480738598,t5_2qhad,t3_5g5w91,t1_daq4p3k,24,1483435402,0,0,daq5oli,Seattle,,,
[deleted],,,,[deleted],,,1483146131,t5_2qhad,t3_5l4hrx,t1_dbtaejw,35,1484164289,0,0,dbteegs,Seattle,,,
Same paper that complains that Seattle apartments don't get two(!) parking spaces per unit is complaining about highway traffic.,,,,fusionsofwonder,Bellevue,,1480824426,t5_2qhad,t3_5gc9b7,t3_5gc9b7,48,1483457928,0,0,darexgf,Seattle,,,flair
"Or WSECU, which is the closest thing to a state bank that we could hope for.",,,,ion-tom,,,1481930174,t5_2qhad,t3_5iqezy,t1_dba9bbp,28,1483824619,0,0,dbae9ki,Seattle,,,
"Plus, it has its own Cafe Chocolati. Their house mocha will definitely give you a caffeine buzz. When it comes time to stretch, get lunch, the Columbia Tower a few blocks down has a food court for everyone, the midlevel Starbucks, and Skyview.

Plus plus, visitor is right next to the rail station when its time to leave.

Good idea.",,,,zappini,Greenwood,,1482939239,t5_2qhad,t3_5koixn,t1_dbphkr4,10,1484101215,0,0,dbpuyn4,Seattle,,,flair greenwood
"TSA has got to change. Sorry ",,,,zackurtis,,,1482305916,t5_2qhad,t3_5jimfn,t3_5jimfn,22,1483932918,0,0,dbgglsu,Seattle,,,
They're just doing their job. Move past this,,,,gingersnap55,,,1482339324,t5_2qhad,t3_5jimfn,t1_dbgg7u5,47,1483940981,0,0,dbgwy3b,Seattle,,,
[deleted],,,,[deleted],,,1480709977,t5_2qhad,t3_5g5cd0,t3_5g5cd0,13,1483425643,0,0,dapmbwz,Seattle,,,
"No, it is coming now because the technology is ready for it to be a reality. It's not coming now (or later) because of a minimum wage increase.",,,,trevorishere,,,1480721211,t5_2qhad,t3_5g53hz,t1_dapuzu5,13,1483429978,0,0,dapv0yx,Seattle,,,
[removed],,,,[deleted],,,1482894205,t5_2qhad,t3_5kmzbs,t3_5kmzbs,-16,1484091435,0,0,dbpb68x,Seattle,,,
"Damn it kinda reminds me of the new barrows bridge and how long it took to build that, the park is going to be nice!",,,,thetreeclimber,,,1481695483,t5_2qhad,t3_5i8s8s,t3_5i8s8s,22,1483751657,0,0,db6c37q,Seattle,,,
Nice if you are inside. it is cold af,,,,Cornerroute,,,1481151721,t5_2qhad,t3_5h2q2h,t3_5h2q2h,94,1483557044,0,0,dax1v02,Seattle,,,
Monster Energy and Monster Dong... Wait...,,,,danjr,Bellingham,,1482623230,t5_2qhad,t3_5k48mw,t1_dblgtmo,10,1484022575,0,0,dbliazv,Seattle,,,flair
"Additional ways it might be defined: Misguided, uninformed, misled, ignorant.

Stupid doesn't immediately equate to malicious.  One thing that's definitely true is we're gonna have to share this country with everybody else in it, stupid or not.",,,,el_seano,,,1480992184,t5_2qhad,t3_5go5mr,t1_dau58d3,11,1483508261,0,0,dau9c3g,Seattle,,,
I'm sure it will help but there's still a huge demand.,,,,Planet_Iscandar,,,1483119148,t5_2qhad,t3_5l4hrx,t3_5l4hrx,18,1484154504,0,0,dbsuoms,Seattle,,,
Clinton was running on basically being a continuation of Obama. Trump was running on saying whatever sounded good at the moment.,,,,Raaaaaaaaaandy,Capitol Hill,,1480986943,t5_2qhad,t3_5go5mr,t1_dau29h3,10,1483506327,0,0,dau5ccs,Seattle,,,flair
I get it! It's funny because of the toilet!,,,,arnorath,,,1481015944,t5_2qhad,t3_5gq18l,t1_daucpgs,33,1483514475,0,0,daum1e6,Seattle,,,
"I'm going to say scam.  I have nothing to back that up, but it sounds too good to be true.  Are they asking for a ""application fee""?",,,,The_Safe_For_Work,,,1481612674,t5_2qhad,t3_5i271x,t3_5i271x,11,1483693099,0,0,db4t9xx,Seattle,,,
"You got a private shower/bathroom and a functioning kitchen in your closet? ",,,,urmom_neko,,,1481008420,t5_2qhad,t3_5gq18l,t1_dauj8bh,12,1483513167,0,0,daujbdy,Seattle,,,
"You forgot the $25 per month additional pet fee and $500 non-refundable pet deposit. ",,,,noodlebucket,,,1482390675,t5_2qhad,t3_5jomip,t3_5jomip,37,1483958770,0,0,dbhx1xg,Seattle,,,
"~~KOMO~~ KIRO snatched him up and he proceeded to take down Staples tech support at the national level ",,,,wiscowonder,Bainbridge Island,,1482332103,t5_2qhad,t3_5jimfn,t1_dbgn4x1,24,1483938180,0,0,dbgr9px,Seattle,,,flair
"32 degrees and dry beats 40 degrees and rainy, any day. ",,,,_klingoff_,,,1481827339,t5_2qhad,t3_5ifbav,t3_5ifbav,11,1483790755,0,0,db8jn9a,Seattle,,,
"At r/urbanplanning this is a pretty common topic: the formation of hubs within a city that essentially function as a microcosm of the city itself. A prime example of this is Vancouver, B.C. While no means perfect, the city has a ton of public transit, while creating miniature ""downtowns"" that would have everything you should need, such as shopping, entertainment, services, housing, etc.",,,,audiobiography,,,1481577503,t5_2qhad,t3_5hyc9v,t1_db42d7u,13,1483680777,0,0,db441na,Seattle,,,
What a great first year for Morris,,,,tropospherik,,,1481429743,t5_2qhad,t3_5hoadz,t3_5hoadz,44,1483638027,0,0,db1oi4c,Seattle,,,
"Holy lazy question.  Have you read the sidebar?  ",,,,solongmsft,,,1482165844,t5_2qhad,t3_5j67f5,t3_5j67f5,10,1483886927,0,0,dbdvnbo,Seattle,,,
"It's called Monkeywood. http://www.monkeywood.org

It's a fund raiser for PNA. Businesses rent these monkeys from PNA. 

Also, Wednesdays (in December) are ""red monkey"" days, and any business that has a red monkey in their window should have some discount on something. You'll have to go inside to find out what.",,,,TheGsus,Greenwood,,1480865491,t5_2qhad,t3_5ge81j,t3_5ge81j,11,1483466141,0,0,darvhtc,Seattle,,,flair
A three-fer with the Huskies... ��,,,,tengo_sueno,,,1481430339,t5_2qhad,t3_5hoadz,t1_db1oafk,40,1483638199,0,0,db1ov3w,Seattle,,,
[deleted],,,,[deleted],,,1480700053,t5_2qhad,t3_5g437j,t3_5g437j,56,1483421300,0,0,dapdta3,Seattle,,,
"Unless you are making a pretty high income it is extremely difficult to both rent and save for a down payment. Even houses 20 miles out of Seattle are $400,000. If you put down a 10% down payment then you have to be able to save $40,000 while spending well over $1000 on rent every month alone. 

Edit: spelling",,,,RiddleMeThis1213,,,1483158253,t5_2qhad,t3_5l4hrx,t1_dbt7y3f,10,1484168156,0,0,dbtmbtw,Seattle,,,
"People are stupid about it. If you really need a liquid during a trip, check it. There's no right to fly, so you have to play by thier rules or get your own plane. ",,,,wholesalewhores,,,1482342372,t5_2qhad,t3_5jimfn,t1_dbgjnbr,12,1483942243,0,0,dbgzg2h,Seattle,,,
"If it encourages exploration, l and opening minds, so be it. ",,,,johnyutah,,,1481417387,t5_2qhad,t3_5hku5s,t1_db1cr62,10,1483634185,0,0,db1go91,Seattle,,,
"Ignorance is bliss - you've proven my point. ",,,,_klingoff_,,,1480986310,t5_2qhad,t3_5go5mr,t1_dau4umj,12,1483506098,0,0,dau4vhn,Seattle,,,
It should've closed in 1986.,,,,SnarkLobster,,,1482530966,t5_2qhad,t3_5jziad,t3_5jziad,12,1483999164,0,0,dbk6wnz,Seattle,,,
Defense wins championships!,,,,thequietone710,Bellevue,,1481432297,t5_2qhad,t3_5hoadz,t3_5hoadz,20,1483638774,0,0,db1q1h5,Seattle,,,flair
Wahhhh,,,,Cannibuss,,,1482340196,t5_2qhad,t3_5jimfn,t3_5jimfn,26,1483941345,0,0,dbgxnym,Seattle,,,
"There's still variance in what people get paid. That means that as long as people make different levels of money, people who make more will be willing to pay for more, so there will always be demand for nicer places, and landlords willing to cater to those demands. Amount of space is one thing that people are willing to pay more for.

This type of space is designed to appeal to a specific renter - frugal (likely young) person who doesn't have a lot of furniture, doesn't cook, and just needs a place to sleep and shower. This person probably doesn't have an S.O. and for the most part doesn't need to entertain guests in their space.

I'd rent it if that were still me. That was me in my late teens/early 20s.",,,,jungleralph,,,1481020262,t5_2qhad,t3_5gq18l,t1_daujgk3,10,1483515131,0,0,daunctc,Seattle,,,
"fun fact, he mentored under Carl Sagan at Cornell and thus Prof. Mass feels that one of his duties is to help educate the public about science.  He is also very passionate about math instructions in primary/secondary schools in the area...",,,,altoidaltoid,Meadowbrook,,1480712514,t5_2qhad,t3_5g437j,t1_dapl7jp,10,1483426670,0,0,dapofir,Seattle,,,flair
[I have been known to make the occasional right hand turn](https://gfycat.com/ContentAdventurousGar),,,,cyanicenine,,,1482556013,t5_2qhad,t3_5k08ep,t1_dbklilm,12,1484006563,0,0,dbkltwz,Seattle,,,
"Chuck's Hop Shop (two locations) and Beer Junction (W. Seattle) are the best combo bar/bottle shops in the city, Brouwer's is the best beery restaurant, and Holy Mountain is the best brewery. All IMHO.",,,,jrbuilder,,,1481910948,t5_2qhad,t3_5ipal4,t3_5ipal4,13,1483817103,0,0,db9zcre,Seattle,,,
"Was up there last weekend. So much snow! ",,,,GayVegan,,,1481993981,t5_2qhad,t3_5iusrp,t3_5iusrp,15,1483839282,0,0,dbb7kin,Seattle,,,
"""Seasonable temps &amp; dry"" is still going to equal a ton of bitching about how hot it is when it gets above 80.",,,,SnarkMasterRay,,,1482710781,t5_2qhad,t3_5k9i18,t3_5k9i18,10,1484042350,0,0,dbmm73b,Seattle,,,
"Fuck if the employees at other Best Buys were more like the ones at Northgate, I'd enjoy my shopping experience much more. These days I can't find shit in that store and it would be great to get some help now and then.",,,,asoughtafterdroid,,,1480801715,t5_2qhad,t3_5gbc5h,t1_daqxvf6,17,1483450512,0,0,dar00fm,Seattle,,,
"&gt;1500 for a 2 bedroom

Really? Because it's $1400 for a studio in CapHill. $1500 for 2BR sounds like a deal.",,,,HuIxU,Madrona,,1483133507,t5_2qhad,t3_5l4hrx,t1_dbszgbo,66,1484159995,0,0,dbt5p77,Seattle,,,flair
"I has to buy a hard drive TODAY to fix a PC for a friend. If I had ordered it, they would have to wait until Tuesday for me to fix it. Brick and mortar stores are good for when you need stuff now.",,,,goombatch,,,1480822238,t5_2qhad,t3_5gbc5h,t1_daqzj8e,10,1483457254,0,0,dardixn,Seattle,,,
I think it's pretty.,,,,SuperVoodoo,,,1483161539,t5_2qhad,t3_5l7c4x,t1_dbto114,10,1484169195,0,0,dbtoezg,Seattle,,,
"The plans in your head and budget don't fit the reality of your situation.

",,,,NotLurk1ng,,,1480702617,t5_2qhad,t3_5g4jaf,t3_5g4jaf,13,1483422440,0,0,dapg285,Seattle,,,
Come on down to Fake Dooooooors!,,,,tarants,,,1481002322,t5_2qhad,t3_5gq18l,t1_daudyuw,80,1483511687,0,0,daugank,Seattle,,,
"Well saying it's a good idea to do so is all a matter of perspective.

In situations like these, there are two different ways bystanders can react. There are those who sit back and watch, and those who react. I've always been the latter. If I can stop others from getting hurt, Ill do so. My screaming at them that I see them and their type of car could reasonably distract them from their adrenaline infused focus on firing that gun. I could care less about the people shooting at one another, but when you're firing 20+ shots out into the open, that's 20+ chances of someone waiting at the bus stop getting shot, a child coming out of the store with their mother, my girlfriend walking home etc.
Nevertheless, I was in a brick building 9 stories up and they would have trouble finding where the yelling was coming from with all the chaos.",,,,Stegosaurusflex,Belltown,,1481524592,t5_2qhad,t3_5hust1,t1_db38dx1,27,1483665595,0,0,db38yno,Seattle,,,flair
"Digging through [RCW 9.41](http://app.leg.wa.gov/RCW/default.aspx?cite=9.41), I'm not finding much, aside from [not being able to carry one in a school](http://app.leg.wa.gov/RCW/default.aspx?cite=9.41.280).

I am not a lawyer. If you run afoul of the law, I am not responsible.",,,,chattytrout,,,1480883407,t5_2qhad,t3_5ghcjj,t3_5ghcjj,11,1483472864,0,0,das92we,Seattle,,,
How about calling the school and asking them?,,,,solongmsft,,,1481820619,t5_2qhad,t3_5iig2q,t3_5iig2q,13,1483787907,0,0,db8dwj3,Seattle,,,
Seems like everyone needs to put fake packages on their porches.  I just get everything delivered at my office.,,,,Monorail5,,,1482890083,t5_2qhad,t3_5kmzbs,t1_dbp651f,28,1484089972,0,0,dbp8dfe,Seattle,,,
"I assume in that glass shower in the corner. ",,,,flukz,Pike Market,,1480989943,t5_2qhad,t3_5gq18l,t1_dau7gl2,45,1483507453,0,0,dau7ne6,Seattle,,,flair
":: Sputters :: It's the TSA! Don't you GET IT?

/S because people can't figure that out too often.",,,,SnarkMasterRay,,,1482340066,t5_2qhad,t3_5jimfn,t1_dbgoz7y,19,1483941293,0,0,dbgxk2y,Seattle,,,
Sorry for what?,,,,lizard_king_rebirth,,,1482311154,t5_2qhad,t3_5jimfn,t1_dbgglsu,11,1483933873,0,0,dbgih5b,Seattle,,,
"Welcome Chinese Oligarchs with illicit funds stolen from your fellow countrymen through bribery schemes and other scandals that you are trying to hide from your government corruption crackdown! 

Come, launder your dirty money in Seattle real estate! 

Price out all the locals! 

Ruin the city that you care nothing about except as a vehicle to park your dirty money!

Inflate the housing bubble to even more insane values! 

Buy my house in Capitol Hill for $15m cash! Oh heck, why not $22m you filthy corrupt turd hoarder?

Make Seattle the housing equivalent of a Swiss bank account, with nothing but dilapidated vacant neighborhoods holding your dirty money! Housing is for hiding your ill-gotten gains, not for living in after all!

Ruining Seattle will be great!",,,,realestatebubble,,,1480965261,t5_2qhad,t3_5gjfm5,t1_daswaeo,14,1483497642,0,0,datnjdq,Seattle,,,
"Wow. I live in Los Angeles and this looks exactly like it does downtown LA only the fire in the pic is bigger. I understand that cost of living in Seattle is pretty comparable to LA but I can't imagine that that is the reason for such a homeless explosion. I have to think that it's related to the drug epidemic. 

In November we passed a massive measure to build a bunch of housing for the homeless, and I'm curious to see what effect that'll have. Do you guys have anything in the works like that?",,,,whatsmy_password,,,1482083369,t5_2qhad,t3_5iztog,t3_5iztog,10,1483862745,0,0,dbcivpq,Seattle,,,
"Why would that be nice? You're essentially telling us that you're a drone, here to join a swarm of other boring identical drones. ",,,,strangermouse,,,1482442409,t5_2qhad,t3_5jrs61,t1_dbih1zi,10,1483973726,0,0,dbirc7p,Seattle,,,
"is this a troll post? ",,,,Boner_Forest,Capitol Hill,,1481006020,t5_2qhad,t3_5gr5e6,t3_5gr5e6,11,1483512638,0,0,daui8u2,Seattle,,,flair
I'll be fine I'm going to take the shuttle! I'm so glad this happened the views from the ferry are amazing!,,,,Darxe,,,1482886485,t5_2qhad,t3_5kl3b6,t1_dbp5h86,25,1484088791,0,0,dbp5x7s,Seattle,,,
"you're getting downvoted, but that happened IRL. ",,,,LionsTigersOctopus,,,1482334461,t5_2qhad,t3_5jimfn,t1_dbgs31t,48,1483939052,0,0,dbgt0a1,Seattle,,,
It's great for acne and chapped lips as well.,,,,ilovegingermen,Capitol Hill,,1482347873,t5_2qhad,t3_5jimfn,t1_dbh34qk,10,1483944503,0,0,dbh41x7,Seattle,,,flair
"In addition to these, I have seen numerous chop shops in my area around I-90 by Poplar and the I-90 trail. ",,,,delightful1,Beacon Hill,,1481658766,t5_2qhad,t3_5i5jry,t1_db5j6pk,10,1483738213,0,0,db5kbgz,Seattle,,,flair
"Prices do not ever increase the same amount as the wage increase. They do tend to go up a small amount but nowhere near the wage increase. 

Read up on what happened when the US finally bumped minimum wage to its current level. The tldr; is short term job losses followed by long term economic growth with more jobs than when we started.",,,,muckrucker,,,1483054811,t5_2qhad,t3_5ky66h,t1_dbrw3yy,16,1484137766,0,0,dbrwras,Seattle,,,
"Never under-estimate the deals you can find by driving around neighborhoods you are interested in and finding places with signs out. If it's a smaller building, or a building with a single owner who isn't using a property management company, you can do a lot to find a better rental price.",,,,Cataclyst,Capitol Hill,,1483158736,t5_2qhad,t3_5l4hrx,t1_dbtahka,11,1484168307,0,0,dbtmmxo,Seattle,,,flair
"sor·ry

ˈsärē,ˈsôrē/

adjective

1. feeling distress, especially through sympathy with someone else's misfortune.

""I was sorry to hear about what happened to your family",,,,jethroguardian,,,1482311439,t5_2qhad,t3_5jimfn,t1_dbgih5b,14,1483933919,0,0,dbgiknd,Seattle,,,
"Yeah, don't you have to have a closet to classify this as a bedroom even?",,,,OSUBrit,Bothell,,1481004228,t5_2qhad,t3_5gq18l,t1_dau6jjk,17,1483512209,0,0,dauhcn0,Seattle,,,flair
"They were semi automatic guns, not automatic gunfire. ",,,,Triggs390,,,1481551314,t5_2qhad,t3_5hust1,t3_5hust1,17,1483670415,0,0,db3iuaa,Seattle,,,
"sad about leaving seattle but dont miss the traffic, bikers, 405 and i-5. or the people who always have to look when their is an accident. i have places to go people, stop holding up traffic ",,,,Xmorpheus,,,1481152635,t5_2qhad,t3_5h2q2h,t3_5h2q2h,-12,1483557386,0,0,dax2kn7,Seattle,,,
As a passenger in the Sno-Cat.,,,,wsdot,WA State Dept of Transportation,,1482177634,t5_2qhad,t3_5j790z,t1_dbe4gv1,15,1483891834,0,0,dbe5hp0,Seattle,,,flair verified
"&gt;  I was hoping to stay around $500.00 for the month

A MONTH?? In Seattle Washington? Maybe try Salina Kansas instead?",,,,realestatebubble,,,1481500039,t5_2qhad,t3_5hsdut,t3_5hsdut,17,1483657375,0,0,db2s5tn,Seattle,,,
Those are chemtrails made by the United States Government to help thin out the population of the world.,,,,scottrm,,,1482192515,t5_2qhad,t3_5j92gt,t3_5j92gt,13,1483898004,0,0,dbehxcs,Seattle,,,
"Imagine you invited a girl there for romantic dinner. And then had to go number 2. ",,,,omon-ra,Issaquah,,1480994517,t5_2qhad,t3_5gq18l,t3_5gq18l,556,1483509119,0,0,daub42m,Seattle,,,flair
There's a special glass on them that shrivels when its cold,,,,ycgfyn,,,1481346858,t5_2qhad,t3_5hh7j0,t3_5hh7j0,21,1483616981,0,0,db0hdrh,Seattle,,,
Dr. LeBig... special doctors for men.  Heh.,,,,Beestung,,,1482789639,t5_2qhad,t3_5kf4nw,t3_5kf4nw,18,1484060639,0,0,dbnn8ag,Seattle,,,
[deleted],,,,[deleted],,,1482348082,t5_2qhad,t3_5jimfn,t1_dbh3c8z,19,1483944587,0,0,dbh4889,Seattle,,,
No you don't.,,,,HarpDarpDerpDarp,,,1482867000,t5_2qhad,t3_5kkasi,t1_dborlb9,38,1484080890,0,0,dborwi7,Seattle,,,
Hey the same thing happens to me when I eat taco bell. Poor 911,,,,bigoltitty,,,1481435007,t5_2qhad,t3_5hnn7m,t3_5hnn7m,13,1483639509,0,0,db1rjxk,Seattle,,,
[deleted],,,,[deleted],,,1482894757,t5_2qhad,t3_5kmzbs,t1_dbpb68x,18,1484091608,0,0,dbpbj24,Seattle,,,
"...globalization? Lol. 

Not sure if you've been around, but there's no shortage of mom and pop coffee houses in our city and others despite starbucks' prevalence. I'm sure they've grown the pie for coffee as a good rather than a commodity, helping the mom and pop stores rather than hurting it. ",,,,themandotcom,First Hill,,1480672020,t5_2qhad,t3_5g029p,t1_daowp8p,20,1483413121,0,0,daoxpl1,Seattle,,,flair
"Prisoners aren't humans ? ",,,,Tibison,,,1481030422,t5_2qhad,t3_5gq18l,t1_dauic97,15,1483516964,0,0,daur350,Seattle,,,
How is it a waste of money? That thing is structurally unsound and sits on compact mud and garbage.,,,,ExpiredDustyMuffin,,,1483040928,t5_2qhad,t3_5kvj6j,t1_dbrlcab,11,1484132401,0,0,dbrm38r,Seattle,,,
"&gt; Some hippy couples would take shits while their partner sat on their lap. Both of them had to switch roles. Supposed to be ""freeing"".

what? that's the definition of hippy these days? not hiding when you poop?",,,,jaquefroid,,,1481006032,t5_2qhad,t3_5gq18l,t1_daud4r1,27,1483512641,0,0,daui91m,Seattle,,,
Great shot. Impressive ability to get Emperor Palpatine in there too.,,,,Artificial_Squab,,,1481698945,t5_2qhad,t3_5i8z0f,t3_5i8z0f,65,1483752427,0,0,db6dp4l,Seattle,,,
Time to change your oil?,,,,uwhuskytskeet,,,1482164808,t5_2qhad,t3_5j790z,t3_5j790z,28,1483886511,0,0,dbdutp7,Seattle,,,
"Between this and the first come, first get rule in the City of Seattle, the only thing the landlord can adjust is rents; this really hurts the small landlords who focused on screening for good tenants and offering fair below market rents. ",,,,procat99,,,1481594175,t5_2qhad,t3_5i05hz,t3_5i05hz,10,1483687173,0,0,db4h4zh,Seattle,,,
Drinking is the only thing to do.,,,,0xDEADBEEE,Rainier Valley,,1482953022,t5_2qhad,t3_5kr80o,t3_5kr80o,10,1484106523,0,0,dbq5k4j,Seattle,,,flair
"I recently moved here from Suracuse NY, I'm just thankful for the lack of snow!",,,,MentalFracture,,,1481157967,t5_2qhad,t3_5h2q2h,t1_dax1v02,26,1483559349,0,0,dax6lmg,Seattle,,,
It's a Marionberry Vatrushka; a delicious cream cheese-filled pastry with Marionberry topping!,,,,ellllyg,,,1482467424,t5_2qhad,t3_5jv140,t1_dbj88fq,20,1483982236,0,0,dbj8lax,Seattle,,,
I'm one of those people. Please show me a 1bd in Seattle for less than $1000,,,,Pickled_Pankake,,,1483127479,t5_2qhad,t3_5l4hrx,t1_dbt01y7,15,1484157742,0,0,dbt15zd,Seattle,,,
"There's a sink, isn't there? What more do you want?",,,,holocaustic_soda,,,1481028793,t5_2qhad,t3_5gq18l,t1_daugmxo,10,1483516606,0,0,dauqc4v,Seattle,,,
"Something is very very wrong with the insurance plan you have. Please speak to someone about it!

There is no way someone paying the premiums you say you are paying and paying those kind of costs out of pocket.

Someone in your process to get insurance has made a terrible terrible mistake. ",,,,Hi5guy,,,1480991166,t5_2qhad,t3_5go5mr,t1_dau5rsk,17,1483507894,0,0,dau8kft,Seattle,,,
"""Muslim registry"".

I can't believe it's the 21st Century and I'm reading this shit about my own country.  ",,,,Snickersthecat,,,1481816698,t5_2qhad,t3_5if7xd,t3_5if7xd,45,1483786345,0,0,db8apf0,Seattle,,,
[I know of only one bus capable of transcending time.](http://www.indiewire.com/wp-content/uploads/2014/06/magic-school-bus-1.jpg),,,,Artificial_Squab,,,1481743462,t5_2qhad,t3_5ic2oa,t3_5ic2oa,16,1483764627,0,0,db72ql1,Seattle,,,
"Advice : Stay in California ",,,,throwawayballard,,,1480703157,t5_2qhad,t3_5g4jaf,t3_5g4jaf,17,1483422675,0,0,dapgjbi,Seattle,,,
"live there aint sketchy, and if ur lucky someone will give ya a mixtape
",,,,frosty_ninja,,,1480988162,t5_2qhad,t3_5gmr4r,t1_datft7l,11,1483506770,0,0,dau69os,Seattle,,,
"Just subscribed, in response to this post.

Thank you, Seattle Times, for a decade of incognito tab-browsing. Please use my $4/week for thoughtful independent reporting.",,,,4kbt,,,1481216916,t5_2qhad,t3_5h4wqd,t3_5h4wqd,14,1483575236,0,0,day3f4p,Seattle,,,
"Seriously, having to wade through a hobo encampment to take a picture for the Internet is commitment. 
""I hope that is dog shit I just stepped in.""",,,,KingdomOfFawg,,,1480553935,t5_2qhad,t3_5frdwr,t1_damqjwg,33,1481892953,0,0,damx102,Seattle,,,
"Lol if there was an unexplained bang, I'd prefer they land to determine it was harmless rather than keep flying and find out it wasn't.",,,,drainhed,,,1482337641,t5_2qhad,t3_5jimfn,t1_dbgumwt,33,1483940284,0,0,dbgvji1,Seattle,,,
"Radiator Whiskey, Oliver Twist, Bathtub Gin, Rob Roy, Backdoor at the Roxy, Hazlewood, Sun Liquor, Liberty, Rumba, The Soverign, Damn the Weather",,,,scotties92,Lower Queen Anne,,1482368088,t5_2qhad,t3_5jnb51,t3_5jnb51,11,1483952319,0,0,dbhjqqx,Seattle,,,flair
"She's a veteran but she can't deal with a pat down? Must be one of those ""veterans"" who didn't actually do shit a.k.a. Joined the military just long enough to sit at a desk and collect benefits and retirement. ",,,,Chhhhhildfreeee,,,1482383898,t5_2qhad,t3_5jimfn,t1_dbghyzt,11,1483957183,0,0,dbhts4s,Seattle,,,
Who hurt you?,,,,CamrenOfWest,,,1482102936,t5_2qhad,t3_5izxdl,t1_dbchht9,11,1483870421,0,0,dbcyehl,Seattle,,,
So you're okay with sharing the room with a toilet?,,,,misterjom,University District,,1480988961,t5_2qhad,t3_5gq18l,t1_dau6s7g,37,1483507087,0,0,dau6w38,Seattle,,,flair
"Annual xmas tour through downtown. I'm surprised more people don't take the opportunity to read local NW prints like The Stranger or Seattle Times. Sad times we live in. ",,,,JonFromSeattle,,,1482629598,t5_2qhad,t3_5k5hmj,t3_5k5hmj,-18,1484024387,0,0,dbllwwo,Seattle,,,
"6 years old. Terrier Mix. Rainier Beach neighborhood. Last seen 12/24/16  at 2PM. He is microchiped. Reward Offered if found. Thanks so much ",,,,seattlegg,,,1482683228,t5_2qhad,t3_5k70bl,t3_5k70bl,12,1484034460,0,0,dbm67e2,Seattle,,,
"I'm pretty sure this guy predicted an earthquake in new Zealand earlier this year. May want to take him seriously. ",,,,tastypic,,,1480873056,t5_2qhad,t3_5ge7eq,t3_5ge7eq,26,1483468639,0,0,das0i5w,Seattle,,,
"&gt;we out-draw the Hawks and are significantly more successful 

This seems like a stretch. ",,,,Masima83,West Seattle,,1481473402,t5_2qhad,t3_5hoadz,t1_db213ru,11,1483646852,0,0,db26iq2,Seattle,,,flair
[deleted],,,,[deleted],,,1481016778,t5_2qhad,t3_5gq18l,t1_dauiumh,14,1483514601,0,0,daumatz,Seattle,,,
"Why should your kid get an extra treatment because your wife was a veteran? Veterans can be terrorists too, at an Securitycheck *no one* deserves special treatment.",,,,YaWishYouHadThatName,,,1482332789,t5_2qhad,t3_5jimfn,t1_dbgg7u5,141,1483938434,0,0,dbgrr7z,Seattle,,,
Most infuriating in your life?? Must be a good life so far!,,,,gar187er,Alki,,1482349088,t5_2qhad,t3_5jimfn,t1_dbh177w,11,1483945015,0,0,dbh52y1,Seattle,,,flair
For Lease Navidad?,,,,YouCompreteMe,,,1482396591,t5_2qhad,t3_5jomip,t3_5jomip,107,1483959870,0,0,dbhz9so,Seattle,,,
"The point is about our declining standards of living. A studio is SUPPOSED to be the affordable one room and 1 bathroom living quarters. 

This is simply a jail cell. Call it out for what it is, or we will all lose in the long run. ",,,,getthejpeg,Kirkland,,1481009189,t5_2qhad,t3_5gq18l,t1_dauj1yf,15,1483513318,0,0,daujmpi,Seattle,,,flair
"If we are in the left lane, someone forced us there. We aren't allowed there in most places, but on 18 or 167 we are. If we are passing someone, be patient. Don't swerve around us and cut us off, you're only making a dangerous situation.",,,,AspiringTrucker,Kent,,1480559650,t5_2qhad,t3_5fo0eh,t1_dam7asp,10,1481895191,0,0,dan1d6b,Seattle,,,flair
