body,score_hidden,archived,name,author,author_flair_text,downs,created_utc,subreddit_id,link_id,parent_id,score,retrieved_on,controversiality,gilded,id,subreddit,ups,distinguished,author_flair_css_class
"Never underestimate the cold weather aversion of a Floridian. Moved here, from there.

They break out heavy weather gear on 50* days and post pictures of their car's temperature readouts. Then they go home on Christmas Eve, turn the A/C down to 70* so they can sleep, and rack up a 250.00 electricity bill.",,,,Steadman,,,1482076229,t5_2qhad,t3_5iwz26,t1_dbbl99y,10,1483860366,0,0,dbce2xo,Seattle,,,
"Jesus. I don't know. I'm paying $1399 for a 950 sq ft unit in mountlake terrace. 750 for this is outrageous to me. ",,,,joshuad80,Interbay,,1481008273,t5_2qhad,t3_5gq18l,t1_dauhtx8,11,1483513137,0,0,dauj95k,Seattle,,,flair
I'm paying $960 but my bathroom came with walls.  I'm not sure walls are worth $200 a month.,,,,90s_kids_only,,,1481002431,t5_2qhad,t3_5gq18l,t3_5gq18l,13,1483511717,0,0,daugcw3,Seattle,,,
This attitude is why seattle tolerates theft.,,,,snowsharks,,,1482898242,t5_2qhad,t3_5kmzbs,t1_dbp9dci,60,1484092708,0,0,dbpdsct,Seattle,,,
"I use strava, I have neither of those things. 

",,,,[deleted],,,1482837588,t5_2qhad,t3_5khj0i,t1_dbo7cyj,11,1484072627,0,0,dbobech,Seattle,,,
"It is a steal. 

I moved from Ohio, where my two bedroom 1200 sq ft townhouse was $650 a month, plus utilities. 

Rent is cheap, but it's an economic desert. ",,,,Flat_prior,Mountlake Terrace,,1483144695,t5_2qhad,t3_5l4hrx,t1_dbt5p77,13,1484163804,0,0,dbtdgdc,Seattle,,,flair
"Saw it from my apartment right next to the parking lot. I was screaming down at them that I could see them and knew what car they were driving, hoping to distract them so that they would stop firing. 
Two groups firing on each other, though it was not automatic gunfire, it was semi automatic pistol fire. Big difference. 
there was at least 20 shots +. Lots of shots, and a pause in between shooting that sounded as if a clip was being reloaded and more shots. 3 guys got into a black sedan and headed south on 3rd.
Talked to the cops, gave them my info and a description of what I saw.",,,,Stegosaurusflex,Belltown,,1481521048,t5_2qhad,t3_5hust1,t3_5hust1,50,1483664729,0,0,db3775b,Seattle,,,flair
[deleted],,,,[deleted],,,1481836997,t5_2qhad,t3_5ijtio,t1_db8rpzp,24,1483794901,0,0,db8rwl9,Seattle,,,
"It literally says ""remember the human"" in the text box you typed this into. It's fine to not miss the institution if you dont, but this comment is disrespectful and dismissive of people who are about to lose their livelihoods during what can already be a stressful holiday season. 

It costs literally nothing to be kind. Try some empathy. ",,,,WotC_Worth,,,1481180623,t5_2qhad,t3_5h4wqd,t1_daxj093,32,1483566478,0,0,daxla28,Seattle,,,
We obviously need more tunnels.,,,,ThurstonHowell3rd,,,1481309422,t5_2qhad,t3_5hfcmj,t3_5hfcmj,12,1483604632,0,0,dazrvy4,Seattle,,,
"He specifically said he investigates ""bike and mail theft"" in his title.  

I would say that an organized ring of thieves, stealing somewhere above $200k worth of property annually and intertwining that money with drug distribution counts as a major crime.  I feel you are downplaying the impact that one homeless thief can have simply because they are homeless.
",,,,MyopicVitriol,,,1481671016,t5_2qhad,t3_5i5jry,t1_db5u03x,12,1483743370,0,0,db5uwaj,Seattle,,,
"There isn't one single minimum wage for all employers.  It can be anywhere from $11 to $15 (as of Jan 1)

https://www.seattle.gov/laborstandards/ordinances/minimum-wage",,,,phinneypat,Phinney Ridge,,1482955554,t5_2qhad,t3_5ks9gz,t3_5ks9gz,13,1484107507,0,0,dbq7jsg,Seattle,,,flair
I *think* the OP is implying that the blankets were tossed onto the floor. And if that's the case...okay...? Were the floors exceptionally filthy?,,,,JohnLeafback,,,1482341664,t5_2qhad,t3_5jimfn,t1_dbgs3jc,45,1483941961,0,0,dbgyv3y,Seattle,,,
the Seattle palette!,,,,jeexbit,,,1482976108,t5_2qhad,t3_5ks43l,t1_dbqiq6n,13,1484114885,0,0,dbqmjx5,Seattle,,,
"Broadway part of Capitol Hill lost its last crumbs of funkiness, with the closing of Red Light, the Harvard Exit, and a few other stores.

Homeless problem is worse; sections of downtown are worse than they were even last spring. 

Traffic is even worse.",,,,CPetersky,,,1481122204,t5_2qhad,t3_5gz7vw,t3_5gz7vw,14,1483544855,0,0,dawcql4,Seattle,,,
Because Delta doesn't have any 787s in their fleet.,,,,LevAndropov,,,1482896006,t5_2qhad,t3_5kn72s,t1_dbp926e,31,1484091999,0,0,dbpcci8,Seattle,,,
Maybe you should have followed the fucking rules,,,,Record_Was_Correct,,,1482348470,t5_2qhad,t3_5jimfn,t1_dbh2kwb,16,1483944764,0,0,dbh4k2x,Seattle,,,
Oh you're just in time to enjoy darkness and rain until around May :),,,,Mirrory,Issaquah,,1481046128,t5_2qhad,t3_5gtyhk,t3_5gtyhk,13,1483522412,0,0,dav2cus,Seattle,,,flair
"Seriously. If you refuse to allow a blanket that's been on a conveyor belt to touch the golden skin of your angelic child, I have some bad news for you about literally everywhere else you take them. ",,,,ihatem0ndays,,,1482335713,t5_2qhad,t3_5jimfn,t1_dbgp2gp,47,1483939528,0,0,dbgtzeb,Seattle,,,
"This is why Seattle needs even more progressive, more liberal policies on homelessness so we can ensure we can attract all the best homeless people from not only the entire country, but the entire world!",,,,seattle-is-aight,,,1482082532,t5_2qhad,t3_5iztog,t3_5iztog,20,1483862453,1,1,dbcia78,Seattle,,,
"You... don't know what a ferry is, do you?",,,,caseyjay,,,1480998500,t5_2qhad,t3_5go4nt,t1_daubzjf,12,1483510531,0,0,daudyp2,Seattle,,,
Yes but that dream is now homeless.,,,,folderol,Everett,,1481043558,t5_2qhad,t3_5gq18l,t1_dauxapc,12,1483521373,0,0,dav078l,Seattle,,,flair
"i...hope they also give each employee a jetpack, because seattle's road infrastructure is retarded. ",,,,asthingsgo,,,1480754225,t5_2qhad,t3_5g5w91,t3_5g5w91,16,1483438745,0,0,daqcepi,Seattle,,,
One depressing life,,,,johnlen356,Sumner,,1481009789,t5_2qhad,t3_5gq18l,t1_dauik16,35,1483513433,0,0,daujvdb,Seattle,,,flair
"Ferry's always have the right away except with a sail boat has its sails up. 

Source: friends dad is a ferry captain ",,,,Gruppchef,,,1480987901,t5_2qhad,t3_5go4nt,t1_dau3da9,10,1483506674,0,0,dau62h1,Seattle,,,
"I'm really happy to hear you aren't bothered about it. I on the other hand am bothered by all the white privilege in places like Colorado, Minnesota,  and the like. Places like that get all the government spending on things like snow plows. They also get their kids to school on time so they can get all the education they're supposed to. I grew up in a place that has white privilege,  but ever since I moved to Seattle my winters feel so disenfranchised. ",,,,imakemoneynotart,,,1481315951,t5_2qhad,t3_5hdyt7,t1_daztyr1,10,1483607297,0,0,dazxdhh,Seattle,,,
"By law, your landlord has 24 hours to fix your heat. Otherwise, you can leave and are entitled to a prorated refund of your money for that month.

If I was you, I'd light a fire under your landlord's ass; if he/she doesn't do anything about it, leave. ",,,,qwazzy92,Bellevue,,1482041610,t5_2qhad,t3_5ixzwa,t3_5ixzwa,15,1483854057,0,0,dbc1cy2,Seattle,,,flair
Any pics or footage of WSDOT using M-60 tanks launching artillery for avalanche control?,,,,crzyb1080,,,1482201311,t5_2qhad,t3_5j790z,t1_dbe6ai3,15,1483901163,0,0,dbeode2,Seattle,,,
"Granted this is an unusual apartment, but I still don't understand all the criticism. If someone is willing to rent this apartment (at a significantly lower price than a standard apartment, too) then what's the problem? $750 is a good value considering that utilities are included.",,,,akhalilx,Belltown,,1481005165,t5_2qhad,t3_5gq18l,t1_daufvcv,46,1483512439,0,0,dauhtx8,Seattle,,,flair
[removed],,,,[deleted],,,1482865766,t5_2qhad,t3_5kiw3x,t1_dboqtm5,-20,1484080410,0,0,dboqyx1,Seattle,,,
"If I wasn't broke I would buy you gold. Soccer is also dumb because the players exaggerate their ""injuries"" any chance they get and in doing so make complete fools out of themselves. I have no respect for the sport.",,,,bannedfromsauga,,,1481433759,t5_2qhad,t3_5hoadz,t1_db1q1b1,-19,1483639181,0,0,db1qvck,Seattle,,,
"Downvote away.  
IMHO because compared to a lot of places... they are. There could be a lot of reasons for it. I don't know if it's the lack of sunlight, computer programmer culture, or maybe just the fact that so many people come here with the expectation of the Seattle Freeze that they end up living up to it. Maybe it's just a regional thing? I've always gotten the feeling like this whole city is populated with introverts. I've lived all over the country and I can tell you that generally Seattleites are the most passive aggressive folks I've encountered. It's actually really weird once you've gotten used to it, and then visiting other parts of the country like ""Oh wow, I remember this."" Does it make me love the city any less? No, it's just something to get used to is all.",,,,74NK,,,1482346939,t5_2qhad,t3_5jkyks,t3_5jkyks,41,1483944121,0,0,dbh3abg,Seattle,,,
I don't think Eugene has a similar feel to Seattle at all. It feels more like Everett to me.,,,,tiff_seattle,Pike Market,,1482252078,t5_2qhad,t3_5jbzkw,t1_dbezef6,14,1483914276,0,0,dbfeva3,Seattle,,,flair
[deleted],,,,[deleted],,,1481791389,t5_2qhad,t3_5if7xd,t1_db7wblc,-23,1483780675,0,0,db7zev8,Seattle,,,
"&gt; Well he can't hit on little children in public so he has to do it in private. 

Did you read the article? He's scummy, but that's not at all what happened. ",,,,Someguy2020,,,1482836080,t5_2qhad,t3_5kiw3x,t1_dbo9w6l,14,1484072422,0,0,dboaz2o,Seattle,,,
Ever fart in the shower? It's like that but with more people on their cellphones.,,,,m3t4ldood,,,1481006109,t5_2qhad,t3_5gr5e6,t3_5gr5e6,24,1483512659,0,0,dauiafc,Seattle,,,
http://i.imgur.com/5szPQ.gif,,,,ilikelegoandcrackers,,,1481037686,t5_2qhad,t3_5gq18l,t1_dauq35t,29,1483519104,0,0,dauvjki,Seattle,,,
"If you have lived here 16 years and don't have any friends, it's probably not the Seattle Freeze.",,,,dbchrisyo,,,1482087890,t5_2qhad,t3_5izxdl,t1_dbca8gr,23,1483864549,0,0,dbcmh0o,Seattle,,,
"I wouldn't want to ride an electric scooter in the rain. ",,,,bb999,,,1480686320,t5_2qhad,t3_5g2yil,t3_5g2yil,15,1483415879,0,0,dap350s,Seattle,,,
Two people opened fire on each other on 3rd and Blanchard. You can listen to police scanner at http://komonews.com/live/live-police--fire-scanner-11-20-2015.,,,,calmsatyr,,,1481519381,t5_2qhad,t3_5hust1,t3_5hust1,16,1483664267,0,0,db368tj,Seattle,,,
for one what,,,,adrianp07,,,1481006695,t5_2qhad,t3_5gq18l,t1_dauc69p,31,1483512787,0,0,dauik16,Seattle,,,
Probably for the best.,,,,l30,,,1480740748,t5_2qhad,t3_5g5w91,t1_dapzcl4,-25,1483435983,0,0,daq6v9h,Seattle,,,
"Today's Space Needle is sponsored by T-Mobile ",,,,solongmsft,,,1483156386,t5_2qhad,t3_5l7c4x,t3_5l7c4x,22,1484167574,0,0,dbtl4ia,Seattle,,,
No kitchen???,,,,mattdre88,,,1481002920,t5_2qhad,t3_5gq18l,t1_daud0bf,30,1483511867,0,0,daugmxo,Seattle,,,
"Nobody is going to find a job for you. ",,,,Mad_V,,,1481218491,t5_2qhad,t3_5h82ab,t3_5h82ab,10,1483575910,0,0,day4spp,Seattle,,,
"&gt;One I believe that the social engineering of making cars unpalatable is ultimately a good thing.

I like my car and enjoy the freedom to drive. At the same time, I understand the current growth and traffic are not sustainable.

Instead of making cars unpalatable and forcing people to move out, the city should provide better means of public transit. Instead of taking away my rights, change the system enough that I have no desire to pay for a car, insurance, and parking.",,,,HeWhoStandsToPoo,,,1482559723,t5_2qhad,t3_5k1hjf,t1_dbkm6jw,11,1484007465,0,0,dbknmf4,Seattle,,,
"Oh yeah, of course none of them are in Capitol Hill (where he lives) or in Ballard (where the nouveau rich live). Stick them all next to working class neighborhoods to remind us how close we are to the fringe. What a fucking shock. Murray makes McGinn look like a Republican. 

Enjoy the rest of your single term, Mr Mayor.",,,,huckfinnster,,,1480641035,t5_2qhad,t3_5g0cvk,t3_5g0cvk,26,1483404045,0,0,daofhtb,Seattle,,,
"I will never forget having to drive my husband to work from Bellevue to Harbor Island when his carpool buddy flaked out even though he drove a VW bug.
An old one.

I was pregnant, with morning sickness , so I had to open the door on the bridge( we were stopped) so I could barf.

I had a Toyota Corolla sr5 sport coupe, so while it was no Bug, it performed quite respectably in the snow.
Damn, I miss that car.

",,,,MrsWhatsit-75,,,1481268876,t5_2qhad,t3_5hc3xo,t1_daz4053,10,1483593767,0,0,daz5iz8,Seattle,,,
"It's not that, it's that the sensors tripped for explosive residue.

On one tour the pyrotechnics guy had to scrub down like he'd been exposed to radiation, and carried some type of clearance letter. (Not sure that helped, considering only about 15% of TSA employees can read.)

The guy basically sets off flame throwers and blows shit up every night. Flying was a real pain in the ass for him.",,,,GALACTICA-Actual,,,1482330300,t5_2qhad,t3_5jimfn,t1_dbgo4vc,12,1483937577,0,0,dbgq23o,Seattle,,,
"Yeah,  I'm super excited about having a city sanctioned junkie hang out down the street.  Ask the residents of Beacon Hill how The Jungle is working out for them.  How about the next ones be Upper Queen Anne and Seattle Center. ",,,,crusisredux,,,1480642704,t5_2qhad,t3_5g0cvk,t1_daofhtb,25,1483404665,0,0,daogr4f,Seattle,,,
"I was once told when picking up a TV from an online order at Best Buy that I needed to purchase a new surge protector for the TV, because the TV ""was Korean, and over there they use joules, not watts to power their TVs. This surge protector here will convert watts to joules.""",,,,ClusterFSCK,,,1480834417,t5_2qhad,t3_5gbc5h,t1_dar7c7q,29,1483460692,0,0,darkhc4,Seattle,,,
[deleted],,,,[deleted],,,1482866587,t5_2qhad,t3_5kkasi,t3_5kkasi,-98,1484080723,0,0,dborlb9,Seattle,,,
"Obligatory surly comment ",,,,tastysmelt,Fremont,,1481075901,t5_2qhad,t3_5gwvqs,t3_5gwvqs,18,1483534148,0,0,davqmwd,Seattle,,,flair
"The nebrahoman is the first one to crash, because despite driving in 50 feet of snow a day he's only driven on flat land in the snow and when he hits a hill and gravity is against him, he'll crash.",,,,alexfrancisburchard,Kent,,1481352488,t5_2qhad,t3_5hhwpn,t3_5hhwpn,34,1483618167,0,0,db0jus8,Seattle,,,flair
"And don't make the mistake of thinking that just because you learned how to drive on snow in Minnesota or Colorado (or wherever else similar) that you can get around in Seattle in the snow.  Those places have the infrastructure to plow and sand/salt roads more frequently, generally flatter terrain and a population of drivers who are used to snow.  You don't know how to drive in Seattle snow until you can reliably make it down a 30 degree incline that's frozen solid overnight while dodging a dozen idiots playing pinball with their SUVs and a stuck articulated bus at the bottom.",,,,GiantLakeOfire,,,1480720840,t5_2qhad,t3_5g437j,t1_dapoc1d,35,1483429856,0,0,dapursf,Seattle,,,
"No you don't understand, it's a cozy little micro unit for one!!!11! :^)",,,,average_shill,,,1480995926,t5_2qhad,t3_5gq18l,t1_dau6jjk,50,1483509669,0,0,dauc69p,Seattle,,,
"I just assumed that traffic was better because all the universities are on break.  ",,,,ftrain65,,,1483039823,t5_2qhad,t3_5kxxwp,t1_dbrkewf,14,1484131964,0,0,dbrl6op,Seattle,,,
"I have personally been involved in investigating some of these spots around Gasworks.  One of the difficulties in investigating bicycle thefts are that there is usually only a serial number on the frame.  The suspects know this and interchange parts so they are harder to identify.  

That said, we do still catch some thieves when stolen bike serials are reported to us. I would encourage everyone to take a current photo of their bicycle/their serial number.  You can email it to yourself.  We want to hear about possible chop shops of bicycles.  Start with reporting suspected of criminal activity to your community police team in the precinct. ",,,,Seattle_PD,Seattle Police Dept.,,1481663409,t5_2qhad,t3_5i5jry,t1_db5j6pk,23,1483740219,0,0,db5ohee,Seattle,,,flair verified
"I bet you lost your job due to complaining a lot ",,,,Loud_as_Hope,,,1482333034,t5_2qhad,t3_5jimfn,t1_dbgmpbq,11,1483938521,0,0,dbgrxrn,Seattle,,,
"Stay in Alabama, Alabama needs you.",,,,realestatebubble,,,1481055761,t5_2qhad,t3_5gtyhk,t3_5gtyhk,12,1483526415,0,0,davaou3,Seattle,,,
"I'm a sixth generation Seattleite born and raised, not some Californian who moved here to work for Amazon. Jerk.",,,,littlepieceofmt,,,1482265630,t5_2qhad,t3_5jbzkw,t1_dbflr92,13,1483920029,0,0,dbfqhsp,Seattle,,,
"I think a big part of the appeal is that you can stop paying attention at any given moment and your odds of missing anything happening are basically zero. It's perfect for sports fans who don't actually enjoy watching good sports, but more enjoy getting wasted with like minded individuals and marching through the streets together chanting what effectively equates to ""We are douchebags!""",,,,mogadiba,,,1481438099,t5_2qhad,t3_5hoadz,t1_db1ri5b,-12,1483640263,0,0,db1t3b0,Seattle,,,
"You can take light rail to downtown Seattle, walk a couple of blocks to the Bainbridge Island Ferry.  When you get off the ferry on Bainbridge Island, you can take the Casino shuttle directly to the Casino or you can take a taxi (a couple are normally waiting in the parking lot).  ",,,,Kimtwo,,,1482862554,t5_2qhad,t3_5kl3b6,t3_5kl3b6,36,1484079186,0,0,dboognd,Seattle,,,
"You really are thick aren't you? Dr. Tiller assassinated in his church by a Christian Fundamentalist. Oklahoma City bombed by a Christian Birmingham Health Clinic bombed by a Christian, Atlanta Olympics bombed the same guy. Then churches help him evade capture. How many doctors, nurses and  others have to die for you to realize it's not just Muslims doing the killings.
",,,,2ndtryagain,,,1481818226,t5_2qhad,t3_5if7xd,t1_db7zev8,14,1483786929,0,0,db8bx44,Seattle,,,
"Reporting illegal activity or encouraging others to do so is not a hate crime. ",,,,syncopation1,Ballard,,1480612956,t5_2qhad,t3_5fu7ag,t1_dan9g7c,14,1483393358,0,0,dantqi8,Seattle,,,flair
"If you can hear the distinct gunshots, it's probably not automatic.  There are a few full-auto guns that shoot slow enough for distinct gunshots, but I don't think the crooks have a lot of belt-fed weapons.",,,,Sunfried,Lower Queen Anne,,1481525261,t5_2qhad,t3_5hust1,t1_db37ads,13,1483665744,0,0,db399rc,Seattle,,,flair
The Jungle is inexpensive.,,,,solongmsft,,,1482992675,t5_2qhad,t3_5kvcow,t3_5kvcow,15,1484119996,0,0,dbqwvbh,Seattle,,,
"He might be a Corinthian. ",,,,CommieStoner,,,1482338311,t5_2qhad,t3_5jimfn,t1_dbgi0ru,30,1483940571,0,0,dbgw3gg,Seattle,,,
Not much of a gain in King Co. but a good bump in Omak.  I general legislating wages has mixed results in market economies.,,,,thegreatdissembler,,,1483040131,t5_2qhad,t3_5ky66h,t3_5ky66h,18,1484132081,0,0,dbrlfm6,Seattle,,,
"Minimum wage is ""minimum"". There has never been anything in the law about non-entry level jobs being paid more than minimum wage. It is entirely up to your company to decide if they believe anyone should get a raise above $15. You will always find jobs that require 5+ years of experience advertising below what minimum wage will be in a few months or less, so I don't expect most places to care.",,,,Tetimi,Maple Leaf,,1483167247,t5_2qhad,t3_5l8hvp,t3_5l8hvp,10,1484170725,0,0,dbtrkqf,Seattle,,,flair
Be thankful all you got was a note. Where I'm from you'd need to visit a body shop if you park like a jerk.,,,,tautologo,,,1482512196,t5_2qhad,t3_5jvbwt,t1_dbjbwc0,11,1483992425,0,0,dbjta11,Seattle,,,
"that's weird the wheels stopped instead of rolling down the ramp

this must be in the West Seattle antigravity vortex",,,,NinaFitz,,,1482254729,t5_2qhad,t3_5jef1p,t3_5jef1p,12,1483915401,0,0,dbfh4nr,Seattle,,,
"&gt; If someone is willing to rent this apartment (at a significantly lower price than a standard apartment, too) then what's the problem?

I understand the point but it's really a bad precedent. That's like saying ""If someone is willing to work for less than minimum wage, then what's the problem?""   
  
Everything just goes downhill without some sort of minimum standard. This house is pretty horrific - like, they couldn't have at least cubicled off the toilet?",,,,Nagemasu,,,1481031709,t5_2qhad,t3_5gq18l,t1_dauhtx8,21,1483517277,0,0,daurqo7,Seattle,,,
"As far as influential I would have to say Bruce Lee, Bill Gates, Paul Allen, Kurt Cobain, Jimi Hendrix, Ted Bundy, Howard Schultz(even though people hate him now), William Boeing, and Ben Gibbard. Maybe throw in Chris Pratt too. ",,,,seattletotems,,,1481353642,t5_2qhad,t3_5hi0kg,t3_5hi0kg,10,1483618381,0,0,db0kauv,Seattle,,,
"You're not alone.  I too am excited the tech sector continues to grow here.

My father grew up on a dairy farm in Redmond and my mom grew up in Juanita.  My ancestors on both sides settled this part of the Oregon territory.  

Apparently that's all relevant for some reason.",,,,Geldan,,,1480766456,t5_2qhad,t3_5g5w91,t1_daqde25,12,1483440420,0,0,daqfo96,Seattle,,,
"Since you seem to be in earnest, I'll try to curb my frustration and give you an honest response.  Speaking only for myself, it is upsetting because you aren't just choosing to take those measures for yourself - you are projecting them onto others, to the point where you are taking the position that a TSA agent is doing something wrong by setting a blanket on a conveyor belt.  Current TSA practices often frustrate me because they are unreasonable, but you are being at least as unreasonable in my opinion.  

You can do whatever you want with your own time and energy, but you don't deserve a pass from the people and institutions you interact with just because you have a kid and have decided to take this extreme approach.  If it were my job to screen you for access to a secure area which you were voluntarily entering with your child, I would not be willing to accept requirements like 'and none of your baby's possessions will touch anything which hasn't been sterilized' as something it was reasonable to require of me.

From a bigger picture perspective, your whole approach is frustrating to me because children who are coddled and overprotected to such a ridiculous degree seem more likely to become the kind of people I don't want to interact with in society - the kind who think they deserve everyone around them to go out of our way to be accommodating to their desires.  ",,,,reasondefies,,,1482366340,t5_2qhad,t3_5jimfn,t1_dbhh7y1,14,1483951733,0,0,dbhijuu,Seattle,,,
"Alaska Way is one of the least safe transportation structures in the united states. You can argue that a surface option, or a caped tunnel would have been a better option, but to claim that it wont be safe is just stupid. 

You also claim that they cut capacity in half, but ignore the additional lanes on the surface. 

I agree it's not perfect, but it's damn well better than you are making it out to be, and it's a hell of a lot better than what we had.",,,,SmilinGoat,,,1481773206,t5_2qhad,t3_5i8s8s,t1_db7aa4i,14,1483776154,0,0,db7q9rj,Seattle,,,
"Gopro 5, 2.7k60fps, linear FOV. protune @ auto white balance, gopro color, 800 iso, medium sharpness.

Mounted on a feiyu WG gimbal in pan mode on a stick.",,,,cyanicenine,,,1482542167,t5_2qhad,t3_5k08ep,t1_dbkdoai,39,1484002658,0,0,dbkdwf5,Seattle,,,
"I'm starting a new religion, Freism. Anyone else wishing to become a Freist, step right up. ",,,,winterforge,Burien,,1481429808,t5_2qhad,t3_5hoadz,t1_db1o8pe,63,1483638046,0,0,db1ojl0,Seattle,,,flair
"It's almost like the TSA doesn't respect or honor anyone, and simply have a job to do. ",,,,fatmoonkins,Bothell,,1482345631,t5_2qhad,t3_5jimfn,t1_dbgg7u5,14,1483943571,0,0,dbh26ll,Seattle,,,flair
ofc you can! manhattan has a strong food truck culture. the issue is the laws that disallow them here :(,,,,themandotcom,First Hill,,1482869077,t5_2qhad,t3_5kl7fr,t1_dboqdz3,11,1484081656,0,0,dboth29,Seattle,,,flair
"Hi Scotty - thanks a ton for all you do! My question: What's the one thing you wish all residents would do to help reduce property crime in our community? ",,,,Porkies4Me,,,1481659509,t5_2qhad,t3_5i5jry,t3_5i5jry,12,1483738529,0,0,db5kz5t,Seattle,,,
"The crazy part is that actually happened.

The Cuban refugee crisis from the boat lift and the ensuing drug problems in Miami were absolutely brutal.

There were 621 murders in Miami in 1981.


Seattle hasn't had close to 621 murders in the last 25 years *combined*",,,,01010101010808090,,,1482082975,t5_2qhad,t3_5iztog,t1_dbchwej,12,1483862611,0,0,dbcilmo,Seattle,,,
agreed. HOT lanes through JBLM would be fabulous.,,,,glynnjamin,,,1480838005,t5_2qhad,t3_5gc9b7,t1_darhsao,13,1483461382,0,0,darlwiq,Seattle,,,
[deleted],,,,[deleted],,,1483046648,t5_2qhad,t3_5ky66h,t1_dbrlfm6,14,1484134708,0,0,dbrqo9s,Seattle,,,
Woooooooo!,,,,PhilTheRed,Greenwood,,1481429184,t5_2qhad,t3_5hoadz,t3_5hoadz,16,1483637854,0,0,db1o56d,Seattle,,,flair
"No this is a common sight now due to rising home/rental prices, liberal giveaways disincentivising workers, layoffs because of forced unearned wage increases and generally rising property crime rates in our area. ",,,,DandelionAcres,,,1480574883,t5_2qhad,t3_5fuxfm,t1_dan9879,-16,1483384198,0,0,danaxt0,Seattle,,,
"I hate to be the ""sources?"" guy but... real sources please?

Now, I have no sources but I'd be willing to bet that a majority of the homeless do have a mental/physical problem that lead to a check to check life or losing a job ect and then results in choosing that over everything else.

",,,,Grampz03,,,1482089965,t5_2qhad,t3_5iztog,t1_dbcnldq,17,1483865383,0,0,dbco7b1,Seattle,,,
Tori Black,,,,frosted_nips,,,1481339636,t5_2qhad,t3_5hi0kg,t3_5hi0kg,16,1483615077,0,0,db0dgwy,Seattle,,,
