body,score_hidden,archived,name,author,author_flair_text,downs,created_utc,subreddit_id,link_id,parent_id,score,retrieved_on,controversiality,gilded,id,subreddit,ups,distinguished,author_flair_css_class
"I'll rent you my closet for $500 a month. 
",,,,Elwood_,Capitol Hill,,1481008219,t5_2qhad,t3_5gq18l,t1_daui729,16,1483513125,0,0,dauj8bh,Seattle,,,flair
"Just a bunch of people that feel as though the rules of the road don't apply to them. I almost hit someone attempting to merge back on from the shoulder where they aren't supposed to wait. ",,,,mr_irwin_fletcher,,,1482423379,t5_2qhad,t3_5jpici,t3_5jpici,17,1483966181,0,0,dbibwlm,Seattle,,,
"If something actually tested positive for explosives, wouldn't they arrest the person?  ",,,,KneesTooPointy,,,1482310617,t5_2qhad,t3_5jimfn,t3_5jimfn,10,1483933782,0,0,dbgias4,Seattle,,,
WSDOT.  Doing social media engagement right.  Thank you!,,,,HOISTTHECHUTE,,,1482177882,t5_2qhad,t3_5j790z,t3_5j790z,78,1483891940,0,0,dbe5pf2,Seattle,,,
"It's why the McDonald's CEO said if it went to $15 an hour they would fire the cashiers and put in kiosks because it would be more cost effective. ",,,,JonToski98296,,,1483050993,t5_2qhad,t3_5ky66h,t1_dbrrzmw,28,1484136367,0,0,dbru07w,Seattle,,,
"Well considering homeless drug addicts are the most entitled people out there it doesn't surprise me. ",,,,olekzap,,,1480697139,t5_2qhad,t3_5g0cvk,t1_dap9b6w,10,1483420025,0,0,dapbai1,Seattle,,,
Poorly. Extremely poorly.,,,,NvgtrWiggles,,,1480721169,t5_2qhad,t3_5g437j,t1_dapu1ro,12,1483429965,0,0,dapuzyi,Seattle,,,
"We should collectively buy Starbucks out and move it to Oklahoma. Who's in? ",,,,SkinnyNormalDude,,,1480639345,t5_2qhad,t3_5g029p,t3_5g029p,70,1483403451,0,0,daoeazg,Seattle,,,
"these should be illegal. the people building these know they are going to make money of our people living in squalor. ",,,,8daysaweek,,,1480999757,t5_2qhad,t3_5gq18l,t3_5gq18l,33,1483510935,0,0,dauerlh,Seattle,,,
"Capitol Hill to Everett?  Say goodbye to your loved ones, free time, any hope of a life after you get off of work.......",,,,kronnyj,,,1481821223,t5_2qhad,t3_5ihxtg,t3_5ihxtg,20,1483788154,0,0,db8eeq2,Seattle,,,
"I used to consider myself very liberal before moving here but listening to Seattle's incessant bullshit echo chamber of extreme liberal beliefs has made me more conservative than I ever was before. This city loves to make excuses for people rather than fix the actual problems. ",,,,olekzap,,,1482902601,t5_2qhad,t3_5kmzbs,t1_dbpfuxy,18,1484094061,0,0,dbpgc2a,Seattle,,,
"How is this even a question? If someone looks like they're in serious danger, you call 911.",,,,fatmoonkins,Bothell,,1481839535,t5_2qhad,t3_5ijtio,t3_5ijtio,30,1483795972,0,0,db8u09n,Seattle,,,flair
Sounds like your fault to me. Stop and buy a souvenir shirt or something and move on with your lesson learned. Thanks.,,,,karlkarlkarl21,,,1482340658,t5_2qhad,t3_5jimfn,t3_5jimfn,43,1483941530,0,0,dbgy1g9,Seattle,,,
"You're right, no one else ever hogs sidewalks ��",,,,themandotcom,First Hill,,1480735114,t5_2qhad,t3_5g5w91,t1_daq173u,32,1483434383,0,0,daq3omh,Seattle,,,flair
Need more housing. Need more mental health resources and job training. Camps are like 0.001% of the solution.,,,,teodeleo,,,1480654588,t5_2qhad,t3_5g0cvk,t3_5g0cvk,33,1483409152,0,0,daoprnd,Seattle,,,
"Because elevators that are broken that often are essentially no better than not having accommodations for the disabled.  

In fact I'd argue that the random nature makes it worse, every day you don't know if the elevator you depend on to get to your transportation is going to be there or not.",,,,seattlethrowawayy22,,,1482213719,t5_2qhad,t3_5ja3o6,t1_dbeqwme,15,1483905195,0,0,dbewh6s,Seattle,,,
Free if you commit a felony.,,,,dHUMANb,Mountlake Terrace,,1481004703,t5_2qhad,t3_5gq18l,t1_daugyeg,36,1483512326,0,0,dauhlgl,Seattle,,,flair
"Spoiler alert: your electrons don't know where they came from.   You're really just paying into a fund to develop and support generally more expensive green generation.  Further, the laws are pretty lax in regards to what those funds actually have to be spent on. ",,,,imsoupercereal,,,1483113189,t5_2qhad,t3_5l3iwk,t3_5l3iwk,18,1484152277,0,0,dbsq77h,Seattle,,,
If you can only afford $500 I'd suggest exploring work before this city.,,,,Coopak,,,1481497307,t5_2qhad,t3_5hsdut,t3_5hsdut,18,1483656337,0,0,db2q0xa,Seattle,,,
"Can confirm
Source: I work for tmobile",,,,classicmike063,,,1483162139,t5_2qhad,t3_5l7c4x,t1_dbtl4kg,27,1484169363,0,0,dbtorne,Seattle,,,
"Clicks share to Facebook. ",,,,spottydodgy,Ballard,,1482852003,t5_2qhad,t3_5kiw3x,t3_5kiw3x,55,1484075484,0,0,dboh3k9,Seattle,,,flair
"Article Text:

The next few days in the Puget Sound region will be cold and dry, according to the National Weather Service.
The temperature in Seattle won’t rise above the mid-30s, meteorologist Dustin Guy said. And the cold snap is expected to last through the weekend.

Temperatures across the region are expected to drop into the lower 30s on Friday and into subfreezing territory on Saturday, Guy said.

“We’ve some very cold days ahead,” Guy said. “But by next week we expect temperatures will return to normal for this time of year.”
On Wednesday, a snowstorm pounded the Portland area, snarling traffic and leaving thousands of commuters stranded.

Meanwhile, dangerously cold temps grip the Upper Midwest in advance of a storm that’s expected to bring several inches of snow in coming days.

Another arctic air mass on the heels of this cold front is expected to bring temperatures to the northern Plains over the weekend and into early next week that will be as much as 24 degrees below normal, according to Stephen Baxter, a climate prediction center forecaster.",,,,WickedGingerMan,,,1481826823,t5_2qhad,t3_5ii58r,t3_5ii58r,15,1483790543,0,0,db8j7a9,Seattle,,,
"Bellingham is a personal favorite of mine, much of the positive qualities of Seattle without the terrible traffic and skyrocketing rent. Someone else mentioned Eugene, that would be good as well though I'm not as familiar with it.

Outside of PNW, if you're in it more for nature than nightlife, Santa Fe or Albuquerque in New Mexico could also be good: it doesn't get too terribly hot in the summer and not bone-chilling cold in winter either. Nightlife is a bit lacking compared to most big cities (especially Seattle), but Nob Hill and UNM in ABQ holds its own.",,,,brakos,Bremerton,,1482223642,t5_2qhad,t3_5jbzkw,t3_5jbzkw,18,1483907270,0,0,dbf0n25,Seattle,,,flair
You mean [Home](http://www.homedepot.com/b/Doors-Windows-Doors-Interior-Closet-Doors-Prehung-Doors/N-5yc1vZc5ij) [Depot](http://www.homedepot.com/b/Lumber-Composites-Paneling/N-5yc1vZbqp3)?,,,,iwannabetheguytoo,,,1481012365,t5_2qhad,t3_5gq18l,t1_daudyuw,20,1483513899,0,0,dauku3t,Seattle,,,
[removed],,,,[deleted],,,1482863599,t5_2qhad,t3_5kiw3x,t3_5kiw3x,-28,1484079580,0,0,dbopada,Seattle,,,
"not only is this worldview brutally inhumane (""human beings are to be exploited for profit, or they're worthless""), it's got a snowball's chance in hell at effectively addressing the increasing automation of the workforce.",,,,clintmccool,,,1483061493,t5_2qhad,t3_5ky66h,t1_dbrrzmw,10,1484140050,0,0,dbs1flq,Seattle,,,
[deleted],,,,[deleted],,,1483145713,t5_2qhad,t3_5l4hrx,t1_dbszgbo,-11,1484164157,0,0,dbte4js,Seattle,,,
To be fair Trump is going to make us so rich we won't have to worry about little things like health care. /s,,,,Spam-Monkey,Mountlake Terrace,,1480978231,t5_2qhad,t3_5go5mr,t3_5go5mr,18,1483503117,0,0,datysgl,Seattle,,,flair
"That save tho.... ",,,,scroft13,,,1481429478,t5_2qhad,t3_5hoadz,t1_db1oa8e,50,1483637946,0,0,db1oc3r,Seattle,,,
The city should bank with BECU. It's a no brainer.,,,,SEAtownOsprey,The CD,,1481923333,t5_2qhad,t3_5iqezy,t3_5iqezy,62,1483822123,0,0,dba9bbp,Seattle,,,flair
"You're right, however there really isn't much more we can do as a city. 

One positive thing is that the additional Rapid Transit routes (In 3 years) will help a lot since they will decrease the wait time for each bus to around 10 minutes. This might also convince some people who would not use the buses before (because of long intervals) to finally start taking the bus.",,,,ParsonsProject93,,,1483139681,t5_2qhad,t3_5l4hrx,t1_dbt8yl0,22,1484162134,0,0,dbta3x8,Seattle,,,
"We use aquaphor instead. Works better anyways. Not sure if it would test positive also, it's less than 50% petroleum jelly.",,,,CNetwork,,,1482336309,t5_2qhad,t3_5jimfn,t1_dbgjggv,24,1483939755,0,0,dbguggr,Seattle,,,
"It's cold outside. ",,,,harvey_balls,,,1482077214,t5_2qhad,t3_5iztog,t3_5iztog,90,1483860695,0,0,dbceoo3,Seattle,,,
"Oh dang, a military vet too? This post hits all the right buttons. 

I'm a dash of autism or cancer away from a Bingo.",,,,Tashre,,,1482351583,t5_2qhad,t3_5jimfn,t1_dbgg7u5,16,1483946040,0,0,dbh76ow,Seattle,,,
"More info would help. Neighborhood last seen in? Name?

Hope you get him back.",,,,Stretchstrong,,,1482643274,t5_2qhad,t3_5k70bl,t3_5k70bl,31,1484027896,0,0,dblszeo,Seattle,,,
"Almost everyone is racist/xenophobic to some extent (myself included), a la implicit bias. The key is to have enough self-awareness to realize these instincts are senseless vestiges of a tribalist past, and should not be indulged. ",,,,Snickersthecat,,,1481832815,t5_2qhad,t3_5if7xd,t1_db8kubj,18,1483793107,0,0,db8oc4u,Seattle,,,
Hillary promised the staus quo offshoring of jobs and rising unemployment.  More unemployed means more welfare.,,,,Lasterba,,,1480982665,t5_2qhad,t3_5go5mr,t1_dau1xb5,-11,1483504769,0,0,dau26tw,Seattle,,,
"This is across the street from my place. Apparently now instead of a view of the lake, I get an intimate view into my neighbors' lives!",,,,tweem,,,1481004942,t5_2qhad,t3_5gq18l,t3_5gq18l,16,1483512385,0,0,dauhpuu,Seattle,,,
"I think being ""consistent"" is less important than doing the right thing.",,,,Hammagua,,,1481923773,t5_2qhad,t3_5iqezy,t1_dba84ch,22,1483822287,0,0,dba9nn1,Seattle,,,
"Maybe my eyes are bad, but when I was looking at it last night I thought it was pink.",,,,MeatScript,,,1483151345,t5_2qhad,t3_5l7c4x,t3_5l7c4x,83,1484165972,0,0,dbthu8f,Seattle,,,
They are wrong. It doesn't matter that the lunch break splits it up. This isn't just Seattle law this is state law. This is the LNI phone number: 360-902-5316,,,,InsightfulPoster,,,1480656108,t5_2qhad,t3_5g1a53,t3_5g1a53,18,1483409626,0,0,daoqpz8,Seattle,,,
[deleted],,,,[deleted],,,1482830877,t5_2qhad,t3_5kiw3x,t3_5kiw3x,-48,1484071715,0,0,dbo9icx,Seattle,,,
"Why did you think it was a good idea to yell at people who are shooting at each other? ",,,,88029eb7-2779-4194,,,1481523364,t5_2qhad,t3_5hust1,t1_db3775b,31,1483665313,0,0,db38dx1,Seattle,,,
Not to be a dick but how do you get an internship that good and not be able to do the research to figure out your living situation?,,,,barf_the_mog,Ballard,,1482196907,t5_2qhad,t3_5ja8wf,t3_5ja8wf,30,1483899588,0,0,dbel497,Seattle,,,flair
The sidebar,,,,JJGerms,Wallingford,,1482465326,t5_2qhad,t3_5jv1j1,t3_5jv1j1,24,1483981566,0,0,dbj781i,Seattle,,,flair
"[deleted]  
 ^^^^^^^^^^^^^^^^0.3127 
 &gt; [What is this?](https://pastebin.com/64GuVi2F/76334)",,,,mainfingertopwise,,,1481029176,t5_2qhad,t3_5gq18l,t1_dauf4f5,23,1483516685,0,0,dauqi4a,Seattle,,,
"John Stimberis, great guy, has international credentials. 
",,,,wsdot,WA State Dept of Transportation,,1482168523,t5_2qhad,t3_5j790z,t1_dbdxl56,46,1483887988,0,0,dbdxudc,Seattle,,,flair verified
"&gt;Don't ever try me with a sorry striker like Altidore! 

",,,,kyoutenshi,,,1481436831,t5_2qhad,t3_5hoadz,t1_db1oteu,26,1483639979,0,0,db1si01,Seattle,,,
"Didn't some government agency test the tsa to see if prohibited items could get through checkpoints (guns knives etc) and like 97% of them got through. Definitely doesn't make me feel safer. Not to mention there's no security for bag handlers, terrorist could get a minimum wage job and throw remote detonation bombs on a plane. ",,,,AgileSnail,,,1482325830,t5_2qhad,t3_5jimfn,t1_dbgmowc,34,1483936349,0,0,dbgnl2r,Seattle,,,
Powells book store.,,,,digitaldavis,,,1482866446,t5_2qhad,t3_5kl7fr,t3_5kl7fr,44,1484080673,0,0,dborhhv,Seattle,,,
"Yes. There is a TON of infrastructure that needs to be built once it's out. Road surface, electrical, communications, structures around openings, realignment of lanes, testing, and so much.",,,,SalishSea,,,1482449822,t5_2qhad,t3_5jszvq,t1_dbit3ko,23,1483976365,0,0,dbiwnrl,Seattle,,,
"Best thing to do is to gain experience as a ski patrol. ",,,,wsdot,WA State Dept of Transportation,,1482185409,t5_2qhad,t3_5j790z,t1_dbe9rdh,23,1483895284,0,0,dbeccuj,Seattle,,,flair verified
"General aviation, or aviation in general,  is the same. Part of the training is to know that if you see an object and it doesn't appear to be moving, you are likely on a collision course. In aviation, you can easily have a close rate of a few hundred miles per hour, so being aware of the smallest dot in the sky is key.",,,,BugSTi,Bellevue,,1480981648,t5_2qhad,t3_5go4nt,t1_dau14h5,16,1483504401,0,0,dau1f8k,Seattle,,,flair
"I really enjoy the cheap hostiles, personally. Keeps me on my toes.",,,,huckfinnster,,,1481078523,t5_2qhad,t3_5gx79w,t1_davseoa,26,1483535069,0,0,davsjtm,Seattle,,,
"Don't move to the city if you want to have a car. ",,,,snowsharks,,,1483131860,t5_2qhad,t3_5l4hrx,t1_dbszxat,32,1484159401,0,0,dbt4hhe,Seattle,,,
"""oh no, that sucks"" --- not how i thought that article would have started... ",,,,slambie,Shoreline,,1482857608,t5_2qhad,t3_5kiw3x,t3_5kiw3x,83,1484077323,0,0,dbokqhf,Seattle,,,flair
I'm hoping that rhymes with priest.,,,,EdwardBil,Broadview,,1481430289,t5_2qhad,t3_5hoadz,t1_db1ojl0,26,1483638185,0,0,db1ou07,Seattle,,,flair broadview
But in this place you won't have to worry about them scratching on the door demanding attention when you poop!,,,,wingie,Redmond,,1481001735,t5_2qhad,t3_5gq18l,t1_daudw8w,17,1483511521,0,0,daufydf,Seattle,,,flair
"No license or permit necessary 
[https://buy.taser.com/taser-state-requirements/](https://buy.taser.com/taser-state-requirements/)

I like how they have a holiday gift guide. If you act fast you can probably get one in time for Christmas! lol

[https://buy.taser.com/gift-guides/](https://buy.taser.com/gift-guides/)",,,,azzkicker206,Northgate,,1480883963,t5_2qhad,t3_5ghcjj,t3_5ghcjj,43,1483473092,0,0,das9jnv,Seattle,,,flair
"Within the last year, the airport changed the location of the cell-phone lot. The old lot was pretty easy to get in and out. The new lot is easy to get into, but on the way out you need to take a left across a stream of traffic and there isn't a protected turn arrow so you get stuck in the lot a lot longer than you want to be. So people have started using the side of road as a waiting area. ",,,,ALandWarInAsia,,,1482418398,t5_2qhad,t3_5jpici,t3_5jpici,25,1483964315,0,0,dbi87y6,Seattle,,,
"Person in trouble especially in public = 911. Immediately. Police aren't going to fucking scream at you for being concerned about someone especially if the person is covered in vomit and blood. ",,,,fatmoonkins,Bothell,,1481840922,t5_2qhad,t3_5ijtio,t1_db8uoap,20,1483796510,0,0,db8v320,Seattle,,,flair
"I'll allow it. If a minor is old enough to be charged as an adult if they were to commit murder, they're also old enough to decide to have sex with another person who is older than they are. ",,,,hellslave,,,1482861135,t5_2qhad,t3_5kiw3x,t3_5kiw3x,-27,1484078621,0,0,dbonbru,Seattle,,,
[deleted],,,,[deleted],,,1480656045,t5_2qhad,t3_5g0cvk,t1_daols5p,22,1483409607,0,0,daoqols,Seattle,,,
"Saw this in the Northgate Mall parking lot outside of Barnes and Noble. has floodlights, speakers, antennas, Seattle Police logo, anyone have any idea why this is there?  Is this part of the Trumpocalypse?",,,,kurtru,,,1480571395,t5_2qhad,t3_5fuxfm,t3_5fuxfm,-17,1483383378,0,0,dan9879,Seattle,,,
"A tunnel, tolled, with a general lane and a car pool lane going each way, replacing three tollfree general lanes each way.

So the land owners adjacent to the tunnel can make more money.",,,,SimpleSimonPieMan,,,1481704457,t5_2qhad,t3_5i8s8s,t1_db6fdq2,-11,1483753480,0,0,db6ftsm,Seattle,,,
"Something I think a lot of people forget is that traffic is not just you. It's lots of other people with various degrees of skills and experiences and cars/tires in various degrees of repair. So while you, the lone genius in a sea of morons, may be able to drive in the snow or on ice you won't be dealing with completely empty roads. You'll have people out there that may be the most incompetent thing on four wheels. And it only takes a couple dozen of those people, in a region of 2 million, to make everything very dangerous.

Tl;dr: Even if the ice road truckers themselves bow before your prowess and might, you should still probably sit out if you can because your safety is dependent on people who are worse than you. That's your chipper safety tip of the day!",,,,HypodermicWheedle,,,1481213000,t5_2qhad,t3_5h6hl3,t3_5h6hl3,40,1483573597,0,0,day002c,Seattle,,,
"There's a town past startup, WA down hwy 2 that might have what you're looking for. ",,,,wichschralpski,,,1482894899,t5_2qhad,t3_5kn6q8,t3_5kn6q8,19,1484091652,0,0,dbpbmet,Seattle,,,
It's a neighborhood thing every Christmas.  It represents monkeys that have escaped from the Christmas lights at the zoo. Zoolights?,,,,calamitouscat,,,1480834609,t5_2qhad,t3_5ge81j,t3_5ge81j,29,1483460730,0,0,darkk82,Seattle,,,
"You do realize thousands of people were breathing the same air as your baby in the airport? Some of those people were sure to have (brace yourself) a cold. It's a good thing you brought along Baby's First Gas Mask™ to make the flight safe as you'll be breathing that same air over and over again for a couple of hours. ",,,,Mugilicious,,,1482344813,t5_2qhad,t3_5jimfn,t1_dbh0y2o,15,1483943240,0,0,dbh1hx6,Seattle,,,
"When are you going to investigate the obvious bicycle chop squats alongside the Burke-Gilman Trail just NE of Gasworks Park?

And the obvious chop squat in the upper reaches of the pavilion at Gas Works Park?",,,,pipedreamSEA,Fremont,,1481657512,t5_2qhad,t3_5i5jry,t3_5i5jry,39,1483737671,0,0,db5j6pk,Seattle,,,flair
"The first sentence in the article literally says it won't be a ""snowmaggedon""",,,,el_cazador,,,1480852126,t5_2qhad,t3_5gduzr,t1_darn4al,16,1483463545,0,0,darq7e9,Seattle,,,
"That's a container hauling trailer with an adjustable axle set. Someone forgot to lock it up after adjusting it. ",,,,p4ts0,,,1482257695,t5_2qhad,t3_5jef1p,t3_5jef1p,42,1483916661,0,0,dbfjofp,Seattle,,,
"Then you're an asshole.  Yes, how homeless people are treated is horrible, but no, assault is not justified.  Besides, where were you raised that you should break someone's shit because they were rude? ",,,,Reus958,,,1482520720,t5_2qhad,t3_5jyjcs,t1_dbjz1lx,23,1483995662,0,0,dbjzw59,Seattle,,,
"I saved this great shot of [WSDOT's howitzer](http://imgur.com/2ZZvhX9).  I couldn't find it in their flickr feed, unfortunately.",,,,drbrain,,,1482218092,t5_2qhad,t3_5j790z,t1_dbeode2,15,1483906229,0,0,dbeyial,Seattle,,,
"It's literally right off of I-5, on 7th and 43rd I think.
",,,,FloppyWaffle,,,1481011836,t5_2qhad,t3_5gq18l,t1_dauj6sm,30,1483513806,0,0,daukn3j,Seattle,,,
You can make sangria in the terlet. 'Course it's shank or be shanked.,,,,Jah_Ith_Ber,,,1481021984,t5_2qhad,t3_5gq18l,t1_dauisac,19,1483515390,0,0,daunvmc,Seattle,,,
"Why, almost the entire world uses it! It's enormous. that's like  $200/ personal user. Not to mention the advertising going on on it and all that... ",,,,alexfrancisburchard,Kent,,1480760451,t5_2qhad,t3_5g5w91,t1_daqe1wq,10,1483439656,0,0,daqe4is,Seattle,,,flair
"Yeah I've heard plenty of people following FedEx and UPS trucks with deliveries. Fortunately, we have a secure package room with an automated locker where you enter a code to open it up. Probably similar to the Amazon boxes I see around town. 

I don't even think I care enough to file a police report, it was probably a homeless person who got into the building. I'm sure we would've loved to have whatever money was in those cards, but clearly someone needed it more than my neighbors and I.",,,,MrWittyFinger,,,1482891560,t5_2qhad,t3_5kmzbs,t1_dbp651f,-19,1484090568,0,0,dbp9dci,Seattle,,,
"Kitchen with shower door and a shower head.

Very interesting. ",,,,Keepit_100_,,,1480992701,t5_2qhad,t3_5gq18l,t1_dau8q3w,17,1483508458,0,0,dau9qrd,Seattle,,,
"ada's technical books is great. they've got a coffee shop inside, and a ton of interesting books and comfy seating. liberty close by for when you get thirsty. 

the library mentioned above is also amazing. 

there are victrola's across the city that are all fantastic. I like the one in beacon hill , specifically. get a free cup of drip with a shot of espresso (for like $2.40). 

",,,,hjhart,,,1482907164,t5_2qhad,t3_5koixn,t3_5koixn,22,1484095154,0,0,dbpilsp,Seattle,,,
"Bro...people aren't stupid. Don't be rude ",,,,olek2012,,,1480986571,t5_2qhad,t3_5go5mr,t1_datyf18,-17,1483506194,0,0,dau52c4,Seattle,,,
For those opposed to a registry what would be your proposed alternative to preventing and mitigating potential extremist actions rooted in Muslim?,,,,TrafficThrowaway9,,,1481794628,t5_2qhad,t3_5if7xd,t3_5if7xd,-39,1483781197,0,0,db80gl9,Seattle,,,
make people feel safer? i don't buy it at all. this was purely a bureaucratic power grab. govt leeches saw a chance to suck funds and jumped on it. the theater is to justify their own budget,,,,TheRealJeffreyLin,,,1482323801,t5_2qhad,t3_5jimfn,t1_dbghz6i,46,1483935920,0,0,dbgmowc,Seattle,,,
"Horrible case and treatment for Jarred Ha. 

People these days are accepted to take the blow and be a victim instead of standing up for yourself and defend. 

Pathetic. ",,,,Monkeyfeng,U District,,1482378871,t5_2qhad,t3_5jndk2,t3_5jndk2,18,1483955761,0,0,dbhqu2j,Seattle,,,flair
"It is all security theater to make everyone feel safer. They know this whole show is not effective for finding actual terrorists.

Did it work? No. Pretty sure everyone in line behind you was pissed off as this is complete bullshit.",,,,knittedsock,,,1482309683,t5_2qhad,t3_5jimfn,t3_5jimfn,163,1483933620,0,0,dbghz6i,Seattle,,,
This entire scenario sounds like an overreaction on your part.,,,,giftedyoungster37,,,1482343052,t5_2qhad,t3_5jimfn,t3_5jimfn,33,1483942515,0,0,dbh00mh,Seattle,,,
"Back in the 1980s, my parents used to blame the Californians for everything. Apparently we have a permanent scapegoat in the PNW. ",,,,whiskeyinthebutt,,,1483043169,t5_2qhad,t3_5kxxwp,t1_dbrkewf,40,1484133331,0,0,dbrnwd3,Seattle,,,
"Oh man, if you made this same comment about Latino immigrants in the Southwest/California your karma would be decimated.

I wonder why these comments are ok for some immigrants and not others?",,,,careless_sux,,,1480984703,t5_2qhad,t3_5gjfm5,t1_dat285n,21,1483505515,0,0,dau3pbv,Seattle,,,
"As someone currently living in BFE Tennessee I truly see little difference between Islamic Fundamentalist and fundamentalist Christians. Between women's health provides being killed or truck bombs killing innocent people Atlanta or OKC. The only real difference is the Christians here are complacent for the most part. ",,,,2ndtryagain,,,1481783592,t5_2qhad,t3_5if7xd,t1_db7rsa0,56,1483779139,0,0,db7wblc,Seattle,,,
"Hahaha, ""sketchy"", used to catch my bus to and from school there every day. 

We used to mess with the druggies trying to get money from us. Also met a really cool vet who'd get off that one bus from the VA or wherever. Couple guys I knew got in a fight over a french fry once, bunch of weirdos started cheering. Can't forget the guy with the Ferrari Segway, he was a chiller. Every shakeup we'd have fun teaching the new bus driver where the sensor was for the light (its waaay back from the exit so they'd always miss it at first). Good memories from the BTC :) 

Definitely wouldn't call it super sketchy though. Besides if you're really that worried the cop shop is like three blocks away.",,,,werkwerk16,,,1480965895,t5_2qhad,t3_5gmr4r,t3_5gmr4r,15,1483497912,0,0,dato3j6,Seattle,,,
That isn't how the economy works. Rents would go up if demand for real estate increased not if the community makes more money.,,,,Jugaarhound,,,1483043277,t5_2qhad,t3_5ky66h,t1_dbrm01p,15,1484133372,0,0,dbrnzgc,Seattle,,,
"That's because the authorized encampments pick and choose who they let in. Those people they deem undesirable just set up camp down the street. Thus, the changes ballard has seen in the last couple years.",,,,seepy_on_the_tea_sea,,,1480648774,t5_2qhad,t3_5g0cvk,t1_daoh2ya,25,1483407002,0,0,daolenf,Seattle,,,
This redditor is a shill that works for the lanolin industry!  Don't believe the lies!   I raised 7 children solely on Vaseline brand petroleum jelly and they are all Doctor's and leaders of industry.,,,,noptamoius,,,1482350280,t5_2qhad,t3_5jimfn,t1_dbgz7r2,23,1483945514,0,0,dbh6379,Seattle,,,
"Aww, wittle socialists getting mad that the government isn't providing all of the jobs in the city?",,,,ycgfyn,,,1481477759,t5_2qhad,t3_5hr3wz,t3_5hr3wz,-25,1483648326,0,0,db29k6e,Seattle,,,
Soccer is such a dumb sport. They played for two hours and nobody scored so they had to play an entirely different game to decide the winner,,,,Quaglek,,,1481432289,t5_2qhad,t3_5hoadz,t3_5hoadz,-55,1483638772,0,0,db1q1b1,Seattle,,,
"His things were all tossed on the conveyor Belt as well, my wife was visibly upset and they decided to do a random pat down. She was humiliated. She's a navy veteran, she served this country with honor and respect, and they showed none of that to her or our child. It's disgusting how they operate and treat us. The terrorists won. Now we're terrorized by our own government. ",,,,Citrous_Oyster,,,1482304933,t5_2qhad,t3_5jimfn,t3_5jimfn,157,1483932726,0,0,dbgg7u5,Seattle,,,
I think I took an avi course from that guy at Alpental.  Alpy Pro Patroller and Avi supervisor for WSDOT.,,,,alpenbum,Northgate,,1482168212,t5_2qhad,t3_5j790z,t3_5j790z,30,1483887866,0,0,dbdxl56,Seattle,,,flair
